start	end	text
1382340	1389060	But you know definitely a romantic and he had a lot of love letters many of them unsent to this one guy
1389380	1392140	Who never ended up returning his affections?
1392460	1398900	so you can tell this is a story about a longing for a person you can't be with and how that person doesn't really want
1398900	1404260	You and how that causes you pain every time you were near them. So you want this dude you can't have
1404780	1406940	But at least there's God
1407580	1413500	Another thing about the queer theory reading of the Little Mermaid is any version of the Little Mermaid is about passing
1413900	1419420	Andersen's version can be read a few ways the most obvious being the crush he had on this dude that he could never express because
1419420	1421420	You know, it was a different time
1421580	1426140	Two bros chillin in the hot tub five feet apart cuz they're not gay
1426140	1429900	But it also expresses his discomfort for passing in high society
1429980	1435700	Which he was not born into and this high society was not kind to the nouveau riche like Hans Christian Andersen
1435700	1439220	This is another reason why the lazy feminist hyper literal
1439620	1441620	mutilates her body for a man
1441740	1446580	Criticism bugs me because it totally dismisses any reading of the text that is anything but strictly
1446980	1451140	Heteronormative and the current discourse the most obvious metaphor is the transgender one
1451140	1455260	Hell one of the highest profile trans nonprofits in the UK is called mermaids
1455260	1460900	But there are lots of ways one can change oneself in order to pass in mainstream society
1461100	1465620	Ariel knows from basically when she's old enough to know stuff that she doesn't really feel at home in the body
1465620	1468500	She's in both in the Disney movie and in the original story
1468500	1471660	And so she goes to incredible lengths to change it
1471660	1476460	So these cheap like Jezebel feminists of 2009 who are like me me me
1476460	1481900	She gave up her voice and mutilated her body for a man like no like I mean, that's not what happens
1481900	1487300	But she's got legs you idiot. She traded her vice to the sea witch and got legs
1488300	1493060	Ariel's whole thing is breaking away from exactly what her society is asking her to do
1493180	1496740	So I'm not saying that the heteronormative read is completely illegitimate
1496940	1502220	But for people to treat it like that's the only read is lazy and basic and I'm just kind of tired of it
1502340	1506580	So anyway, so the OG short story is gay AF moving on part something
1506580	1509460	The Disney version is gay if to just you know, not in the same way
1509620	1515660	They weren't kidding when they called me. Well a witch in the early days of queer theory. This was like, hmm
1515820	1520340	Why are all the villains queer coded? Oh, I shall practice my curtsy
1529940	1533620	But now we've more or less come around to the correct opinion which is yes, yes they are
1533620	1537460	They are extremely queer coded and also they are awesome and we stan
1537460	1542020	You know, my last captain of the guard was a bit of a disappointment to me
1542700	1545540	Ursula is more than queer coded
1545540	1551940	It is well known that her design was heavily inspired by the drag queen divine who was most famous for starring in John Waters films
1551940	1553940	like hairspray I
1554060	1559660	Watch that tramp and I'm embarrassed to be white and pink fling goes this blood turn you on
1559660	1564840	It doesn't more than turn me on. Mr. Vader. It makes me come and female troubles
1564840	1566840	I hate you
1569920	1578040	Voice actress Pat Carroll conceived Ursula as like an aging Shakespearean actress which explains so much of the performance
1578400	1580360	Look at me
1580360	1582360	Wasted away to practically nothing
1583800	1592040	My poor little poopsies and don't underestimate the importance of a body language
1594840	1596840	Thirsty bitch
1598240	1600400	I'm taking this one. Give me the shoe bitch
1601240	1606360	And she ends up as sort of a composite of drag and camp icons Joan Collins
1606520	1609520	No, you know where to find the boys and the booze
1610040	1618120	Tallulah Bankhead my good woman. Would you kindly leave the premises before I grab your pink hair and put it out by black roots
1618560	1624680	Three days Norman Desmond. All right, mr. DeMille. I'm ready for my close-up and of course divine
1624840	1626840	You're a pain too
1629800	1634360	Like in a lot of ways this goes beyond coding this is clearly deliberate
1634680	1640200	Especially considering how much poor unfortunate souls resembles a traditional drag show
1640680	1643960	But you'll find that nowadays I've mended all my ways
1644640	1646640	She uses her eels as a boa
1646760	1650120	This is also the first Disney movie to use Alan Menken and Howard Ashman
1650440	1655960	Who were at the time best known for the Broadway camp hit Little Shop of Horrors quick note on Howard Ashman
1655960	1660760	It's not a coincidence that the most iconic songs of the Disney Renaissance came out of those first three movies
1660760	1661960	but then kind of
1661960	1663960	out after that
1666200	1673720	And that's not nostalgia that's Howard Ashman who died from complications from AIDS in 1991 and while it's not like making never wrote any
1673720	1678280	Good music again. I feel like he was at his strongest writing with Ashman
1678520	1683400	Ashman was deathly ill during the production of Beauty and the Beast and if you really want some heartstrings tug
1683560	1687720	Listen to the people who worked with him described the way he kept on trucking until the very end
1688040	1694200	Howard was physically there. He had lost a lot of weight. He was, you know, he was wearing his shirt with suspenders, you know
1694280	1700200	And trying to be as casual as possible and certainly didn't want to project any sense of of illness
1700920	1702920	um at that point
1702920	1706280	Nobody else professionally knew that he was he was sick
1706680	1712360	Another thing that tends to get lost in analysis of this movie Menken and Ashman had a huge influence not just on the music
1712440	1715560	But also the story itself. Not only did they help shape the story
1715640	1718520	They had the songs and score written before animation even began
1719160	1725960	And in that way also helped shape the characters particularly Ursula who is defined by her big musical number
1726360	1728360	The boss is on a roll
1728360	1730200	Oh
1730200	1737080	That's Menken and Ashman Ursula's drag show basically explaining gender performativity theory by way of Judith Butler
1737400	1739960	But far more entertaining you'll have your looks
1740600	1742600	your pretty face
1742680	1744680	body language
1745800	1751480	Menken and Ashman so the read of poor unfortunate souls his drag performance was deliberate Menken and Ashman
1751560	1756360	Especially would have been steeped in New York drag culture. So I don't read this as Disney being appropriative to me
1756360	1758680	This is Ashman writing what he knows
1759160	1762360	So in my old age Ursula is far and away my favorite thing in this movie
1762440	1765880	Possibly because i'm only about three years away from morphing into her completely
1765960	1770520	But I love Ursula the older I get as a brand Disney villains have always been my favorite
1770680	1774440	And of course most recent Disney movies don't do villains in the traditional sense anymore
1774680	1779560	Like they'll do the bait and switch or the misunderstood or sympathetic motivations or whatever this is
1780040	1785880	But after Shadow Man and Mother Gothel, they kind of petered off on pure fun evil. Come on boys
1786360	1789880	Won't you shake a poor sinner's hand?
1791080	1795880	And I don't know what it is about evil without nuance that I find so appealing in the case of Disney villains
1796040	1798540	But I think it's really just the fact that they're having fun
1807400	1812680	That everyone in a Disney movie is having fun including the bad guy this is why of classic Disney
1812680	1817480	I think Maleficent is the most beloved she out of all of them is having a high old time
1817880	1822440	People don't remember the dalmatians. They remember Cruella. Look at how much fun she's having
1822760	1828140	This is part of why of the renaissance Disney movies the most beloved ones tend to have the most memorable villains
1832520	1834520	Why do we even have that level
1835720	1839800	And that's part of why the black cauldron is widely considered the worst one. I'm, sorry guys
1839800	1843740	I know you love John Hurt, but he sucks in this. Oh my soldiers
1845560	1850040	How long I have thirsted to be a god
1851320	1857560	In fact the black cauldron nearly ended the animation studio until the great mouse detective the best Sherlock Holmes movie of all time
1857560	1861240	Don't at me quite literally saved the studio. Smile everyone
1862360	1865900	Disney now owns the world. Thank you the great mouse detective
1866840	1868840	I have the power
1869160	1873960	Of course you do I feel like it's not one of those situations like the Hunchback of Notre Dame where
1874200	1878280	we all kind of reevaluate whether it got a fair shake upon its first release because
1878840	1884120	I'm losing to a bird. Everybody likes the little mermaid and you know, it's not bad. It's not the best one
1884280	1885080	It's fine
1885080	1891080	But you know there was that backlash that was kind of lazy and targeting the popular thing because that was what the click bait was
1891240	1892760	for a while
1892760	1896200	But thank god we've moved on and now our click bait is like
1896840	1898100	I don't know
1898100	1899940	UFOs
1899940	1901940	Wow, what a good segue
1902740	1910500	Hi, i'm alan smithy the director of this film. Are you tired of science fiction books with lyrical poetic prose?
1910980	1917780	Do you like weird space aliens? Are you a fan of the comical misuse of everyday household?
1917860	1923780	I I guess I didn't really do that today. That was a missed opportunity. I should have done that but you didn't
1924180	1929140	Well, you should pre-order my book truth of the divine it is the second book meaning it's the
1929620	1931940	sequel to the first book which is
1932480	1939860	Axioms end. Oh boy. See this is what y'all tuned in for. This is um, the requisite self promo portion
1940180	1942180	I'm gonna do better this time
1942260	1946500	Because it is a better book. It's got everything the cheesecake factory
1947200	1949200	president dick cheney
1949440	1951440	congressional hearings
1951520	1953520	persians
1953580	1959200	Sadness and the reason I promote these now is that pre-orders are extremely helpful not just for me
1959200	1964800	But for any author you want to uh help so if you have a favorite author you want to support and they have a book
1964880	1968080	That's coming out pre-order their book and then like six months from now
1968080	1971280	You'll get like a magic package in the mail and then you'll be like, oh
1971840	1973040	Right
1973040	1978800	I guess I did order that and the best thing about pre-orders is you do not get charged until the book ships
1979280	1982720	So if I get canceled again, you can just cancel your order
1983440	1986240	So another question I get a lot will there be signed copies
1987040	1989920	Yes, do I know how that's gonna work? No
1990560	1995680	They haven't told me yet. I'll put that in the next video. But if it's anything like last time
1995760	2002400	It's uh putting your receipt for the thing you already bought into like a online portal. I don't know. I'll let you know later
2002480	2006820	It's it's gonna be great. So the pre-order link for truth of the divine is in the description
2007440	2009440	Unless you are in the uk
2009600	2010940	in which case
2010940	2017600	Pre-order the book through your favorite uk-based online retailer because the uk edition has a different publisher
2018300	2024380	And that has caused some confusion. This this also applies to australia new zealand, but not canada
2024700	2028960	And for those of you in the rest of the world, um, I don't know use a vpn
2029420	2034380	I have no control over how to ship to what country or foreign language rights so far
2034460	2037900	the only country that has bought foreign language rights is
2038440	2040140	turkey
2040140	2043500	No, i'm not kidding. I know brazilians. I know
2044780	2051100	Consider petitioning your publishers. Also, I will come to brazil. I promise we were gonna go in 2020
2051100	2052140	but there was
2052140	2054140	You know, there was a thing
2057020	2061260	Hand to your very very large christ we were gonna come in 2020. We'll come eventually
2061420	2066620	so anyway pre-order truth of the divine about which the new york times has said nothing because
2067020	2072860	Uh, they haven't gotten a review copy yet, but in the meantime, thank you for watching and I hope you spend the rest of your
2072940	2074940	pride month stanning
2075560	2077560	ursula
2080780	2082780	Don't be scared. It's only me
2086300	2091180	And you can all come everyone can come every creature in the sea can come
2097580	2100080	Hi father, sorry i'm late
2102940	2106940	Well, i'm not leaving you up there alone this time you mean you'll go with me
2107500	2109500	It doesn't look like I have a choice
2109660	2112780	Oh, it'll be so much fun. You'll see come on. Let's go
2113500	2119420	Hardly, wait. I'm not a fish. I'm a dolphin. That's not very nice to say
2119660	2125900	I'm your official royal pet. Don't you like me? Did you hear that? Cecil the prince is gonna marry her
2126620	2128620	Well, I hope so claudia
2128620	2130620	I hope so
2130700	2136080	Stop the storm stop the storm away sky creatures
2139580	2142880	Oh, you mean they're getting married
