start	end	text
1350160	1356800	since its inception become wildly obvious to me. Why is it so expository in the first five chapters?
1356800	1362160	Why is the entire third act like that? Why did I not do a motivation better? And so trunk novel is
1362160	1367360	where my inspiration goes, not commercial as fuck, so I start working on that instead. And what was
1367360	1372080	supposed to be a fairly modest rewrite, with the intention of I guess, you know, getting the
1372080	1377520	creative juices flowing for the other one, ends up being like a complete overhaul. And by the end of
1377520	1382640	this rewrite, I have deleted about 60,000 words and written another 70,000. And so by the time
1382640	1386640	I'm done with this, and this would have been about a month after the Hobbit videos came out,
1386640	1392880	I was like, hey look, a thing. I guess I have two projects again, sort of. And as far as I can see,
1392880	1398800	trunk novel is the more polished of the two, so why don't we just tepidly see if there's any
1398800	1405280	interest there? So once again, I very tepidly send out like, I don't know, maybe 10 query letters and
1406800	1407840	noes across the board.
1407840	1416800	Okay, fine, this is clearly not meant to be. Fine. And the flavors of the no are pretty much
1416800	1422000	all variations on, I don't think I can sell that. But here's the thing, that revision actually
1422000	1427040	did do the thing it was intended to do, and it helped me figure out how I wanted to fix the bleak
1427040	1431680	ending of commercial as fuck. So you know what, working on trunk novel wasn't a total wash,
1431680	1436160	so I'm working on that, and then I get an email from this agent telling me that she is leaving
1436160	1447600	the agenting industry. Jesus Christ. All right, fine. Fine. I give up. I give up. The end. Oh,
1447600	1454000	wait, no, this is about like triumph or something. Never give up, except for I totally gave up.
1454000	1459760	And this is where my hashtag privilege comes in. So it was almost around this exact time that this
1459760	1466640	rando in Brooklyn emails me like, hey, I'm a literary agent. Do you have one? And this was
1466640	1472080	not the only thing that was going on in my life. Like, if you watch the talk I did for XOXO 2019,
1472080	1477760	which is on their YouTube channel, this was around that time. So, you know, my heroes are dead, my
1477760	1482400	enemies are in power. Not a great time. So he asked me if I have anything that I'd be willing
1482400	1486400	to share, and I'm like, okay, which one do you want? Do you want commercial as fuck or do you
1486400	1492640	want trunk novel? And he says whichever one is more done. So trunk novel it is. So basically,
1492640	1498080	in very short order, he does pinpoint the issue with why agents thought that they could not sell
1498080	1503840	this. And one of these days I might talk about the issue. And no, it wasn't about like problematic
1503840	1509360	content or gender or anything, but it was very small and ultimately very fixable. It was kind
1509360	1516800	of on the level of like, hey, this takes place in Santa Monica. What if it took place in San Diego
1516800	1521680	instead? We'll talk about it one day. So this dude, his name is Christopher Hermelin, and he
1521680	1526640	is part of a boutique agency in Brooklyn. He signs me up, we do a round or two of revisions,
1526640	1532320	and then we go on submission the first week of January. That was on a Monday. I get my first
1532320	1537360	phone call from an editor on a Friday, and then after talking to a few more, ultimately it's sold
1537360	1546480	in less than two weeks. Yep. Okay, so ultimately we come again full circle with that question of
1546480	1551040	why is my thing not selling? What is wrong with my manuscript? Is it my manuscript that's the
1551040	1555280	problem or the market? And in my case, it's a little difficult to answer since I ultimately did
1555840	1560400	sell to a commercial imprint, and the book itself doesn't really fall in line with any publishing
1560400	1565520	trends right now. So it does kind of remain to be seen just how much, if at all, Saint Martin's
1565520	1570560	gamble will pay off. Because that is kind of the reason that agents are so bearish, and they want
1570560	1574960	things that are comparable to things that have already sold well. This, for the record, was mine.
1575520	1582880	Thank you. Thanks for debuting at number one. Readers are creatures of habit. They want things
1582880	1588000	that are like the thing that they've already read. So if I'm to come to a publisher with this book
1588000	1594480	and they're like, okay, what is it about? And I'm like, I don't know, it's Independence Day meets
1594480	1600560	the big short. Mary Doria Russell's Invader Zim. I guess it's kind of fair for them to be like,
1600560	1605200	I don't really care if it's any good or not, I don't know if I can sell that. The point here being
1605200	1611600	is that it is honestly really difficult to tell where the line in the sand is. Your work is not
1611600	1618960	good enough, and the publisher slash agent doesn't think there is a market for it. So in conclusion,
1618960	1623920	something, something, follow your dreams. I think it would have been just as easy for me to be like,
1623920	1629680	yeah, I wrote a thing and it's out now, and then not, you know, cop to the 10 years of,
1630400	1634640	I guess failure is a strong word, struggle. And then people will be like, wow, I guess you just
1634640	1641120	magically did it on the first try when in reality, no. Because it doesn't do anyone any favors to act
1641120	1647920	like, even in a position like mine where I have a relatively large online platform, I didn't have to
1647920	1652880	put in the work and go through a lot of rejection. But here is what I have learned from the thing.
1652880	1657120	Learning to write, learning to be a novelist, and the publishing industry in general is
1657120	1663520	incredibly, incredibly slow going. So you have to be incredibly patient. And looking back,
1663520	1668320	the best choice I made in the whole thing was choosing to trunk that novel in 2014.
1668320	1673440	So the fact that I was able to get in another five years of writing experience actually helped
1673440	1678960	the thing get to a level where it could sell to a major publisher and hopefully will be, you know,
1679520	1685840	not hated by a plurality of you. So in some ways, I think fiction is more difficult to publish than
1685840	1692080	nonfiction because it's harder to really gauge demand for. But that is not to say that nonfiction
1692080	1700240	is easier. It's just different. But a lot of people's success really is owed to luck and timing.
1700240	1705360	These people that you hear of that get these like debut novels with six-figure advances and, you
1705440	1711920	know, they tend to be YA, um, they hit at the right point in the right genre, but they also
1711920	1718640	tend to be outliers. For instance, if you were querying a YA dystopia in 2009, you're probably
1718640	1723440	going to get different results from querying the same book in 2019. A few years ago, author
1723440	1728480	Jim C. Heinz did a survey of traditionally published authors to see how long it actually
1728480	1735120	took them to get published, and the average length of time was, drumroll, 11 years. So what
1735120	1740480	does that mean for this channel? Is this going to turn into this shameless self-promotion channel?
1740480	1747440	Well, no, not yet. I mean, six months it will. But I do imagine that this has shed some light on
1748480	1753760	why this channel hasn't been as prolific as it has been in years past. And one more thing with
1753760	1758720	regard to pre-orders, and this applies to pretty much all traditionally published authors, is if
1758720	1763840	you want to support an author and you plan on buying the book anyway, pre-orders are a great way
1763840	1768000	to do that because it helps the publisher decide where they are going to end up, you know,
1768640	1772400	spending their resources. Who gets the marketing? Who gets to go on a book tour?
1772400	1777360	Pre-orders are basically their barometer to, you know, who gives a shit. So if you want to pre-order
1777360	1783120	American Three-Body Problem for Girls, the link is in the description. It is available in hardcover
1783120	1787280	and Kindle right now. I guess the paperback will be like, I don't know, six months or a year after that.
1787280	1792800	And yeah, this won't be the last video of this kind. I will probably be doing a lot more process
1792800	1797760	slash publishing industry type stuff in the months and years to come. Although yes, don't worry,
1797760	1804720	we will still be doing traditional video essay type stuff too. So yeah, so yeah, I know everybody
1804720	1809840	can't wait for this YouTuber book. This should be, this should be an interesting journey that we can
1809840	1815040	all go on together. Hope this was some help, and if it wasn't, well, hope at least it was
1815040	1822000	entertaining to watch. This is gonna be a long year. Happy end of the decade, everybody!
