start	end	text
1358320	1364080	body being found a few houses down the path makes no sense and let's watch Zimmerman realize in
1364080	1370240	real time that this aspect of his story is a load of old crap. He was about there but he was walking
1370240	1378480	towards me. Yes sir I believe like I said I was already past that so I didn't see exactly where
1378480	1384640	he came from but he was about where you were and I said I don't have a problem and I went to go grab
1384640	1390320	my cell phone but my I left it in a different pocket and I went I looked down in my hand pocket
1390320	1395760	and he said you got a problem now and then he was here and he punched me in the face right here
1396560	1404960	right around here okay to be honest I don't remember exactly that's why I think I stumbled
1406240	1411840	and I fell down he pushed me down somehow he got on top of me on the grass or on the snow
1412800	1419760	it was over more over towards here I think I was trying to push him away from me and then
1421120	1425600	he got on top of me somewhere around here and
1430560	1435840	Now all of this trying to push him away from me while moving down the path stuff is completely
1435840	1441280	absent from any of Zimmerman's earlier accounts of the incident and is also a bit suspect by
1441280	1447280	itself. If Zimmerman was trying to escape why didn't he go to the lit street where his truck
1447280	1453760	was? You know why instead move further down the dark path towards Trayvon Martin's house
1453760	1459840	incidentally? I don't know. It's a possibility obviously but the fact that Zimmerman neglected
1459840	1463680	to mention this in his written statement and police interviews and made it sound as though
1463680	1469520	he was knocked down immediately makes me doubt his story here. Zimmerman also undersells the
1469520	1475760	distance down the path that he fell to the ground. He moves to about the location of this tree but
1475760	1480320	we can see from the image that Martin's body was actually found about another house length past the
1480320	1485680	tree. Now okay it was dark and a traumatic experience so I can't expect Zimmerman to be
1485680	1490480	that accurate but it is still worth pointing out that Zimmerman's account in this recorded
1490480	1495520	walkthrough contradicts both his previous statements and the crime scene photographs.
1496080	1503440	So why would Zimmerman lie here? He asked with mock sincerity. Well obviously because he's trying
1503440	1508800	to give himself the best possible justification for his actions. Zimmerman's account includes
1508800	1514320	Martin being the first aggressor which is very important but also Martin explicitly telling
1514320	1520000	Zimmerman that he was going to kill him and then reaching for Zimmerman's gun and I mean why not
1520000	1524640	right? If you're the only witness to a shooting you committed you may as well make it airtight.
1524640	1530320	I'm surprised you didn't have Trayvon Martin say, I Trayvon Martin hereby pledge to kill you and
1530320	1535440	will do so shortly. This therefore gives you the full legal justification to respond with lethal
1535440	1540400	force and defense of your own life. I mean you know why not? Now the idea that Trayvon Martin
1540400	1546080	would at first run away from Zimmerman and then see red and decide to double back and actually
1546080	1551520	murder him strains belief somewhat. I mean I don't believe Zimmerman chased down Martin
1551520	1557440	intending to kill him in some racist rage but nor do I believe that Trayvon Martin while he was
1557440	1563120	still on the phone to a friend mind silently decided to double back and murder Zimmerman.
1563120	1569120	So what do we think actually happened? Well we're admittedly moving into the realm of speculation
1569120	1574320	here. I do have a theory of what was probably the most likely version of events and I'll give that
1574320	1579760	here for whatever good it's worth. So Zimmerman isn't looking for a street sign obviously and
1579760	1583600	nor is he intending to be where his truck currently is and we know that because of the
1583600	1588800	end of Zimmerman's police call. So he's still poking about looking for Martin, he doesn't want
1588800	1595120	this asshole to get away. Then him and Martin meet on the intersection behind the houses.
1595120	1599680	Zimmerman's friend who he was still on the phone with testified in court that at this point Martin
1599760	1606480	stated Zimmerman was still following him. So that backs up this theory of what Zimmerman was up to.
1606480	1612800	So let's get into Zimmerman's mindset here. He thinks Martin is a dangerous criminal suspect.
1612800	1617920	He's up to no good. He might be on drugs and Zimmerman states he's got his hand in his
1617920	1623840	waistband and later something's wrong with him. He's got something in his hands indicating he
1623840	1630480	thinks Martin might be armed. So then, you're in a dark alley and you're confronted by who you
1630480	1637200	suspect to be an armed and dangerous criminal who's on drugs. Now what would you do in that situation?
1637200	1644720	Well, Zimmerman claims he reached for his phone to dial 911. Now I don't buy this at all, you know,
1644720	1649200	excuse me Mr Dangerous Armed Criminal could you hold still for a few minutes while I call the
1649200	1655520	police on you right in front of you. No, that doesn't make any sense to me. What would make
1655520	1661040	sense to me in this situation is someone reaching for their gun. Now there's a few issues here.
1661040	1666800	Firstly, Florida is a concealed carry state and Zimmerman had a concealed carry permit.
1666800	1672720	Open carry is generally banned. Now if you're correct in your assessment of the person being
1672720	1677120	a dangerous armed criminal then of course you'd be in the right to reach for your gun to defend
1677120	1682640	yourself but if you later turned out to be wrong and your dangerous armed criminal turned out to
1682640	1689360	be an unarmed teenager walking home from the store then you're fucked because drawing, reaching for,
1689360	1694480	or flashing your gun would make you the aggressor and initiator of the physical confrontation and
1694480	1701040	then you're going to prison. So beyond my own estimation of what was the most likely series of
1701040	1707360	events, what evidence do I have that Zimmerman reached for his gun? Well, nothing that would
1707360	1713280	stand up in court admittedly but there is something else that leads me to believe that is what happened.
1713280	1718960	"...from but he was about where you were and I said I don't have a problem and I went to go grab
1718960	1724640	my cell phone but my I left it in a different pocket and I went I looked down in my hand pocket
1724640	1729360	and he said you got a problem now and then he was here and he punched me in the face."
1729360	1735840	So Zimmerman here indicates that he tried to find his phone to call 911 but he had moved his phone
1735840	1741040	to a different pocket and looks down to his right side to indicate that's where he reached for it
1741600	1746000	and this is significant because this is also the area of his body where his gun was.
1746560	1752720	"...but uh that's when my jacket moved up and I had my my firearm on my right side hit."
1753440	1758640	Now according to Zimmerman he had only just got off the phone with the non-emergency police line
1758640	1764160	so he had just put his phone away only a few moments ago according to his timeline
1764800	1770480	and now he suddenly can't remember where it is. So Zimmerman, when confronted by who he thinks
1770480	1776640	is a dangerous armed criminal in a dark alley, coincidentally reaches to check for his phone
1776640	1782800	in the right side pocket where his gun happens to be. I don't know, it is possible but it's
1782800	1788400	awfully convenient and now you might be thinking why would Zimmerman bother to lie about this?
1788400	1793920	He's the only living witness to the start of the fight so he can make up whatever story he likes
1793920	1799520	and the answer there is that Zimmerman at this point knew there was a witness to the incident
1799520	1804880	but didn't have any indication how much of the event they had actually been witnessed to.
1804880	1808880	From Zimmerman's interview with the police on the night of the shooting he says
1808880	1813760	Then somebody comes out and I couldn't see. There was a flashlight in my head so I asked if it was
1813760	1820160	a police officer and he said no it was a witness but he was calling the police and I said the
1820160	1826160	police are on their way. So present in Zimmerman's mind during the police walkthrough is the existence
1826160	1832640	of a witness who could have possibly seen any part of the event which means he needs to account for
1832640	1838640	his actions including that of reaching for his gun. So that's why his phone goes missing only
1838640	1844000	seconds after he put it away and why he not so coincidentally reaches to that area of his body
1844560	1849840	right before Martin hits him. So actually Zimmerman faced with what he incorrectly
1849840	1855040	thought was a dangerous criminal reached for his gun and Trayvon Martin chased down an alley by
1855040	1863360	a stranger who then reached for his gun defended himself. Is that what happened? Well probably we
1863360	1869840	can't know for sure. There was actually no witness to the start of the fight no CCTV footage and that
1869840	1877040	series of events while likely wouldn't stand up in court. I haven't proved anything there and that's
1877040	1881920	because it's impossible to prove. Zimmerman should never have been charged with something that it was
1881920	1886720	impossible to prove in court and I'd like to highlight something here in conclusion to this
1886720	1891920	section. I just talked about the Trayvon Martin case without once descending into the ridiculous
1891920	1897840	character assassinations that were rampant in the American media during the trial. Trayvon Martin
1897840	1903760	smoked weed you know the drug that notoriously makes people really angry and confrontational.
1903760	1909200	Trayvon Martin posted a photograph of a gun on social media that's apparently more of an
1909200	1914400	indication of violent tendencies than owning carrying and actually shooting someone with a gun.
1914960	1919920	Now this is the other tactic for justifying Zimmerman's actions saying Trayvon was obviously
1919920	1927360	a bad guy since he did x or y common teenage activity and that's just disgusting and shameful
1927360	1932960	behavior to be honest. Until the legal punishment for skipping school or smoking weed or whatever
1932960	1938960	is the death penalty people can stuff those sorts of justifications right up their back holes.
1939520	1944880	So anyway what I hope I have proved during that little analysis of the Trayvon Martin case
1944880	1951200	is that there is no avenue whatsoever for laying blame upon Trayvon Martin and again in summary
1951200	1955600	any injury Zimmerman sustained could have been perfectly legally inflicted. Unless you have
1955600	1961040	evidence that Trayvon Martin started the fight Zimmerman's injuries are no justification.
1961040	1966240	Trayvon Martin still being between the houses and not returning home is also no justification.
1966240	1970880	Zimmerman also had no reason to be there and even if Martin did confront Zimmerman
1970880	1976400	that doesn't prove who initiated the physical confrontation which is the important thing.
1976400	1981200	There is nothing you can accuse Martin of that is not also true of Zimmerman and so the most
1981200	1986880	pro-Zimmerman position I will accept as legitimate here is one of complete neutrality. The only
1986880	1991760	logical explanation I have for explaining why people would actually openly justify Zimmerman's
1991760	1997600	actions is because they are racially biased whether consciously or not. Absolutely none of
1997600	2002560	the evidence implicates Martin as doing anything illegal at any point other than the testimony of
2002560	2008320	a man who has an enormous incentive to lie and thus whose account cannot be trusted. If you
2008320	2015200	favor Zimmerman's account of the incident you are by process of elimination either a fool or racially
2015200	2020880	biased. Now I stated earlier that I could prove that a racial bias exists in the response to
2020880	2026400	cases like this and so let's take a look at that and for this last section of the video we need to
2026400	2034880	know about the shooting of Lavoie Finicum. So on January 2nd 2016 an armed group led by Ammon Bundy
2034880	2042320	of the 2014 Bundy standoff seized and occupied the National Wildlife Refuge in Harney County in
2042320	2050800	Oregon. They did this for some stupid reason whatever it doesn't matter. On January 26th
2050800	2056320	two trucks carrying Ammon Bundy, Lavoie Finicum and others left the refuge to travel to a meeting
2056320	2062480	in an adjacent county and the FBI used this opportunity to intercept the trucks and arrest
2062480	2068480	the group. One truck stopped but the other of which Lavoie Finicum was the driver led the
2068480	2074080	police on a high-speed chase with Lavoie Finicum shouting that the only way the police could stop
2074080	2079680	him was to shoot him. A mile down the road Finicum's truck encountered an FBI roadblock
2079680	2084560	where he crashed left the truck armed with a gun and approached police who fatally shot him.
2085440	2090400	Now whatever you think about the legitimacy of the police shooting of Lavoie Finicum the facts
2090400	2095120	are that he was involved in an armed takeover and occupation of a government building led the
2095120	2099840	police on a high-speed chase told the police he wouldn't stop until he was killed and crashed
2099840	2103840	his car at a police roadblock and then approached them armed with a gun and it really is amazing
2103840	2108960	what you have to do to get the police to shoot you if you're an older white guy in a cowboy hat
2108960	2113440	and all of this was recorded by both a police helicopter and camera footage from inside the
2113440	2118320	truck and I want to make clear here that I'm not celebrating or laughing about the man's death in
2118320	2124800	any way but it was entirely avoidable by him. For the other truck that stopped when the police asked
2124800	2131440	all occupants were arrested peacefully. Lavoie Finicum did not have to die and it was clearly
2131440	2137360	his own actions that brought about his shooting. So why am I telling you about this incident? Well
2137360	2143200	it serves as a very useful comparison to the shootings of various young black men including
2143200	2149040	Trayvon Martin because thanks to the permanent record of the internet it means that I get to do
2149040	2156000	this. Keith Roadbush on twitter says Finicum was simply murdered by scared cops who don't know how
2156000	2162240	to handle it when someone else is armed and trained. Finicum never hurt anyone. For Trayvon
2162240	2166960	Martin however, Keith says my solemn prayer is that Trayvon will serve to teach young black
2166960	2173280	Americans the thug-like gang-banging stealing and dope-smoking life is futile. Holly Ammon on
2173280	2179600	twitter says an innocent man was gunned. Lavoie Finicum did nothing wrong. These men, all of them,
2179600	2184640	did nothing wrong. Yeah other than occupy a federal building and lead the police on high
2184640	2191280	speed chase, Holly. For Trayvon Martin however, Holly says Trayvon was just a big black thug.
2191280	2196800	BlueVino on twitter says it's kind of rude to forget that Lavoie Finicum was shot and killed
2196800	2202640	while unarmed. In actuality it's kind of rude to forget that he was really armed with a gun.
2202880	2209920	BlueVino. Anyway for Trayvon Martin, BlueVino says the death was Trayvon's fault for attacking.
2209920	2217280	Trayvon had no right to attack. Trayvon initiated violence. Waifu Kaori says one confirmed dead
2217280	2224160	Lavoie Finicum hold these people accountable. Should we also hold George Zimmerman accountable
2224160	2230640	though? Apparently not. The hero George Zimmerman is going to donate money from his gun auction to
2230640	2237360	fight the Black Lives Matter terrorists. What a great man. Ginger Merritt on twitter says
2237360	2243520	Lavoie Finicum was murdered in cold blood and then quotes a bible passage. For Trayvon Martin
2243520	2249520	however, she says God protected someone Trayvon Martin would have assaulted. So God works in
2249520	2256400	mysterious and apparently racially biased ways it seems. D. Claire Diane claims Lavoie Finicum
2256400	2262960	was murdered in the first degree but elsewhere states Trayvon Martin was a black thug. And it
2262960	2268720	goes on, you get the point. And you can compare the shooting of the armed Lavoie Finicum to other
2268720	2276880	shootings of unarmed black people as it turns out. At Radical RW on twitter says Lavoie Finicum was
2276880	2282640	murdered in the first degree but for the case of Tamia Rice, the 12 year old shot by police while
2282640	2289280	playing in a park, they say some idiot pulled a fake gun on a cop and got shot. What did he
2289280	2294800	think would happen? Radical RW doesn't bother asking what Lavoie Finicum thought would happen
2294800	2300640	when he ran a police roadblock however. There can be no explanation for this obvious contradiction
2300640	2307360	in reactions except for racial bias. When an armed white criminal is considered less dangerous than
2307360	2314720	an unarmed black teenager, what other explanation could there possibly be? So don't be like these
2314720	2321040	people I guess is my point. Don't go for the easy excuse. Put some thought into your opinions and
2321040	2328480	also consider why you hold those opinions that you do. Now I intentionally called George Zimmerman
2328480	2335120	white in the first minute of this video and I did that for a reason. One point that was repeated
2335120	2341120	constantly during the trial was that Zimmerman was not white, he's hispanic and therefore this
2341120	2347680	isn't a white black race thing you know. Which is pretty racist in itself to be honest but I called
2347680	2353520	Zimmerman white because that is what he himself identifies as. He says he's white in the police
2353520	2359200	interviews because of course hispanic isn't a skin color. You can have white hispanic people and
2359200	2365280	black hispanic people and whatever else. Claiming Zimmerman to be hispanic not white portrays an
2365280	2371280	ignorance both of the facts of the case and of the relevant racial terminology. So I called
2371280	2377440	Zimmerman white early on deliberately to trip up any youtube commenters who don't listen to
2377440	2383600	arguments and don't watch the whole video. So anyone who comments Zimmerman was actually hispanic
2383600	2389360	haha you're wrong beneath this video I'm here preemptively shaming you. Thanks a lot for
2389360	2395920	watching everyone. Another day, another depressing video. I apologize. I have one about the British
2395920	2402320	Empire in the works. I'm sure that's not going to be too cheery either. Maybe eventually I'll run out
2402320	2407120	of darker topics and we can talk about something pleasant for a change. Wouldn't that be nice?
2407760	2412800	Thanks as always to all my patrons scrolling by right now who enable me to keep making videos
2412800	2418480	like this one so if you want more videos like this consider sending me a dolly yourself and
2418480	2423920	also maybe check out the other creators that I personally support on patreon all of whom are
2423920	2430880	very interesting folks who create awesome things and are definitely worth having a p-cat also also
2430880	2435600	follow me on twitter and send me a curious cat question if you like I try to answer at least
2435600	2439680	some of them rightio thanks folks I'll see you soon
