start	end	text
0	6240	Hello, everyone. So, today I'm gonna talk about the killing of Trayvon Martin by George Zimmerman.
6240	11440	But I feel like I need to explain myself and justify this a little before we get going here.
11440	17120	It'd be fair to ask, why now, five years later, do you wanna talk about this?
17120	20480	And the answer there is that I still believe it to be relevant.
20480	25360	The generalities of the incident, a black person, in this case Trayvon Martin,
25360	29120	is killed by a white person, in this case George Zimmerman,
29360	32720	in unclear or ambiguous circumstances.
32720	38160	And then later, the killer receives either no or relatively little legal punishment.
38160	42800	The names and the locations change, but the general outline remains the same.
43600	48640	And the feeling held by a lot of black people and more racially conscious people of other races
48640	53120	is that these people probably would not have been killed had they been white,
53120	55200	or if they had still been killed,
55200	58880	the justice system would have treated the killers much less leniently.
59200	61280	And this can be a hard thing to prove.
61280	64560	We're talking about certain likelihoods and probabilities,
65280	68000	subconscious or otherwise hidden biases,
68000	72800	and we don't have another America in which Trayvon Martin was a white teenager
72800	77280	walking home from the store to see what would have happened differently were that the case.
77840	83120	It's also easy to examine only the particulars of each incident in isolation,
83120	85840	and therefore avoid considering the overall trends.
86560	90240	Each case is easy to excuse if you're looking for excuses.
90800	95920	Trayvon Martin hit George Zimmerman, so Zimmerman was justified in defending himself.
95920	100880	Tamir Rice had a toy gun, and you know, that could have been mistaken for a real gun,
100880	103600	so, you know, therefore, etc.
104240	108000	There's always an excuse, however valid that excuse is,
108000	111200	with the cases that receive a lot of media attention.
111200	115040	A useful comparison here is the shooting of Levar Edward Jones.
115120	118480	Now, this shooting was not a particularly high-profile case.
118480	122720	A Google search for Levar Edward Jones only gives 1300 results,
122720	127200	compared to the 1.6 million for Trayvon Martin, for instance,
127200	130880	and I wouldn't be surprised if a lot of people hadn't heard of this shooting.
130880	133040	So, a very brief overview then.
133040	136000	On September the 4th of 2014,
136000	140880	South Carolina State Trooper Sean Grubert pulled up behind Levar Edward Jones
140880	143120	as he accessed his vehicle at a gas station.
143840	146880	Grubert asked Jones to get his license and registration,
146880	148480	and when Jones reached for them,
148480	152320	Grubert panicked and pulled his gun and fired several times,
152320	154000	hitting Jones in the hip.
154000	157600	Now, I'll link the video in the description and avoid showing it here,
157600	159600	but it's pretty much as I described.
160160	163920	So why didn't this case get as much media attention as some others?
163920	165760	Well, there's a few factors,
165760	168960	and they're all rather depressing to think about, to be honest.
169680	172880	The first is that there is a clear record of the incident.
172880	176400	It happened in plain sight in view of Grubert's dashcam.
177120	180000	The second is that the person who was shot survived
180000	182240	and could thus later argue their case.
182880	186000	And the third is that Grubert was very quickly fired,
186000	189040	arrested, and charged with felony assault and battery.
189040	192000	So there's very little to argue about this case.
192000	193440	It's clear-cut.
193440	196240	The person who was shot was entirely innocent,
196240	198880	the police officer was clearly in the wrong,
198880	200080	and that's the end of that.
200080	202480	You know, there's no excuse for that one.
202480	204320	And that's the important thing here,
204320	207120	there not being an excuse or a justification.
207840	212480	But let's imagine an alternate version of the shooting of Levar Edward Jones.
212480	215200	What if the gunshot had been fatal
215200	218960	and the person who was shot wasn't around to tell his side of the story?
219600	222640	And what if the dashcam had been angled slightly differently
222640	224400	or didn't pick up the incident?
224400	229760	Or, alternatively, what if the dashcam footage had been not so mysteriously lost?
230400	233120	Uh, well then the officer in this imaginary case
233120	237040	could have then said anything he liked to justify the shooting.
237040	240240	He looked dangerous, he said he was gonna kill me,
240240	244720	he grabbed for my gun, whatever, and there's the justification.
244720	249840	Now we see that blame is always individualized in these sorts of incidents.
249840	253840	The black person who was shot or killed is always considered at fault
253840	258400	up until it's an obvious and unavoidable fact that they were innocent.
258400	262160	Now, completely absent from this framework are societal factors
262160	266400	or racial biases or any sort of wider consideration of trends.
267280	269600	Only one person can be at fault.
269600	273520	It's either the person who was shot or the person who did the shooting,
273520	275280	and that's the end of that.
275280	277840	And so we come to the point of my video.
277840	281840	This video is aimed at people who might subconsciously even
281840	286000	reach for the easy excuse to justify these kinds of incidents.
286000	290880	Now, I don't think these people are capital R racists necessarily,
290880	294480	just that they might be harboring some biases that can be exposed
294480	298880	with a little effort and a bit of deeper thinking about the topic.
298880	303760	And we're gonna examine one case in particular, the shooting of Trayvon Martin.
303760	307680	We're gonna look at the various justifications given for Zimmerman's actions
307680	312640	and see if they hold water, and then afterwards I've come up with a clever way,
312640	318640	if I do say so myself, of proving that bias exists in reactions to cases like this.
318640	320480	So stick about if you want to see that.
321360	325920	My intention here is that by getting people to stop and think about just one case,
325920	329360	they might not be so quick to jump to conclusions for similar cases.
329920	333120	My hope is that this video can be linked to people who might try
333120	335840	to excuse the actions of George Zimmerman,
335840	339760	and hopefully they'll sit through it and maybe take a few points on board.
339760	345200	So okay, I'll start out here by giving an as-neutral-as-possible account of the incident.
345840	350320	On February 26th, 2012, Trayvon Martin,
350320	354720	who was visiting family at the Retreat at Twin Lakes in Sanford, Florida,
355280	358320	walked to a local store at about 7 p.m.
358880	362080	On his return from the store, he was spotted by George Zimmerman,
362080	364480	the organizer of the local neighborhood watch,
364480	367440	who mistook him for a criminal and called the police.
368160	372960	Zimmerman described Martin as looking as if he was up to no good and possibly on drugs.
373520	375600	After observing Martin for a time,
375600	379600	Zimmerman left his vehicle to continue to follow him when he moved out of sight.
380240	384560	This was followed by the police dispatcher asking Zimmerman if he was following Martin,
384560	386880	to which Zimmerman replied that he was.
387520	389920	The dispatcher then asked him not to do that.
390560	396560	Zimmerman was also armed with a 9mm handgun for which he had a concealed carry permit.
396560	399040	After being unable to locate Martin,
399040	402160	Zimmerman entered his call with the police dispatcher,
402160	405600	instructing them to call him back when an officer arrived on the scene.
406240	408080	Shortly after ending the call,
408080	413360	Zimmerman and Martin met at the top of the T-shaped intersection between the rows of houses.
413920	418400	A physical altercation ensued during which Zimmerman received a nosebleed
418400	421120	and some light abrasive wounds to the back of his head,
421120	423840	and Trayvon Martin was shot fatally in the chest.
424400	427520	Police arrived on the scene shortly thereafter.
427520	429920	So that's the basic outline of the events,
429920	432800	containing only the facts that are beyond dispute.
432800	436480	Of course, quite a few other things happened, or probably happened,
436480	439120	but those need to be talked about in more detail.
439120	441440	So what do we think about this incident?
441440	446800	Well, let me start by saying that I agree with Zimmerman being found not guilty at trial.
446800	450400	Now, that is not because I do not believe him to be at fault.
450400	451280	Because he was.
451920	453040	He definitely was.
453600	455920	But I believe he was overcharged.
455920	458880	Zimmerman was charged with second-degree murder,
458880	462640	which requires the prosecution to prove beyond the reasonable doubt
462640	466000	that Zimmerman intended to kill Trayvon Martin.
466000	470480	And without an eyewitness to the start of the physical altercation, as we'll see,
470480	472960	that is impossible to prove in court.
472960	476560	The start of the altercation is what is important here.
476560	480400	You see, the first justification for the shooting of Trayvon Martin
480400	482160	is that he injured Zimmerman,
482160	485440	and therefore Zimmerman could have reasonably feared for his life,
485440	487600	and thus was in the clear to defend himself.
488320	490560	Now, the problem with this argument is that
490560	494960	that same justification for Zimmerman's actions also works in reverse.
495520	497600	Trayvon Martin was also injured.
498320	501040	Much worse than Zimmerman, he was fatally injured,
501040	502960	and therefore, by the same logic,
502960	507840	he was legally in the clear to kill Zimmerman in self-defense as well.
507840	510560	So we're in a weird legal limbo here.
510560	515360	It certainly can't be the case that two people are just legally allowed to fight to the death
515360	517520	because they both fear for their own lives.
517520	522240	So what matters here is who initiated the physical altercation.
522880	526240	Without knowing that, Zimmerman's injuries could have been inflicted
526240	529760	by Trayvon Martin acting legally in self-defense.
529760	532160	And a lot of people who were outraged by this case
532160	534320	probably fought with some justification
534320	538160	that a stranger following you at night and chasing you down a dark alley
538160	541360	was itself enough to justify defending yourself physically.
542160	547600	As for actual hard courtroom evidence, though, we have relatively little to go on.
547600	549920	We have Zimmerman's account of the incident,
549920	552960	told through his written statement, his interviews with the police,
552960	556400	and a recorded walkthrough of the event conducted the following day.
556400	562000	But that is obviously not reliable by itself for what I hope are obvious reasons.
562000	565760	Also, Zimmerman provably lies at several times
565760	569760	during his recounting of the incident, which we'll get to shortly.
569760	574080	So without a witness to or recording of Zimmerman starting the fight,
574080	578560	and with no other indication that Zimmerman actually wanted to kill Martin,
578560	581680	there isn't really enough here for a murder conviction.
581680	585680	What you can prove is that Zimmerman was in the wrong at several points.
585680	589360	He was incorrect in his profiling of Martin as a criminal.
589360	592720	He was incorrect to leave his vehicle to pursue Martin.
592720	596560	He had several times acted recklessly and idiotically,
596560	601280	but that doesn't prove he actually wanted to murder Trayvon Martin.
601280	604240	And indeed, if we read the Sanford Police Department's report
604240	608560	after they eventually decided to recommend charging Zimmerman with something,
608560	612720	they said there is probable cause for charging Zimmerman with manslaughter,
612720	613520	stating,
613520	616560	"...the encounter between George Zimmerman and Trayvon Martin
616560	618960	was ultimately avoidable by Zimmerman.
618960	623040	If he had remained in his vehicle and awaited the arrival of law enforcement,
623040	627040	or conversely, if he'd identified himself to Martin as a concerned citizen
627040	630720	and initiated dialogue in an effort to dispel each party's concerns,
631600	635840	there is no indication that Trayvon Martin was involved in any criminal activity
635840	637280	at the time of the encounter."
637280	642560	And yes, the prosecutors would have had a much easier time proving manslaughter in court,
642560	647200	mainly because of all the aforementioned lies that Zimmerman can be shown to have told.
647200	653200	So, let's talk about some of those and also examine another anti-Treyvon Martin argument,
653200	656800	this one being that during the time Zimmerman was on the phone,
656800	660720	Trayvon Martin had enough time to get home to safety.
660720	666480	And people generally use this fact to suggest that since Trayvon Martin did not return home immediately,
666480	670880	he was therefore looking to ambush or otherwise confront Zimmerman.
670880	674000	Now, one can come up with several possible scenarios
674000	677600	for why Martin did not return home immediately.
677600	680240	Firstly, he was on the phone to a friend at the time,
680240	684400	so maybe he simply wanted to finish his conversation before reaching the house,
684400	686240	and so he paused early.
686240	691200	Secondly, maybe he was sufficiently freaked out by the strange guy who was following him around
691200	694880	and decided that leading that person to his house might be a bad idea.
695520	699920	Remember, Martin had no clue who Zimmerman was or why he was following him,
699920	702560	so that is another possible scenario.
702560	706480	These possibilities, though, are actually entirely unnecessary.
707360	712480	Let's go with the idea that Trayvon Martin did hide or even walked all the way home
712480	716800	before changing his mind and deciding he was gonna confront Zimmerman.
716800	721120	So he marched right back up the path with the intention of doing just that.
721120	725920	Now, the problem here is that confront does not mean attack,
725920	728000	and it certainly does not mean kill.
729120	731520	Martin does not know what's going on, remember.
731520	733680	He doesn't know that the police have been called,
733680	737440	or that Zimmerman has a gun, or that he's about to be shot with it.
737440	741360	He's under no legal responsibility to do anything in particular,
741360	743120	so long as he does not break the law.
743680	745760	He does not have to return home.
745760	748560	He can walk up and down the street all night if he likes,
748560	753360	and there's nothing illegal about approaching someone to ask why they're following you.
753360	758800	Criticizing Martin for not returning home immediately is cynically placing the blame on him
758800	761920	for not anticipating and avoiding his own killing.
762560	765840	Even if Martin did double back to confront Zimmerman,
765840	770560	that still tells us nothing about who initiated the physical confrontation.
770560	775280	Secondly here, this criticism of Martin's actions also applies equally,
775280	777360	or even more so, to Zimmerman.
778000	782480	The top of the T intersection is much closer to where Zimmerman's truck was parked
782480	784800	than where Trayvon Martin's house was,
784800	788480	and Zimmerman had the exact same amount of time to get back to his truck
788480	790160	if that's what he wished to do.
790880	795680	If you're going to criticize Trayvon Martin for still being present when Zimmerman got off the phone,
795680	799360	then you have to apply that criticism to Zimmerman also.
799360	803360	Unlike Martin, however, Zimmerman is still around to inform us
803360	807520	why he was still in the alley between the houses instead of back at his truck,
807520	812640	and his explanation for still being there, as it turns out, makes no sense whatsoever.
813280	816720	Firstly, let's go through the transcript of Zimmerman's call to the police
816720	819040	and highlight all the relevant information.
819040	822400	Then we'll look at Zimmerman's walkthrough of the events the next day
822400	824160	and compare the two accounts.
824160	827440	So, the relevant parts of the police call are as follows.
827440	832320	Firstly, Zimmerman gives the dispatcher the address of the clubhouse at Retreat View Circle.
832880	836720	Then later in the call, he gives the more precise location of his truck.
836720	841040	Go straight past the clubhouse, make a left, and then past the mailboxes.
841040	842400	That's where his truck was.
843120	846800	Then the dispatcher asks what address Zimmerman is parked in front of,
847440	851280	one time, and Zimmerman responds that he does not know.
851280	854960	And at the end of the call, the following exchange takes place.
854960	859360	The dispatcher asks Zimmerman if he wants to meet the police near the mailboxes
859360	862960	where his truck is, and Zimmerman agrees at first.
863600	866880	But then when the dispatcher attempts to confirm this meeting place,
867440	869520	Zimmerman changes his mind and says,
869600	882160	Now let's look at the recording of Zimmerman's reenactment to the incident for the police,
882160	885360	because there are a few key points where his account differs here.
899520	918640	At this interaction, where the dispatcher asks Zimmerman if he can get to somewhere
918640	922400	he can see Trayvon Martin is not in the transcript,
922400	928800	and is likely a later embellishment by Zimmerman to justify his continued following of Martin in his truck.
930000	940480	I saw him walking back that way and then cut through the back of the houses.
941120	944240	He looked back and he noticed me and he cut back through the houses.
944240	951200	I was still on the phone with non-emergency and then he came back and he started walking
951200	956560	up towards the grass and then came down and circled my car and I told the operator that
956560	962400	he was circling my car. I didn't hear if he said anything, but he had his hand in his waistband.
962400	967520	At this interaction, where Zimmerman observes Martin circle his truck and informs the operator
967520	972640	about it, is not present in the transcript. Zimmerman does mention that Martin is looking
972640	977440	at him at one point, but at no point mentions Martin circle the truck.
977440	982240	It's unlikely that Martin would have had enough time to do this in the brief time in the call
982240	988800	before Zimmerman left his truck, and also unlikely Zimmerman would not have mentioned it to the dispatcher.
988800	993760	This is likely a later embellishment in order to make Martin appear more threatening.
993760	998960	And I think I told the operator that and they said where are you?
998960	1003760	And I could not remember the name of the street because I don't live on this street.
1003760	1010400	Retreat view circle goes in a circle. And I said I don't know and he goes we need an address.
1010400	1017440	And I said I don't know an address. I think I gave them my address. And they said give us
1017440	1022800	directions to get to you. And I said if you tell the police to go straight at the clubhouse and
1022800	1027440	make a left my truck will be there. And again they asked me where he went and what direction he went.
1027440	1032720	And I said I don't know. And then I thought to get out and look for a street sign.
1032720	1034720	So I got out of my car and I started walking.
1034720	1036720	Go ahead.
1053840	1057920	I was still on the phone with non-emergency and I started walking.
1057920	1059920	Okay.
1059920	1069360	And because I didn't see a street sign here but I knew if I went straight through that that's retreat view circle.
1069360	1074160	And I can give him an address. He said just give me the address of the house you're in front of.
1074160	1078160	And there's no address because this is the back of the house.
1078160	1080160	So it works here.
1081200	1085840	At firstly the dispatcher does not repeatedly ask for an address in the transcript.
1085840	1090800	This is a fabrication by Zimmerman in order to create a pretext for him to leave the car.
1091600	1095120	Secondly his described actions here make no sense.
1095120	1100000	I mean we're first expected to believe that a man who has lived in the neighborhood for several years
1100000	1105600	and is the self-appointed head of the neighborhood watch can't remember what street he's on in a
1105600	1112080	neighborhood with free streets. That seems rather unlikely to me but whatever.
1112080	1117600	Next up Zimmerman is parked on Twin Trees Lane and claims he can't give an address because he's
1117600	1124320	at the back of the houses. But as he's saying this we can see behind him some houses which do face
1124320	1129440	onto Twin Trees Lane. So his claim that he has to walk through to retreat view circle in order to
1129440	1134880	find an address is clearly incorrect. He could just look at the much closer houses that do
1134880	1141040	actually face onto Twin Trees Lane. So that's when I walked straight through here to get the address
1141040	1147120	so that I could meet the police officer and then they said uh I said he's not here they said do
1147120	1151440	you still want him to come and I said yes and they said where do you want him to come to and I said
1151440	1156720	you know what just tell him to meet me at my truck next to the clubhouse if you go straight
1156720	1160560	in through the clubhouse it makes a left I have a Honda original I'm silver Honda original I was
1160560	1166400	parked right there I'll meet him right there so I started walking back. This interaction in which
1166480	1171600	Zimmerman informs the dispatcher that he wants to meet the police by his truck is the actual
1171600	1176880	opposite of what appears in the transcript. The dispatcher is the one to suggest that and
1176880	1183280	Zimmerman instead proposes them calling him back to see where he is. This lie is also repeated in
1183280	1187360	one of the police interviews where Zimmerman claims the dispatcher asked where he wanted
1187360	1194560	to meet the police and he said at his car. So what does all this add up to? Well I think it's fairly
1194560	1201440	clear that all this rubbish about needing to find an address is an obvious fabrication. The dispatcher
1201440	1206960	already had an address they were directing police to and at no point asked Zimmerman to go walking
1206960	1212800	to find another one and even if they had done that there were much closer addresses available for
1212800	1218080	Zimmerman to go and check and even if Zimmerman had needed to walk through to retreat view circle
1218800	1224080	he lived on retreat view circle and I simply refused to believe that he forgot the name of his
1224080	1228880	own street and needed to go and physically look at a street sign to see where he was.
1228880	1234800	Now the probable truth is simply that Zimmerman was still looking for Trayvon Martin intending to
1234800	1242400	be the hero and catch the bad guy because quote these assholes always get away. Now Zimmerman also
1242400	1247520	tells several lies relating to the initial confrontation between him and Martin and let's
1247520	1253680	take a look at those. Firstly there is a major discrepancy in Zimmerman's story about the location
1253680	1259440	where he was knocked down by Martin. From his written statement he says as I headed back to
1259440	1267680	my vehicle the suspect emerged from the darkness and said you got a problem I said no the suspect
1267680	1275360	said you do now as I looked and tried to find my phone to dial 911 the suspect punched me in the
1275360	1282560	face I fell backwards onto my back the suspect got on top of me. So Zimmerman here makes it sound as
1282560	1286960	if he was immediately dropped by the first punch and this is echoed in his interview with the
1286960	1293360	police he punched me in the nose at that point I fell down were you still standing at this point
1294080	1301280	no ma'am okay I fell to the ground when he punched me the first time. So that's Zimmerman
1301280	1307280	restating and confirming that he fell at the first hit and here's why this makes no sense
1307280	1312880	if Zimmerman really was walking back to his truck from retreat view circle where he was apparently
1312880	1316080	looking for a street sign to tell him what the name of the street he lived on was called
1316640	1322080	and if he was doing that he would only need to walk across the top of the t intersection to get
1322080	1326720	back to the truck. Now the problem with this account is that Martin's body was found a few
1326720	1332400	houses down the path between the buildings here's a photograph taken from around the location where
1332400	1338240	Zimmerman first claimed he fell to the ground showing Martin's body in the distance. So what
1338240	1343840	does this mean? Well either Zimmerman's story about meeting Trayvon at the top of the intersection
1343840	1348160	is untrue and he was actually punched to the ground 40 feet down the path between the buildings
1348160	1353840	with no explanation of why he should be there or his story about being dropped with the first punch
1353840	1358320	is untrue because if he'd fell to the ground at the top of the intersection then Trayvon Martin's
