start	end	text
1046920	1048300	is a really fun experience.
1048300	1050220	There are so many nuances and specifics
1050220	1052300	to the game's level designs and movement mechanics
1052300	1054600	that it's just a joy to see how much extra speed
1054600	1056060	can be teased out.
1056060	1058600	But the game's parkour focus and aesthetic
1058600	1060400	also poses a question for runners.
1060400	1062640	What does it mean to speedrun?
1062680	1064680	What does it mean to speedrun Mirror's Edge?
1064680	1066440	There's a variety of interesting glitches
1066440	1068140	available to exploit if you want to beat
1068140	1069600	Mirror's Edge as fast as possible,
1069600	1071560	but some of them significantly impact
1071560	1073980	the way the game is played and what the experience
1073980	1075280	of watching it is like.
1075280	1077160	Take, for example, the out-of-bounds glitch,
1077160	1078280	or OOB.
1078280	1080540	Plenty of games let you get OOB of the level
1080540	1082740	and use this to get to places meant to be reached
1082740	1084500	through slower or harder means.
1084500	1086280	This can be used very egregiously
1086280	1088920	to bypass large chunks of several levels,
1088920	1091380	and this is technically much, much faster
1091420	1093240	than playing the game the normal way.
1093240	1096540	But it also runs counter to the sort of principles
1096540	1099300	that make Mirror's Edge the game you'd want to see speedrun
1099300	1100720	in the first place, doesn't it?
1100720	1102680	It's a game all about motion, finesse,
1102680	1104680	clever use of controls and timing
1104680	1107260	to skirt along the edge of the proverbial mirror,
1107260	1110140	not to clip through it and then just win.
1110140	1112640	Part of the fun of speedrunning is watching a game
1112640	1115220	being played very skillfully and very quickly,
1115220	1117600	and some tricks rub up against what some people
1117600	1120440	would define as skillfully playing the game.
1120460	1122260	So Mirror's Edge has multiple categories
1122260	1123460	for the main run through the game,
1123460	1126000	including Any% and Glitchless.
1126000	1128800	In Any%, you can be treated to a faster run of the game
1128800	1130340	using a lot of technical trickery
1130340	1133300	to run across surfaces in weird and impossible ways,
1133300	1136220	accelerate far faster than was probably ever intended,
1136220	1139400	abuse a bizarre mistake in the wall-run kick programming
1139400	1142180	that allows you to jump on one frame right afterwards
1142180	1144020	like Faith had a double jump or something,
1144020	1147020	slide into parts of the world you were never meant to see,
1147020	1149700	have an LSD trip nightmare as every frame
1149700	1152280	of Faith's movement is suspended before her eyes,
1152280	1154040	and climb through moving elevators
1154040	1156080	to shoot up into darkness.
1156080	1158460	This run is really interesting and showcases
1158460	1160300	some amazing tricks and moves,
1160300	1162760	but it's also maybe not the sort of stuff
1162760	1165300	it's fun to see specifically in a speedrun
1165300	1166560	of this type of game.
1166560	1168480	This is obviously highly subjective, of course,
1168480	1171260	but the community seems to agree with me, so I win.
1171260	1174360	In around 2013, they introduced the Glitchless category,
1174360	1176860	which specifically prohibits using major glitches
1176860	1178820	that alter the flow of the game in this way.
1178820	1180940	Glitchless runs don't go out of bounds,
1180940	1183320	don't abuse the weird extra jump you can get
1183320	1184400	from kicking off a wall,
1184400	1186400	and prohibit a few other specific tricks
1186400	1189160	that some people might deem against the spirit
1189160	1190200	of Mirror's Edge.
1190200	1193660	Glitchless has never and will never be faster than any percent,
1193660	1197000	but to me, at least, it's even more entertaining to watch.
1197000	1198660	Runners in this category are navigating
1198660	1201040	through more of the intended world of Mirror's Edge,
1201040	1204120	which, for someone who played and really liked the game,
1204120	1206180	is a way more interesting challenge.
1206180	1208420	All kinds of segments that are completely avoided
1208440	1210400	by fairly easy tricks in any percent
1210400	1213520	have to actually be played and routed properly in Glitchless.
1213520	1217120	Let's compare just one jump across both categories.
1217120	1219740	Here's the entrance to the RPA building in the second level.
1219740	1222240	This jump is one of the first properly tough jumps
1222240	1223620	in the game. It's a long distance,
1223620	1225580	but also involves downward traversal.
1225580	1228420	You have to approach it at speed and jump really late,
1228420	1231120	but also roll when you land or you get hurt.
1231120	1233720	Either rolling or taking damage is really slow.
1233720	1236600	A runner doesn't really want to do either of those things.
1236600	1238380	In the current Glitchless world record,
1238400	1241400	the runner Wreck executes an incredibly skillful maneuver
1241400	1243680	to take full advantage of this rail here,
1243680	1246520	so they land on the rail instead of the regular ground,
1246520	1248820	which prevents them having to roll or take damage,
1248820	1252620	but they also turned in midair and executed a side jump
1252620	1255400	to immediately get back to top speed when they landed.
1255400	1257000	This is really, really cool.
1257000	1259120	It's really difficult to do. I can't do it.
1259120	1261820	Here's the same part in the current Any% world record
1261820	1263160	by Philotrax.
1263160	1264920	Trax abuses the wall kick jump
1264920	1267960	to effectively fly over this challenging gap,
1267960	1270140	landing safely on some of the game's trademark
1270140	1272520	white plant furniture stuff.
1272520	1275060	Extrapolating tricks like this across a full game run
1275060	1278020	makes for two very different and uniquely interesting paths
1278020	1279260	through the game to watch.
1279260	1281480	Earlier, I asked the question of which category
1281480	1284280	should be considered the real speedrunner of the game,
1284280	1287060	but I don't think there's an objective answer,
1287060	1288360	at least for most games.
1288360	1289700	Even in Bloodborne's case,
1289700	1291780	using bugs that were patched out later,
1291780	1294240	this is a version of Bloodborne that was released,
1294240	1296420	and it beats the game as fast as possible,
1296420	1298460	and in Mirror's Edge, maybe clipping through walls
1298460	1301580	should be seen as just as valid a strategy as not doing so,
1301580	1303800	but everyone gets to decide for themselves
1303800	1306000	how to figure out what a speedrun needs to be,
1306000	1307640	and usually there's gonna be enough people
1307640	1309520	who feel that way that it's gonna end up
1309520	1310720	as a speedrun category,
1310720	1312220	and the Mirror's Edge community has come up
1312220	1314440	with quite a lot of categories over the years.
1314440	1316720	I've only talked about one of the extra ones so far.
1316720	1318400	There's also Any% in bounds,
1318400	1320680	which specifically avoids out-of-bounds glitches
1320680	1322320	if you think going oob is wrong
1322320	1323780	and are okay with the more advanced
1323780	1325440	wall kick jump tricks and stuff.
1325460	1326880	There's much more healthy competition
1326880	1329440	when there are multiple agreed sets of rules to choose from.
1329440	1331680	I imagine if there had only been one ruling
1331680	1334100	for how to speedrun Mirror's Edge,
1334100	1336520	it would be a lot less satisfying for a lot of runners
1336520	1338480	and wouldn't have seen quite as many runners
1338480	1339860	come and go over the years.
1339860	1341820	One runner eventually got a job at DICE
1341820	1343240	and worked on the sequel,
1343240	1345900	which apparently some people even played,
1345900	1346740	so that's nice.
1346740	1349160	Speedrunning is a completely arbitrary challenge,
1349160	1352160	one that most developers never even think to account for,
1352160	1354340	so it's totally fine to have multiple ways
1354360	1355740	of categorizing runs,
1355740	1357700	different kinds of challenge and so on
1357700	1360540	because some types of run are more interesting than others
1360540	1362700	and none are really any more valid
1362700	1365340	because they're all ultimately just silly things
1365340	1367880	some people do for the sake of fun and competition.
1367880	1370260	I think it's cool that even what it means
1370260	1373300	to play a game quickly can be up for discussion sometimes.
1373300	1374920	My favorite type of Mirror's Edge run
1374920	1378100	is the 69 stars category, which is very nice.
1378100	1379940	It's the category for running through all the game's
1379940	1381480	optional time trials in one sitting
1381480	1382760	and getting all the stars.
1382780	1384860	It really embodies the things I enjoy the most
1384860	1386280	about the Glitchless speedrun.
1386280	1388820	It's just great performances utilizing mechanics
1388820	1391120	mostly intended by the game's developers.
1391120	1393960	Runners do awesome stuff like ignore the game's
1393960	1395620	in-built run-ups for big jumps
1395620	1398580	and instead make really precise movement over them
1398580	1401660	to jump manually at the edge and make it further and faster.
1401660	1402660	It's awesome.
1402660	1406040	The current number one record is by Voatiem?
1406040	1407680	Voatiem? I'm not sure,
1407680	1411000	who got in just a teeny smidge over 21 minutes
1411000	1413080	due to a couple of minor mistakes.
1413080	1414540	You're kidding, right?
1414540	1417460	Someone is going to beat 21 minutes in this category,
1417460	1418960	and I can't wait. It's gonna be awesome.
1418960	1420960	And because Mirror's Edge seems to inspire
1420960	1423840	utter obsession in its fans, myself included,
1423840	1427060	speedrun.com also has a category extension leaderboard
1427060	1429600	for even more weirder and specific runs.
1429600	1432220	Uh, speedrun.com slash memeem.
1432220	1433680	Heh heh. It's pretty great.
1433680	1435440	There's a true Glitchless category here
1435440	1438140	for weirdo purists like me who just want to see
1438140	1440780	the actual game played near perfectly.
1440800	1442800	There's categories that often only even have
1442800	1444480	one or two submitters where, like,
1444480	1446400	runs where one runner uses the mouse
1446400	1447780	and another uses the keyboard
1447780	1450520	or where two runners each use half of one controller.
1450520	1452280	Honestly, this is just getting silly now.
1452280	1453860	What about a New Game Plus category
1453860	1456240	where players chapter select the last segment
1456240	1458000	and beat it in 13 seconds
1458000	1461000	and people are genuinely down to counting milliseconds
1461000	1463120	to figure out who was actually the fastest?
1463120	1465840	What about RBO, reverse boss order,
1465840	1468420	where runners chapter select to each boss in the game
1468440	1471240	in reverse order and time beating each of them?
1471240	1474860	What about reverse RBO, where they do RBO backwards?
1474860	1476280	Why would you do it like that?
1476280	1478080	That's just boss. Why is it called that?
1478080	1480660	How about Any% x 25,
1480660	1482820	where one runner has decided to run the game
1482820	1485080	25 times in a row,
1485080	1487660	which took over 17 hours
1487660	1490720	and which they openly declare no one will ever beat?
1490720	1492720	What the fuck are your sidesteps right now?
1492720	1496600	I told you I'm not even paying attention anymore.
1496620	1498540	Why would you do this, Hekigan?
1498540	1501460	Was your 60-millisecond lead in New Game Plus
1501460	1504000	not enough anymore? Did you need something stronger?
1504000	1505800	What are you doing to yourself?
1506800	1510100	This is also where the segmented speedrun lives
1510100	1512860	with various runners including the aforementioned Hekigan,
1512860	1515640	Votime, Votime,
1515640	1518600	Philotrax, and Wreck all contributing small segments
1518600	1521100	to produce an absolutely incredible run.
1521100	1523940	It's a fabulous expression of a community's commitment
1523940	1525660	to beating a game as fast as possible
1525660	1527620	and their years of developing skills
1527620	1530320	and learning more and more about how the game works.
1530320	1531960	I love it. Link in the description.
1531960	1534000	Just give it a look. It's just great.
1534020	1537040	There's a tremendous sense of community to speedrunning.
1537040	1539200	People share information and discoveries,
1539200	1540700	discuss theories together,
1540700	1543300	and all the tricks used in runs are by their nature
1543300	1545380	immediately available for further analysis
1545380	1546660	and use in other runs.
1546660	1547760	I remember, like, way back in the day,
1547760	1549720	like, in 2014, like, I was in a Skype call
1549720	1551880	with some other SMS runners.
1551880	1553760	We were watching Tobu do some runs,
1553760	1556180	and we've never seen that spin jump before,
1556180	1558480	and it just, like, it blew our minds.
1558480	1560400	We're like, okay, I'm never gonna go for that,
1560400	1561680	and that was just, like, commonplace,
1561700	1563120	so that just goes to show, like,
1563120	1564420	how far this game has come.
1564420	1566080	Yeah. Speedrunning is an almost
1566080	1569080	inherently collectivist activity in this sense.
1569080	1571160	While there is competition to be the best
1571160	1572540	and take or hold the record,
1572540	1574960	almost no record holder has completely earned
1574960	1576640	that position all on their own.
1576640	1579100	The best runs owe a debt to the discoveries
1579100	1581420	and ideas contributed by previous runners.
1581420	1583020	The best run is often representative
1583020	1584840	of many people's contributions
1584840	1586800	alongside the runner's own skill, of course.
1586800	1589900	In a sense, speedruns are always a group effort.
1589920	1593040	It's really not surprising that awesome charity events
1593040	1595380	like GDQ have emerged from this space.
1595380	1597120	It's just a grander scaled version
1597120	1599680	of what speedrunning had kind of always been.
1599680	1601800	You can't copyright a technique or strategy
1601800	1603640	for beating a video game quickly.
1603640	1605760	There are no patents in speedrunning.
1605760	1607260	Proving that you got a time
1607260	1609640	or even getting the fastest time
1609640	1612560	isn't just an achievement or personal victory.
1612560	1615260	It's also automatically a contribution
1615260	1617360	to the greater community effort,
1617360	1618900	and that's radical.
1619860	1622180	But speedrunning isn't always about socialism.
1622180	1625180	Sometimes it's about beating video games very quickly.
1625180	1627640	Part three, in-depth investigation.
1627640	1629600	Actually, no, I've thought of a better title for this one.
1629600	1630900	Donkey Kong.
1630900	1631440	Ah!
1631440	1634440	["DONKEY KONG 64 THEME"]
1634440	1637700	["DONKEY KONG 64 THEME"]
1637700	1639940	Donkey Kong 64 is a game by Rareware
1639940	1641280	for the Nintendo 64.
1641280	1642400	Oh, you don't need to know that part.
1642400	1644700	It's very much the embodiment of the stereotypes
1644700	1646560	about Rare's games for the time period.
1646560	1649560	Large levels full of hundreds of different specific items
1649560	1652720	you have to collect to unlock more things to collect.
1652720	1655860	For instance, each level has 500 bananas,
1655860	1657940	but what makes it particularly troublesome
1657940	1659860	is that some items are specifically
1659860	1662260	for one of the five characters you play.
1662260	1664220	To collect enough stuff to progress,
1664220	1666020	you'd have to traverse the same environments
1666020	1668180	over and over with every character,
1668180	1669980	and the levels were often really big.
1669980	1671640	At the time, it made the game feel big
1671640	1673520	and like a cool, sprawling adventure
1673520	1675440	that lasted a long time and had a lot of chances
1675440	1677400	to see how each character can progress
1677400	1678480	through the same environment
1678480	1680440	using their own skills and abilities.
1680440	1682560	That's because I was seven years old.
1682560	1683860	["BOOM"]
1683860	1686480	Now it just feels like time-consuming busywork.
1686480	1688320	Lots of this was completely unnecessary
1688320	1689940	from a design standpoint, too.
1689940	1691820	You could design a game with collectibles
1691820	1694060	only one character could reach in the first place
1694060	1696020	instead of most of the time just having them
1696020	1697560	hanging out there, faded out,
1697560	1699780	reminding you you're gonna have to come back here again
1699780	1700900	with another character,
1700900	1703100	and running back to that barrel that changes characters
1703100	1705600	because you need to pick something else up is awful.
1705600	1707640	Running back to previously completed levels
1707640	1710020	because you finally have the characters you needed
1710020	1712360	to pick up those bananas you'd already walked past
1712360	1714680	eight times is a more painful tragedy
1714680	1716400	than Titus Andronicus.
1716400	1719400	I would cut off my hand and send it to Emperor Saturninus
1719400	1721320	if it meant I could have just picked that banana up
1721320	1724680	four hours ago with Daddy Kong instead of Yankle Kong.
1724680	1726940	I can feel my cells dividing
1726940	1730360	as my precious existence rushes toward its finite end
1730360	1733620	with nothing in the world to beguile my sorrow
1733620	1735660	but the sweet siren song of,
1735660	1737820	ooh, banana.
1737820	1740900	Donkey Kong 64 is an existential crisis
1740900	1743580	in the form of a video game cartridge.
1743580	1747860	I'm actually more aware of the futility of my existence
1747860	1750240	after trying to go back and play this.
1750240	1753940	Now, I could sit you down and explain the progression
1753940	1756040	of the Donkey Kong 64 Any% run to you
1756040	1757740	like it was the back of my hand,
1757780	1760540	but firstly, there's already a video
1760540	1762700	by Summoning Salt out there doing just that,
1762700	1764320	and that video's better than anything I could do,
1764320	1765860	so you should just go check that one out,
1765860	1768320	and secondly, well, to be honest,
1768320	1771240	I've seen a lot of speedruns at this point,
1771240	1772860	and I'm kind of used to it, you know?
1772860	1774360	Oh, yeah, Donkey Kong 64,
1774360	1776580	a game I beat in 72 hours as a kid
1776580	1778900	being beaten by a professional in 30 minutes.
1778900	1781580	Yeah, sure, that's impressive.
1781580	1786860	To a clown at the circus, I need something stronger.
1786860	1788820	I've built up a tolerance to this stuff.
1788820	1791360	We need to go deeper and darker.
1791360	1793020	We need to talk about the players who will settle
1793020	1795320	for nothing more than total conquest,
1795320	1797560	and no, I'm not talking about
1797560	1800560	Donkey Kong Country 2 Diddy's Kong Quest.
1800560	1802020	You get it's a pun.
1802020	1807020	No, I'm talking about the Donkey Kong 64 100% speedrun.
1807020	1808600	Yeah.
1808600	1810860	Well, technically, it's the 101% speedrun
1810860	1812900	because Rareware were pretty good
1812900	1815100	at ironically recognizing that they'd put
1815100	1817340	way too many collectibles in their goddamn game.
1817340	1819420	To achieve 101% completion,
1819420	1821560	players must collect the Nintendo coin,
1821560	1823640	the Rareware coin, all eight keys,
1823640	1825960	all ten battle crowns, all 20 fairies,
1825960	1828420	all 201 golden bananas,
1828420	1830260	and all 40 banana medals,
1830260	1831880	each of which is awarded for collecting
1831880	1834520	75 of a Kong's bananas in a level
1834520	1838640	for a total of 3,000 bananas.
1838640	1841220	Hey, but sometimes they come in little bunches of five.
1841220	1842340	Thanks, Donkey Kong.
1842340	1844420	The rules list for this run on speedrun.com
1844420	1846240	actually includes the stipulation
1846240	1848240	that to submit runs for this category,
1848240	1849820	you must hate yourself.
1849820	1853420	Runners in this category endure such supreme torments
1853420	1855080	that one of them fucking streamed themselves
1855080	1857460	breaking their cartridge to make sure it was over.
1857460	1859000	This is my DK cart.
1859000	1860660	Fun fact.
1860660	1862240	Did you know that the PAL version
1862240	1864620	of the Donkey Kong 64 cartridge was gray,
1864620	1867320	but the US retail version was banana yellow?
1867320	1869860	Heh, you learn something new every day.
1869860	1871820	This run is challenging in far more ways
1871820	1872960	than the traditional run.
1873000	1875000	In that run, your objective is fairly simple.
1875000	1876540	Find the fastest way to the end,
1876540	1877620	whatever that way may be,
1877620	1879200	abusing cutscene glitches,
1879200	1880920	level skips, moon jumps, et cetera,
1880920	1882120	effectively ending up with runs
1882120	1883860	where you do as little as possible.
1883860	1886460	This run's core is having to actually do
1886460	1888120	everything the game asks of you,
1888120	1889920	planning the most efficient route possible
1889920	1890960	through all of it,
1890960	1893160	and then somehow actually doing it all
1893160	1894660	precisely and quickly,
1894660	1896860	but with hundreds of golden bananas to collect,
1896860	1899080	and some of these can be very challenging,
1899080	1901500	and thousands of bananas!
1901500	1904000	Executing on all of this in succession
1904000	1907040	introduces a new kind of test for these runners,
1907040	1908200	resilience.
1908200	1910460	Paradoxically, as with the Beast Blood pellet,
1910460	1912040	when quicker strategies are found,
1912040	1914280	often that makes the game easier to beat
1914280	1916040	because the length of time you have to focus
1916040	1917860	on execution has gotten shorter.
1917860	1920320	You only have to pull off 30 minutes of good stuff
1920320	1922580	to beat the Any% run in 30 minutes.
1922580	1925500	If something takes around five hours to beat,
1925500	1928460	that's five hours of time to make mistakes in.
1928460	1931580	Five hours to get tired or lose focus
1931580	1934380	or slip from your intended most efficient path.
1934380	1937200	These runs are essentially torture,
1937200	1938960	and they're amazing.
1938960	1942280	There's a three-year-old run by German runner 360 Chris M.
1942280	1946040	that took 19 hours and 53 minutes.
1946040	1949820	The best part of this run is it has face cam.
1949820	1954160	You can watch in real time as the sun sets and rises,
1954160	1956780	and he gets ever closer to making it to the end.
1956780	1958240	He no-sells it, too.
1958280	1960780	Like, by the end, he still doesn't seem that tired.
1960780	1961900	It's kind of awesome.
1961900	1963100	Despite there being plenty of runs
1963100	1964940	that are way, way more optimized,
1964940	1967440	the better runs push the five-and-a-half-hours mark,
1967440	1969780	there's something very special about runs like this one
1969780	1971360	where they probably know their planned route
1971360	1973020	is gonna take them a full day,
1973020	1975280	but they sit down and do it.
1975280	1978780	I kind of love runs like this just for their sheer dedication
1978780	1980940	regardless of how efficient they are.
1980940	1983480	Yeah!
1983480	1984940	Whoo!
1984940	1986440	Sub 20, boys!
1986480	1988640	PB, boys. I PB'd by, uh,
1988640	1990340	four hours and six minutes.
1990340	1991340	Pretty solid.
1991340	1993560	Wait, his last attempt took nearly 25 hou—
1993560	1994480	Holy shi—
1994480	1996260	The various runs of this game have led players
1996260	1998940	to look very closely at almost every aspect,
1998940	2001020	even going so far as using hacking software
2001020	2002940	to analyze the code in detail,
2002940	2004680	looking for anything that can be exploited
2004680	2005860	to make runs faster.
2005860	2008680	DK64 has been investigated in a level of detail
2008680	2010980	greater than the developers could have ever intended
2010980	2013300	or expected, and that's led to new discoveries
2014160	2016420	but also to something really cool.
2016420	2017840	Enter Isotarge.
2017840	2020220	Isotarge is a runner with a really respectable time
2020220	2021380	in the any% category,
2021380	2023260	but it's also the longest-standing run
2023260	2024720	in the top ten by far.
2024720	2027460	In fact, it was the world record for six months back in 2015.
2027460	2029800	Isotarge has made a lot of contributions to the community,
2029800	2031960	including spending a lot of time digging around
2031960	2034080	inside the game's code, finding new glitches
2034080	2035960	and holes in world geometry and so on,
2035960	2038220	anything that could be exploited to get better runs.
2038220	2040080	Isotarge has found a lot of cool stuff in the game,
2040080	2042460	including this image of a Rareware employee's face
2042460	2043960	hidden inside the game's files,
2043960	2046780	which looks like it's been edited in a Game Boy Camera,
2046780	2048780	but they've also found stuff like this.
2048780	2050460	Out-of-bounds collectibles.
2050460	2052700	It's common for developers to leave items and objects
2052700	2054960	in places players can't get to in the game proper
2054960	2056500	and not worry about removing them,
2056500	2059080	like this coin hidden in a wall in Mario 64
2059080	2060960	that someone actually figured out how to get,
2060960	2062960	and since these items exist well outside
2062960	2064240	the intended scope of the game,
