start	end	text
0	11420	By now you probably know what a speedrun is already.
11420	14340	It's where players commit to beating a game as fast as possible.
14340	16340	On the surface, it's a bit silly.
16340	20060	People sitting down with one game, playing it over and over,
20060	23300	dedicating immense time and effort to learning its ins and outs
23300	27260	and learning skills that probably aren't all that helpful anywhere else.
27260	31040	And yet, somehow, the experience of taking part in
31040	33800	or even watching someone try to speedrun a game
33800	37300	is exhilarating and amazing and just fun,
37300	40640	and speedruns of some games frequently get millions of views.
40640	43060	This clearly matters to a lot of people,
43060	44800	so there's probably a reason why,
44800	48100	and I was having trouble scratching out the reasons why,
48100	52400	so I arrived at the obvious solution of writing a YouTube video about it.
52400	54240	Speedrunning is really fun to watch,
54240	56940	and stories about speedrunning are consistently fascinating,
56960	59420	and I really want to talk about why,
59420	61800	and no one's managed to stop me so far.
61800	65340	["Souls"]
65340	69060	It's generally accepted that the Souls series is pretty difficult,
69060	70940	and they are, at least for beginners,
70940	75020	because the games are generally not great at teaching you how to really grasp playing them.
75020	76940	I've heard there's already a video out there somewhere
76940	79940	that drones on and on for way too long trying to explain this,
79940	81020	so we'll ignore that here.
81020	84240	This difficulty is the prime reason why speedruns of games in this series
84240	85820	are so entertaining to watch.
85840	87500	Owing to the games' inaccessibility
87500	90800	and the time investment required to get good, as it were,
90800	93680	watching someone blast through them is just plain fun.
93680	96600	What's interesting in a more in-depth way about speedruns, though,
96600	98680	is seeing how they develop over time,
98680	101440	and Dark Souls is a perfect example of why.
101440	102860	Part 1.
102860	104600	Development.
104600	107280	The earliest speedrun on record at speedruns.com,
107280	109660	a fantastic resource, by the way, for Dark Souls,
109660	111400	is by Japanese runner Twilight.
111400	114900	In 2011, a lot less was known about how Dark Souls really ticked,
114900	116740	and there was yet to be much of a community
116740	119940	to help pick away at all the possible fastest approaches to the game,
119940	123240	so Twilight's run consists largely of combining general tricks
123240	126780	that were widely known early on for making the game easier or faster.
126780	130060	For example, in Dark Souls, there are multiple different starting classes
130060	132400	with their own stats, starting items, and abilities.
132400	134560	While some do have unique advantages,
134560	137900	the Pyromancer starts with the ability to throw fireballs,
137900	140480	something none of the others can access for quite a while,
140480	143100	so it's usually the one recommended to new players
143100	144880	because if they're having trouble fighting,
144880	146840	they can throw fire on people.
146840	149300	I mean, come on. So Twilight picks them.
149300	151800	It's not really a surprise. It's kind of the obvious choice
151800	153640	if you were to think about how to speedrun this game
153640	155020	if you played it a few times.
155020	157020	The next big choice is the starting gift.
157020	159260	Players can choose something extra to start the game with
159260	160880	from a list at character creation.
160880	163980	Normally in Dark Souls, early on to continue deeper into the game,
163980	166220	players have to go through a fairly tough area,
166220	169420	fight a difficult boss to get a key to another difficult area,
169420	171420	then fight another boss there to progress through
171460	173660	to another difficult area called Blighttown,
173660	175080	which leads down to another boss,
175080	176580	which is guarding a bell you need to ring
176580	177780	to progress the game,
177780	180280	but for, uh, reasons,
180280	182500	the developers made one of the starting items
182500	184200	players can choose from a key
184200	186240	that unlocks a gate in the starting area,
186240	188160	which skips past two of those bosses
188160	190620	right into the lower part of Blighttown,
190620	192880	so it's pretty clear what item a speedrunner
192880	194280	would want to start with here.
194280	196880	It's just the most obviously fast and helpful choice.
196880	198200	I mean, look at the other ones.
198200	200380	Binoculars, a rubbish ring,
200380	202740	a n-n-a more rubbish ring,
202740	205280	pendant, trinket, no effect,
205280	206780	black firebombs?
206780	208780	What a garbage option.
208780	210700	Why would anyone ever pick that?
210700	212120	I don't know. I guess they're pretty good.
212120	215500	I mean, they're more deadly than STD bomb.
215500	217920	What? Another initially obvious trick for speedrunning
217920	219960	involves this drake that turns up early on
219960	221120	and hangs out up here.
221120	222540	Getting a decent weapon in this game
222540	223780	usually takes some time,
223780	225740	but once you get to this big scary boy,
225740	228160	one recommended way for new players to get an advantage
228160	230740	so they don't have too hard a time starting out
230740	233240	is to sit in a safe place and spam arrows at its tail
233240	235480	until it breaks off, giving you this sword.
235480	237940	The drake sword deals a ridiculous amount of damage
237940	239820	for the place in the game where you can get it.
239820	242200	It drops off in its usefulness quite quickly,
242200	243240	but for early players,
243240	245120	it's just a fantastic weapon to pick up,
245120	246860	but instead of wasting time and arrows,
246860	248280	of which they had neither,
248280	250360	Twilight simply dodged behind it
250360	252440	when it jumped down and cut its tail off
252440	253980	and then ran to the next area.
253980	256160	This is one of the most cathartic things
256160	257520	you can see in a speedrun.
257600	260060	You know, you spend a bunch of time dying to its fire
260060	261220	or getting kicked to death,
261220	264020	and then you see someone else just steal its tail
264020	265380	and run away with it
265380	267380	and proceed to beat people to death with it
267380	268680	for the rest of the game.
268680	269520	It's great.
269520	270680	A lot of Twilight's early run
270680	273100	consists of playing the game the way one normally would,
273100	275840	but just doing more running and ignoring enemies.
275840	279060	Early runs like this play the game basically as normal,
279060	280720	but very quickly and precisely
280720	283480	doing the most obviously easy and fast moves.
283480	285300	Twilight burns all the remaining bosses
285300	286600	with their hot, hot hands
286600	287800	and grabs enough humanity
287800	289800	that they can feed it to the Daughter of Chaos
289800	292800	and open a shortcut past all the major fire-based bosses,
292800	295060	which obviously would take a long time to fight
295060	296880	when all your weapons are fire.
296880	300560	Have you ever tried actually fighting fire with fire?
300560	301840	I'm on a watch list now.
301840	304500	After a lot of running past things and killing bosses,
304500	305960	they gather the four Lord Souls
305960	307420	required to open the big door
307420	309140	to the remnants of Great Uncle Gwynn's
309140	311000	mega weekend barbecue and kill him
311000	313460	so someone can finally call the fire department,
313460	317280	and they do it in an hour and 26 minutes in in-game time.
317280	321160	This is an ungodly fast speed to finish Dark Souls,
321160	323500	but there was a lot of improvement to make.
323500	325340	What I think is interesting about the early runs
325340	327540	through the game is that they weren't just improving
327540	329500	on execution of the same route
329500	331660	or finding slightly more improved paths,
331660	334500	but the nature of the entire route from the very start
334500	335920	was still up for debate.
335920	337280	Nothing was set in stone,
337280	340160	even what type of character you chose to play as,
340160	342620	and it wasn't clear what the fastest way would really be,
342660	344740	and that's a really fun experimental period
344740	346240	in the development of a speed run.
346240	348200	This is where Dark Souls runs excel
348200	349820	in the spectatorship aspect.
349820	352400	In lots of other games, you don't have as much choice
352400	355280	or freedom in where to go or what sort of character to play
355280	356700	or what weapon to use.
356700	359120	There are so many other paths or decisions
359120	360940	that could have been made in a Souls game
360940	364020	that the next run threatens to be completely different,
364020	365660	and, well, it was.
365660	367940	The next world record was set three months later
367940	370620	and has gone on to be the longest standing world record,
370660	372660	lasting 13 months.
372660	375240	It was set by another Japanese runner, Keita.
375240	376480	I hope I'm pronouncing that properly.
376480	379740	Ke, and then it's a neon gate, so Keita.
379740	380620	KEITA.
380620	382280	All right, what's really fun about this run
382280	385120	was it diverged from Twilight's path immediately.
385120	387540	Not only do they start the game with a different class
387540	388660	right out of the gate,
388660	390400	but once they make it to Firelink Shrine
390400	392580	and you assume their run is gonna be similar looking
392580	393740	but with slight improvements,
393740	397280	they get up and immediately head in the opposite direction.
397280	398040	KEITA.
398040	400580	Goes to parts of the game Twilight never even sees
400580	401420	in their run.
401420	403000	Firstly, they go to the Valley of Drakes,
403000	404280	dodge between the drakes,
404280	405820	and grab the Red Tearstone Ring,
405820	407420	which boosts the player's damage output
407420	410580	by roughly 66% when they're below 20% health.
410580	411960	By playing more riskily,
411960	414240	KEITA becomes much more dangerous.
414240	416540	This is the kind of improvement I love seeing in speedruns,
416540	418660	learning to abuse a risk-reward mechanic
418660	421620	to just get the rewards by simply playing really well.
421620	423540	In a speedrun, a risk-reward item
423540	426660	can very frequently become a reward.
426660	428240	Then they run into Darkroot Basin
428240	429860	and encounter the Black Knight there.
429860	432180	Now, Black Knights are tough enemies in the early game.
432180	433320	They don't take much damage
433320	435320	even when you riposte or backstab them.
435320	436780	You can see this is gonna take quite a-
436780	438100	Oh, he's pushed him off the cliff.
438100	440400	Is rewarded with the Black Knight Halberd.
440400	442240	You only get this weapon for killing the knight
442240	444060	like 20% of the time,
444060	446140	and these knights don't respawn.
446140	448780	This halberd forms the basis of KEITA's strategy,
448780	450560	so if they don't get the halberd here,
450560	452480	they would have to start the run again.
452480	454640	There are definitely countless runs
454640	457240	on the cutting room floor that ended here just because.
457240	459240	You can slightly increase the chance of it dropping
459240	461160	if you have more humanity on you,
461160	463020	but it's still like a crapshoot.
463020	464900	Now, there's a reason the last thing you fight
464900	467940	before the final boss is a Black Knight with a halberd.
467940	469480	Gwyn knew what was up.
469480	472900	This weapon absolutely mashes most enemies and bosses.
472900	475320	Then they just keep going and run all the way around
475320	477740	to the Darkroot Basin entrance to the Undead Parish,
477740	479700	skipping several areas completely.
479700	482280	After beating the gargoyles with a regular old axe,
482280	483520	they use the souls they've gained
483520	485820	to level up enough to equip the halberd,
485820	488820	which they can now just about wield if they two-hand it.
488860	490860	Cairta had precisely figured out
490860	493140	the most efficient way to get the souls they needed
493140	495180	to use this weapon as early as possible.
495180	497360	This means they're able to utterly destroy
497360	500180	the fire bosses that Twilight had to skip completely
500180	501440	because of their weapons.
501440	504820	It's literally faster for Cairta to run through all this
504820	506640	and kill all these bosses
506640	508520	than it is to gather the materials
508520	510280	required to just skip them.
510280	513680	Overall, Cairta saved 15 entire minutes over Twilight
513680	515900	while killing more bosses.
515900	518060	Most of the current record holders in Dark Souls
518060	519880	use this basic strategy now,
519880	521340	but they've saved even more time
521340	523380	by discovering new holes in the game to exploit,
523380	525180	like by messing with the camera system
525180	527520	enough to go out of bounds and enter Sen's Fortress early.
527520	529180	They've improved the strategy so much
529180	531720	that they don't even use the Master Key anymore.
531720	534600	Instead, they use black fire bombs to...
534600	536020	Oh, no.
536020	537800	Black fire bombs?
537800	541720	What a garbage option.
541720	547020	Why would anyone ever pick that?
547800	551140	I just shouldn't be allowed to talk about Dark Souls anymore.
551140	553020	Someone should just fucking come and stop me
553020	556440	before I make him another fucking idiot of myself.
556440	559100	Could someone ever please stop me talking about Dark Sou-
559100	561860	♪♪
561860	563320	-♪♪
563320	565900	This just goes to show how much a run can develop.
565900	568480	The once really obvious main choices
568480	571060	of Pyromancer, Master Key, and Drake Sword
571060	573260	have all, in turn, been superseded.
573260	575260	The creation and development of new runs through games
575340	577340	is really, really fun to watch,
577340	579960	but in a way that's hard to describe.
579960	583540	It's a kind of logistical fun.
583540	584800	Is that a kind of fun?
584800	587380	That doesn't sound like a kind of fun.
587380	591180	It reminds me of the feeling I got when I had my GPS out,
591180	593380	and it told me to take a route through a park
593380	594680	that I knew really well, and I was like,
594680	596600	nah, I can go through that faster,
596600	600020	and I walked a different route, and I got through it faster.
600020	601260	It just felt amazing.
601260	603760	It's a bit like the feeling I got
603760	606380	when I decided I was gonna do my taxes eight months early.
606380	608380	Have you ever done your taxes early?
608380	611420	♪♪
611420	613180	Speedrunning is for you.
613180	614800	♪♪
614800	616680	W-welcome, friend!
616680	619100	♪♪
619100	620960	Wha-?
620960	624680	I have a script for this bit, but I forgot all the words.
624680	627840	Part two, categorization and arbitrarin-
627840	630600	No one I showed this script suggested better titles,
630600	632560	so I'm just gonna have to go with these ones.
632560	635140	Now, I have to admit, I've so far deliberately
635140	637560	not mentioned something about the Dark Souls run.
637560	639680	The progression I described is actually only one
639680	642520	of several different categories of run through the game,
642520	645020	one known as any% no wrong warp.
645020	647060	Like I said before, most of the normal run
647060	649060	is spent killing all the major bosses
649060	651560	to get the Lord Souls to unlock the big door,
651560	653520	which is why it was kind of a big deal
653520	656480	when players figured out a way to teleport right here
656480	659760	on the other side of the door without having to open it.
659760	661600	The game's DLC added an arena
661600	663480	where players could fight each other online.
663480	665300	Swang into tomorrow!
665300	666600	After beating Artorias,
666600	668480	who incidentally was my favorite boss fight
668480	670940	in the series until Bloodborne's DLC came out,
670940	674640	you gain access to the Battle of Stoicism gazebo,
674640	677020	which presumably sounds better in Japanese.
677020	680020	When they join the arena through the gazebo,
680020	682100	players receive a purple coward's crystal,
682100	683400	which they can use to quit a fight
683400	685020	and teleport back to the entrance.
685020	687180	It does this by telling the game to move you
687180	689140	to a certain map and position,
689140	691360	the map being the main DLC area,
691360	693700	and the position being the entrance to the arena.
693700	695120	Now, there are other items in the game
695120	696200	which work similarly,
696200	698440	like the Homeward Bonio or the Dark Sign.
698440	700160	They tell the game to take you to the map
700160	701980	where you last rested at a bonfire
701980	703860	and the position of that bonfire.
703860	706200	So let's say you last rested at the bonfire
706200	707400	in front of the big door.
707400	709160	Barring specific circumstances,
709160	711520	using one of these two items will take you back here.
711520	714400	Now, you can't normally use the purple coward's crystal
714400	716360	outside of the arena. It's grayed out.
716360	717900	Trying to use it makes your character
717900	720060	have a panic attack and think about all the times
720060	722020	they said, you too, when a waiter told them
722020	723940	to enjoy their food, but there's a glitch
723940	725560	that allows players to use items
725560	727060	even when they're not intended to
727060	728720	by trying to use it,
728720	730260	switching to an item they can use,
730260	731260	like the Estus flask,
731260	733360	while holding down the Use button still,
733360	735680	running off an edge while toggling weapons,
735680	738560	and pressing the Use button again on an exact frame,
738560	741860	causing the player to drink the item along with the flask,
741860	745180	which uses it even if you're not supposed to be able to.
745180	746440	What a handy item.
746440	749060	You can visit the gazebo whenever you like.
749060	750220	But here's the thing.
750220	751760	Using the crystal in the main game
751760	754480	has a fancy long animation where you can't do anything
754480	756360	as the game fades to a loading screen,
756360	757860	but when you use it this way,
757860	761060	you can still walk around and use items before it fades,
761060	764360	so what if we used another item that teleports us
764360	766820	while this other effect was going off?
766820	768940	Well, to put it simply,
768940	771260	the game gets confused.
771260	774400	It tries to load you to the map of the last used bonfire,
774400	776900	which in our case is the bonfire before the big door,
776900	779120	which we cleverly napped at before coming here,
779120	781740	but the position of the arena entrance.
781740	783740	The arena entrance the game is looking for
783740	785580	doesn't exist in this map, though,
785580	787900	so instead it takes you to the pre-programmed
787900	789700	default position in the level,
789700	792660	and it turns out that the default position for this area
792660	795040	is inside the Kiln of the First Flame,
795040	798820	so now all players need to do to beat the game
798820	802580	is gain access to this bonfire and the DLC battle arenas,
802580	805620	and then they can warp directly to the last area.
805620	806880	Oh, and also they have to perform
806880	808760	an absurdly precise set of inputs
808760	810960	with barely even a frame of lenience.
810960	813620	Seriously, it's really hard getting this footage alone.
813620	815260	Took me, like, 25 minutes,
815260	817180	but if you can execute this consistently,
817180	819540	which speedrunners are really good at learning to do,
819540	821800	this method saves a lot of time.
821800	824080	However, it was decided by the community
824080	826420	to be so different from the other runs,
826420	828120	since you have to both own the DLC
828120	829920	and abuse a pretty major glitch,
829920	832620	that all runs prior to the discovery of this glitch
832620	834760	and after the discovery but which don't use it
834760	837060	should be split off into their own separate category.
837060	839260	At this point, the Dark Souls speedrun community
839260	842060	has split the game into at least 14 different categories
842060	843900	ranging from extra difficult challenges
843900	845300	such as killing all the bosses
845300	847760	or completing the entire game without leveling up
847760	850140	to absurdist challenges like completing the game
850140	852800	after collecting one of every ring item in the game.
852800	854760	The Lord of the Rings run.
854760	855760	That's a clever name.
855760	857400	This kind of separation of a run
857400	860180	into distinct categories also happened in Bloodborne.
860180	861640	When the game was initially released,
861640	863100	a glitch in some of the architecture
863100	864180	for the game was discovered,
864180	866020	resulting in the player being able to leap off
866020	867600	at an angle from a coffin
867600	869480	and get onto a raised section of wall,
869480	871480	then do an attack at another part of a wall
871480	872480	to clip through,
872480	874320	skipping a whole bunch of the game.
874320	876060	For example, the fight with Ghasgwagni
876060	877680	and leading to the creation of a route
877680	879400	which, supplemented by other tricks,
879400	881900	would eventually only take about 20 minutes,
881900	883480	which is utterly absurd.
883480	885780	However, Bloodborne was pretty heavily patched
885780	888180	after release, making lots of changes and fixes
888180	890400	including that error in the architecture
890400	892900	and also, incidentally, much better load times.
892940	894660	This makes this run impossible to do
894660	896700	on a properly patched version of the game.
896700	898320	It also means the version of the game
898320	900780	you would play today on an online PS4
900780	903320	would be unable to do the fastest speedruns,
903320	905660	which puts you at a pretty major disadvantage.
905660	908400	The solution was for new categories to be created,
908400	910320	so runners could run the original version
910320	911540	of the game if they wanted,
911540	914160	but runners could also compete using the current patch.
914160	916280	The current fastest patched run of the game
916280	917700	is slower by eight minutes,
917700	920160	although, incidentally, because of the massive fixes
920160	922500	to load times, despite the in-game timer
922560	924560	telling you it's almost eight minutes slower,
924560	927680	it's a minute faster to watch in real time.
927680	930020	Bloodborne was messed up when it came out, wasn't it?
930020	931560	Bloodborne's a really interesting game
931560	933640	to run as well in general for a lot of reasons,
933640	935400	one of them being the beast blood pellet,
935400	937120	which adds a meter filled by dealing
937120	939160	certain types of damage, and the higher the meter,
939160	941860	the more damage the player both deals and receives.
941860	944000	It's a bit risk-reward in normal play,
944000	945620	but it's a godsend for speedrunners,
945620	947660	and in some ways, it makes the game easier
947660	951040	for speedrunners by specifically rewarding fast play.
951040	953420	The diverging any% categories in these games
953420	956120	raises interesting questions about the hobby.
956120	958620	In games with multiple categories,
958620	961000	which one is the real speedrun?
961000	964060	Why are some glitches and tricks permitted and others not?
964060	967140	Shouldn't the goal be to create the fastest singular run
967140	969480	and agree on one standard set of rules
969480	971560	for what the speedrun should be?
971560	974280	And how does one decide when something is allowed
974280	977280	and when something should be a separate category or banned?
977320	981060	Well, it depends on both the game and its community.
981060	982860	A game that's impacted by these questions
982860	984900	in a big way is Mirror's Edge.
987400	989480	Mirror's Edge is a game very close to my heart,
989480	991540	to the point that I've speedrun it before as well.
991540	994280	If I'd bothered to submit the run to speedruns.com,
994280	999340	I'd officially be in 201st place.
999340	1001260	The thing about Mirror's Edge is it's a game
1001260	1002840	about moving very quickly.
1002840	1004460	The player character is very mobile,
1004460	1006640	has a diverse set of moves across surfaces,
1006660	1008460	and for picking up speed, and different ways
1008460	1010740	of jumping onto, off of, and across things.
1010740	1012840	There are also a lot of little ways the mechanics
1012840	1015080	can be manipulated to go even faster.
1015080	1016840	This makes it an ideal speed game.
1016840	1019380	This runner just executed a trick so quickly
1019380	1021420	at the beginning that you probably didn't even see it.
1021420	1024000	Right as they loaded in, they turned to the side
1024000	1026260	and did a side hop, which immediately gets them
1026260	1027340	up to top speed.
1027340	1028800	This is one of my favorite tricks right here.
1028800	1031300	Normally, this pole, like, you have to slowly
1031300	1033440	do a balancing act as you walk across it.
1033860	1035860	You're taking your sweet old time.
1035860	1038080	Runners have reached the point where they leap onto it
1038080	1039540	in a straight line and don't fall off,
1039540	1041120	and then turn and do another jump off of it,
1041120	1043040	so they never have to do it. It's incredible.
1043040	1044920	Playing Mirror's Edge as fast as you can,
1044920	1046920	and then going online and checking out a speedrun
