start	end	text
2064240	2066660	runs don't usually consider them collectibles
2066660	2067580	as part of a run.
2067580	2069040	They're more cool oddities
2069040	2071160	that shouldn't really be considered as game objects
2071160	2072200	to be collected.
2072200	2074980	But what if an item was absolutely collectible
2074980	2076280	without any glitches,
2076280	2078160	but no one had found it before?
2078160	2079820	One day when messing around in the game's code
2079820	2081940	looking for flags for collectible objects,
2081940	2083360	Isotarge found a banana coin
2083360	2086620	that hadn't been accounted for in the level Fungi Forest.
2086620	2089580	Banana coins in DK64 are used to buy items and upgrades,
2089580	2092120	and because this is Donkey Kong 64,
2092120	2094740	there are six different kinds of banana coin.
2094740	2096160	There's one color for each character,
2096160	2097540	but also a multicolored one,
2097540	2098940	which is usually hard to find
2098940	2100980	and gives five coins to every character
2101020	2102180	as soon as it's collected.
2102180	2103980	There's only 15 of them in the game,
2103980	2105860	one in each level except Angry Aztec,
2105860	2109140	which has two, and seven in the hub world of DK Isles.
2109140	2111260	This new coin wasn't any of the ones
2111260	2112940	that had been collected before,
2112940	2114680	but unlike the other items,
2114680	2116720	this one wasn't out of bounds.
2116720	2119640	It was hidden in a place no one had ever thought to check,
2119640	2121940	hidden in the tall grass in the level,
2121940	2124140	right about hee- no, wait, sorry,
2124140	2125860	right about...
2125860	2127680	here.
2127680	2128940	And there it is.
2128940	2130220	As far as I can tell,
2130220	2133340	this coin isn't mentioned anywhere on the Internet
2133340	2136340	prior to its discovery by Isotarge in the game's code,
2136340	2137640	and it's not in any strategy guide
2137640	2139840	from the time period I can get my hands on.
2139840	2141760	It's not really known whether the developers
2141760	2143140	put this coin here intentionally,
2143140	2144720	or forgot to remove it,
2144720	2147880	or why they thought to give so little indication it was there.
2147880	2150180	It's easy to see why it was missed for so long.
2150180	2151680	Now, a cool kicker to this story
2151680	2154800	would be that it invalidated all the 101% runs,
2154800	2156880	or it turned out that there are now technically
2156880	2158760	102% runs or something,
2158760	2161420	but banana coins aren't counted for percentages
2161420	2162500	on the game's menu screen,
2162500	2164340	and the total amount of coins you can get
2164340	2166000	isn't even listed in the game anywhere.
2166000	2168960	The 101% run doesn't even include all of the bananas
2168960	2171000	because the game only counts banana medals
2171000	2172760	towards completion, so they don't even get
2172760	2176420	all the bananas in the runs where you get 101% completion,
2176420	2178580	which is a bit of a disappointment, really.
2178580	2180500	You should get them all next time.
2180500	2182040	To amuse me.
2182040	2184040	Here's the SGDQ run in 2017,
2184040	2185420	soon after the coin was discovered,
2185420	2188080	where they just stopped to get it for kicks.
2188100	2190580	Lo and behold, it is...
2190580	2193120	the Rainbow Coin!
2193120	2194360	Yeah.
2194360	2197080	Uh, that Rainbow Coin has been hidden
2197080	2198860	basically since the game came out,
2198860	2201660	so, uh, over 16 years, right?
2201660	2203660	It's not technically a major discovery,
2203660	2205580	and it changes nothing about how the game is run
2205580	2206620	in the main categories,
2206620	2207920	outside of what are essentially
2207920	2210580	ultra-masochistic jokes that people only really do
2210580	2213080	just to be one of the two people who ever did it at all,
2213080	2215580	but it's still a really, really cool discovery.
2215580	2218420	Something was hidden just out of plain sight,
2218420	2220580	even to the people who would make a point
2220580	2222580	of collecting everything in the game
2222580	2224580	for 17 years.
2224580	2226080	What's fun about the Banana Coin
2226080	2227920	is that it's kind of an abstract example
2227920	2229920	of how awesome speedrunning communities are
2229920	2232080	for deconstructing and examining games.
2232080	2234080	Like, people are so dedicated
2234080	2236080	to coming to an understanding of a game,
2236080	2238080	they're uncovering things which probably would've remained
2238080	2239580	hidden forever otherwise.
2239580	2242080	And that's just neat, no matter how you peel it.
2242080	2243580	Oh, God, did I just say...
2243580	2245580	Why is speedrunning awesome?
2245580	2247580	Because people are awesome.
2247580	2249580	Because watching someone try something
2249580	2251580	over and over again, getting better and better,
2251580	2253580	and learning new secrets and strategies
2253580	2255580	in order to be the best at something,
2255580	2257080	sometimes for years,
2257080	2260080	is compelling and fascinating and human
2260080	2262580	in a way that no other form of media,
2262580	2265580	no television show could ever adequately replicate,
2265580	2268080	because a real human person
2268080	2270080	is sitting right there and doing it.
2270080	2272080	I opened this video using clips
2272080	2274580	from an attempt to finish Zelda Ocarina of Time
2274580	2277580	in the Any% category by skater82297.
2277580	2280580	This video in particular is one of my favorites.
2280580	2283080	This guy's been hammering away at Zelda Ocarina of Time
2283080	2284580	since at least 2014,
2284580	2286580	shaving seconds, fractions of seconds,
2286580	2288080	off of his personal best.
2288080	2289580	Here's a cool trick. On speedrun.com,
2289580	2292080	you can actually click to see all of the obsoleted runs,
2292080	2295580	runs that a runner has themselves gone on to supersede.
2295580	2297580	If you turn that on,
2297580	2301580	this guy basically is the top 20 fastest runs of Zelda
2301580	2303080	of all time.
2303080	2304580	But he didn't have number one.
2304580	2306080	Someone else was faster than him.
2306080	2308080	So he just kept going and going.
2308080	2309580	And you can see all of his runs.
2309580	2311080	And live on his channel,
2311080	2314080	you could have seen all of the many, many attempts
2314080	2316580	that went into even getting those runs.
2316580	2318580	And in this run, you see him get annoyed
2318580	2320080	by the tiniest things.
2320080	2323080	Goma doesn't activate for about a second longer
2323080	2324580	than he thinks it should,
2324580	2326580	and it just frustrates the hell out of him.
2328080	2329580	Dude.
2329580	2330580	Fuck you!
2330580	2331580	Fuck you!
2331580	2333080	Fuck you! Fuck you!
2333080	2334080	Fuck you.
2334080	2335580	No. Fucking shit, dude.
2335580	2337080	Fuck off.
2337080	2338580	I'm mad. Now fuck off.
2338580	2341080	He's angry about this boss not spawning fast enough,
2341080	2343580	even though he can kill it in seconds flat.
2343580	2345080	That was bullshit, dude.
2345080	2346080	That was utter shit.
2346080	2347580	That was bullshit.
2347580	2350580	A random onlooker would wonder why someone did this to themselves,
2350580	2352080	did something over and over,
2352080	2354080	even though it clearly wasn't any fun for them.
2354080	2358080	But then, they get deeper and deeper into the run.
2358580	2362580	And they start to realize that this might be the one.
2362580	2365080	The tone changes.
2365080	2367080	Things get quiet.
2369580	2372080	This might be happening.
2372080	2374080	Is it happening?
2376580	2380080	Oh, my God. Oh, my God.
2380080	2381080	Oh, my God.
2381080	2384080	Towards the end, he can barely even control his breathing.
2385080	2387080	He's panicking. He's anxious.
2387080	2390080	But he knows that if he can just execute on the ideas
2390080	2392080	that he's been developing for years,
2392080	2394080	this might be it.
2395080	2396580	Oh, my God, dude!
2396580	2399080	Oh, my fucking God!
2399080	2401080	Oh!
2401080	2404080	Okay. Okay.
2407080	2408080	Yes, dude!
2408080	2410080	Fucking yes!
2410080	2411080	Yes!
2411080	2413080	Oh, my God!
2413080	2415080	Yes!
2415080	2416080	Yes!
2416080	2418080	Yes, dude!
2418080	2420080	Oh, my God!
2420080	2422080	Yes!
2422080	2424080	Oh, my God!
2424080	2426080	Oh, my God, dude!
2426080	2430080	This run is currently the fastest run anyone has ever done
2430080	2432080	of The Legend of Zelda Ocarina of Time.
2432080	2434080	And then, in that moment,
2434080	2438080	in that period of being utterly overjoyed at this achievement,
2438080	2440080	it becomes clear why people do this.
2440080	2443080	And what you can get from this that you can't get anywhere else.
2443080	2445080	It's a story.
2445080	2447080	Not something written or directed by someone.
2447080	2450080	A real human story.
2450080	2453080	It's a story of perseverance and triumph.
2453080	2457080	And it's derived from something so small and silly-seeming,
2457080	2460080	but that only makes it more beautiful in a way.
2460080	2464080	And the best part is, the story's not over.
2464080	2468080	There's almost always more to learn about how to run any given game.
2468080	2471080	Always someone trying to beat the record.
2471080	2473080	And anyone can be a part of that.
2473080	2477080	Or, at the very least, anyone can be there to watch it happen.
2477080	2480080	This is probably why so many people tune in to events like GDQ
2480080	2483080	and even donate money to support work that helps keep people alive
2483080	2486080	so they can spend time with the people they love.
2486080	2488080	Or, you know, watching speedruns.
2488080	2490080	Hmm.
2490080	2492080	Hmm.
2498080	2502080	Okay, I have to admit, I told a bit of a porky pie earlier.
2502080	2504080	That's Cockney rhyming slang for lie,
2504080	2508080	which I clearly know, obvious Cockney, that I am.
2508080	2512080	I never actually beat Donkey Kong 64 as a kid.
2512080	2514080	I played it for 72 hours, and then I couldn't beat
2514080	2516080	the Donkey Kong arcade part near the end,
2516080	2519080	which you need to do to unlock the final boss fight.
2519080	2524080	So I had 72 hours of play and nothing to show for it.
2524080	2527080	And, frankly, that's piss.
2527080	2531080	So to finally put this little fucker to rest,
2531080	2533080	I'm gonna stream it.
2533080	2535080	I'm gonna start the game again,
2535080	2537080	and I'm gonna get absolutely everything in that game,
2537080	2540080	including the rainbow coin just to bring everything full circle,
2540080	2542080	and I'm gonna get absolutely everything, all the bananas,
2542080	2545080	not the minimum required for 101% completion,
2545080	2547080	and I'm not gonna stop until it's done.
2547080	2551080	I might, I will, fall asleep in my chair.
2551080	2553080	I'm not that resilient, although it is currently,
2553080	2556080	no joke, 2.41 a.m.
2556080	2558080	Hope you can see that.
2558080	2560080	So I might do okay, but I should probably rig it up
2560080	2563080	so that if anyone donates, an air horn will go off
2563080	2565080	and wake me up. Let's just torture me
2565080	2567080	for other people's enjoyment.
2567080	2569080	And all the donations will go to charity.
2569080	2572080	So finally some good can come out of Donkey Kong 64,
2572080	2574080	because certainly no fun has come out of it.
2574080	2576080	Anyway, thanks for watching this video.
2576080	2579080	Um, it's really just a love letter to the speedrunning community
2579080	2582080	because I just find it's been such a fulfilling part of my life,
2582080	2584080	and it looks like a lot of other people's.
2584080	2587080	A lot of gaming spaces can be pretty clicky at times,
2587080	2589080	and I think speedrunning has generally avoided that
2589080	2592080	with a lot of sort of close-knit but quite friendly communities.
2592080	2594080	A lot of people were really forthcoming with information
2594080	2596080	when I was doing research for this video,
2596080	2598080	and that was just really awesome, and I just think it's cool
2598080	2601080	how people can share the things they enjoy
2601080	2603080	and learn more about stuff and occasionally raise
2603080	2605080	quite a lot of money for some really good causes.
2605080	2608080	I just think the whole thing is so fun and kind
2608080	2611080	in a way that you don't see very often.
2611080	2613080	So, yeah, just thought it was nice.
2617080	2620080	Probably could have thought of a clever ending to this video,
2620080	2622080	but...
2622080	2624080	Uh...
