start	end	text
1376580	1378580	And they did originally shoot Arwen warrior princess
1378580	1380580	at Helm's Deep, but then they cut that.
1380580	1382580	Also a good choice in my opinion.
1382580	1384580	Because that was what made Eowyn remarkable.
1384580	1386580	She disguised herself as a man because she had to,
1386580	1389580	because women don't do battle in Tolkien's universe.
1396580	1399580	And the screams and the horror of battle take hold.
1400580	1403580	Do you think he would stand and fight?
1404580	1407580	So not only is shoehorning in this unnecessary character
1407580	1409580	doing a disservice to the story,
1409580	1411580	she does not mesh with the fabric of the universe.
1411580	1413580	I do not think you would allow your son
1413580	1415580	to pledge himself to a lowly sylvan elf.
1415580	1417580	I don't know, maybe lowly sylvan elves
1417580	1419580	train their women in the art of war or something.
1419580	1421580	To be clear, my issue with all things Tauriel
1421580	1423580	isn't because it's unfaithful to Tolkien,
1423580	1425580	or because representation is bad.
1425580	1427580	It's because it's a transparent and cynical move
1427580	1429580	on the part of the studio.
1429580	1431580	You create a female character that is completely
1431580	1433580	out of place in her own universe for her to be
1433580	1435580	the center of a love triangle that serves no purpose
1435580	1436580	in this narrative.
1436580	1438580	Not plot-wise, not thematically, nothing.
1438580	1440580	Hell, the only female character that escapes
1440580	1443580	the great love triangle in Ing is Galadriel.
1443580	1444580	And even then...
1444580	1446580	Come with me, my lady.
1446580	1448580	Gandalf, I swear to Christ.
1448580	1451580	In order to take this job, you have to promise me
1451580	1453580	I will not be in a love triangle.
1453580	1455580	I swear to God, this is what I said to them.
1455580	1457580	And they said, we promise you, you won't be
1457580	1458580	in a love triangle.
1458580	1461580	Came back in 2012 for reshoots, and they were like,
1461580	1464580	ah, the studio would really like to see,
1464580	1466580	and I was like, here we go.
1466580	1469580	Yep, the great love triangulation of Tauriel
1469580	1473580	was a reshoot edition, requested by Warner Brothers.
1473580	1475580	And all of this mess was added in reshoots,
1475580	1478580	a year after principal photography had ended.
1478580	1480580	So if this romance feels tacked on,
1480580	1482580	it's because it is.
1482580	1485580	And sure enough, I'm in another love triangle.
1485580	1488580	Tauriel's relationship with Legolas doesn't make sense.
1488580	1490580	Thranduil expects them to get married.
1490580	1492580	He has grown very fond of you.
1492580	1494580	But also kind of hates her.
1494580	1496580	He would allow your son to pledge himself
1496580	1498580	to a lowly sylvan elf.
1498580	1499580	No.
1499580	1500580	She has no reason to fall in love with Kili.
1500580	1502580	There is no reason for these two to care about each other.
1502580	1504580	Like, they couldn't even write in a bit
1504580	1506580	about how he saves her from a spider
1506580	1507580	at the beginning or something,
1507580	1509580	or she saves him from a, I don't know,
1509580	1510580	they had spiders.
1510580	1512580	Studios say we need wombs.
1512580	1514580	But what do you do with women in movie?
1514580	1515580	I don't know.
1515580	1516580	Love triangle when none of the characters
1516580	1518580	even have a reason to like each other, I guess.
1518580	1520580	Aren't you going to search me?
1521580	1523580	I could have anything down my trousers.
1524580	1525580	Or nothing.
1525580	1527580	Oh, the burning passion.
1532580	1534580	So we will probably never know exactly
1534580	1536580	where filmmaker intent ended
1536580	1537580	and studio mandate began.
1537580	1539580	But a lot of the weakest aspects of the films,
1539580	1541580	if not directly demanded by the studio,
1541580	1544580	were at the very least encouraged.
1544580	1546580	But the important lesson here is that
1546580	1548580	all of these additions come at a price.
1548580	1549580	And the price is what should have been
1549580	1551580	the emotional core of these films.
1551580	1552580	Bilbo, his journey,
1552580	1554580	and his growing friendship with the dwarves,
1554580	1556580	particularly Thorin.
1556580	1558580	So speaking of callbacks to Lord of the Rings,
1558580	1560580	Thorin, you notice that he doesn't really
1560580	1561580	look like a dwarf?
1561580	1562580	Gandalf.
1562580	1564580	Thorin looks more like, well,
1564580	1566580	Aragorn than he does Gimli.
1566580	1568580	So both aesthetically and thematically
1568580	1571580	Thorin is something of a callback to Aragorn
1571580	1573580	since Thorin is the king what needs to
1573580	1575580	reclaim his crown in this trilogy.
1575580	1576580	In the pre-production phase,
1576580	1577580	Jackson stated that he wanted the dwarves
1577580	1579580	to be iconically dwarvish.
1579580	1580580	Pete said to us,
1580580	1582580	I want to be more bold.
1582580	1584580	I want the dwarves to look like
1584580	1587580	a race of dwarves from Middle-earth.
1587580	1588580	But...
1588580	1590580	Well, again, I'm not saying he was forced to do it.
1590580	1592580	I'm just saying beards got shorn,
1592580	1593580	Thorin looks like Aragorn,
1593580	1596580	and Gimli, well, he looks like your anime boyfriend.
1596580	1597580	The ones with the most screen time
1597580	1599580	are less cartoonish and dwarvish
1599580	1602580	and more Game of Thrones-y and mainstream.
1602580	1603580	That said,
1603580	1606580	there are elements of Thorin's Aragornification
1606580	1607580	that do work.
1607580	1609580	Thorin's narrative in the book is that
1609580	1610580	he's a very important dwarf
1610580	1612580	who suffers indignity after indignity,
1612580	1613580	and that's funny.
1613580	1614580	This
1616580	1617580	is where he's introduced in the book.
1617580	1619580	And the book even mentions how annoyed he is
1619580	1621580	that very important dwarves such as himself
1621580	1623580	gets relegated to the pile.
1623580	1625580	So I think the filmmakers found a good way
1625580	1626580	to bridge this.
1626580	1627580	Don't put him in the dwarf pile,
1627580	1630580	have the other dwarves hella respect his prowess in battle,
1642580	1644580	and rather than making it a joke
1644580	1645580	that this very important dwarf
1645580	1647580	has to suffer indignity after indignity,
1647580	1649580	have it be more about him regaining his honor
1649580	1651580	by way of reclaiming his heritage.
1651580	1653580	This is a good foundation for a character arc,
1653580	1655580	but his arrogance is also a good basis
1655580	1657580	for building a relationship with Bilbo.
1672580	1674580	And I really like the dynamic they built
1674580	1675580	between Thorin and Bilbo.
1675580	1677580	And so does Ao3, by the way.
1681580	1683580	The problem, as with most problems in this movie,
1683580	1685580	is when the restructuring does a disservice to the story,
1685580	1687580	or when they go so far with a good thing
1687580	1689580	that they don't know when to stop,
1689580	1691580	jumping that shark from compelling
1691580	1693580	to confusing and or boring.
1693580	1694580	As I mentioned in the last video,
1694580	1696580	moving Thorin's change of heart moment with Bilbo
1696580	1698580	to so early in the narrative was a mistake
1699580	1702580	I've never been so wrong in all my life.
1704580	1706580	Because there's no growth between Thorin and Bilbo
1706580	1707580	in movie two.
1707580	1709580	Thorin and Bilbo's relationship and its falling out
1709580	1711580	is the emotional core of movie three.
1711580	1713580	Diluting the movie with all the crap
1713580	1715580	that we don't need and doesn't matter
1715580	1717580	dilutes the emotional core.
1717580	1719580	Another casualty of this is Thorin's death.
1719580	1723580	Hell, Thorin dies before Tauriel's...
1723580	1725580	Why does it hurt so much?
1725580	1727580	...scene, and both scenes are given
1727580	1729580	the same emotional weight with both the cinematography
1729580	1730580	and the editing.
1730580	1732580	One of these scenes features a relationship
1732580	1734580	that has been built organically.
1734580	1736580	The other features a woman crying over a man
1736580	1737580	she has no reason to care about
1737580	1739580	in a studio-mandated love triangle.
1739580	1741580	And the latter is given the greater focus
1741580	1742580	because it comes last.
1742580	1744580	I'm not saying Keeley and his wingman, Feeley,
1744580	1746580	don't deserve some sort of death scene,
1746580	1748580	because yeah, we've spent a lot of time with them too.
1748580	1750580	But that this happens...
1750580	1752580	Why does it hurt so much?
1753580	1755580	Because it was real.
1756580	1758580	Immediately after this...
1763580	1765580	...robs Thorin's death of its gravitas
1765580	1767580	and pulls the rug out from under what was naturally
1767580	1769580	a cathartic and good farewell
1769580	1771580	that had actual bones in the story.
1781580	1783580	And I hate to bring out the tinfoil hat again,
1783580	1785580	but I cannot help but wonder if Warner Bros.
1785580	1787580	looked at all the gay jokes that followed
1787580	1789580	the Lord of the Rings trilogy...
1789580	1791580	I'm glad you're with me.
1793580	1794580	...and thought,
1794580	1796580	we don't want that.
1796580	1797580	No homo.
1797580	1799580	It isn't difficult to tease out the stuff that worked,
1799580	1801580	like Thorin and Bilbo,
1801580	1802580	from the stuff that didn't,
1802580	1804580	like Tauriel and Keeley, Gandalf and Galadriel.
1804580	1806580	On the one side are things that were there
1806580	1808580	in the source material and just needed to be fleshed out.
1808580	1810580	The other is made up out of whole cloth
1810580	1812580	tacked on because the studio wanted it
1812580	1814580	or because the focus group said it tested well
1814580	1815580	and it's less gay.
1815580	1816580	So the emotional core,
1816580	1818580	especially between Bilbo and the dwarves,
1818580	1820580	the most important aspect of the films,
1820580	1821580	suffers.
1821580	1823580	In this movie, this is our fellowship.
1823580	1825580	And they start out great.
1825580	1827580	The strongest point in all three movies
1827580	1829580	is at the beginning when the dwarves show up.
1838580	1840580	But as the movies progress,
1841580	1843580	until movie three ends with Bilbo just...
1843580	1845580	sneaking out.
1845580	1847580	And the implication here is that
1847580	1849580	the emotional core of the story
1849580	1851580	doesn't really matter.
1852580	1854580	Even though we were in the core cast,
1854580	1857580	we really did feel at some point
1857580	1859580	that we were actually becoming
1859580	1861580	the world's highest paid extras.
1861580	1863580	Whether it had to do with the fact that
1863580	1865580	the studios had said,
1865580	1867580	actually, they're all right,
1867580	1869580	these dwarves, yes,
1869580	1871580	but the real stories are the battle
1871580	1876580	between Thorin and the evil orcs.
1876580	1879580	It's the story of the relationship
1879580	1881580	between Radagast and Gandalf
1881580	1883580	and finding Galadriel again
1883580	1885580	and getting her help.
1885580	1888580	If that is what the studios were pushing for,
1888580	1890580	then they certainly got what they wanted.
1890580	1892580	What I think they missed out on was
1892580	1895580	the heart that we started with.
1896580	1900580	And we had that as a group of dwarves
1900580	1904580	going with Gandalf and with our Hobbit
1904580	1908580	to find our treasure.
1908580	1911580	The treasure, like in the Maori language,
1911580	1914580	taonga, has to do with the treasure
1914580	1916580	of people, of history,
1916580	1919580	and really of heritage.
1919580	1921580	That's what we were after.
1921580	1923580	That's what we as actors
1923580	1925580	were driving towards.
1925580	1929580	And that, I felt, gradually dissipated
1929580	1931580	until at the end we just had
1931580	1935580	a big punch-up with five massive armies
1935580	1938580	driven by technology.
1945580	1946580	There is a lot more to it,
1946580	1948580	but in the case of The Hobbit,
1948580	1949580	bad studio mandates seem to be
1949580	1951580	the cornerstone of the discussion.
1951580	1953580	No, I don't necessarily feel better
1953580	1955580	about The Hobbit,
1955580	1957580	but that doesn't mean that the legacy
1957580	1959580	of The Hobbit has to be all or nothing.
1959580	1960580	I mean, just look at what it's done
1960580	1962580	for the people of New Zealand.
1962580	1964580	Clearly, they're proud of their ties
1964580	1965580	to Middle-earth.
1965580	1967580	There are giant stone dwarves
1967580	1968580	at the airport,
1968580	1970580	and this well-kept-up movie set
1970580	1972580	staffed with enthusiastic people
1972580	1974580	happy to show you around.
1974580	1976580	Maybe these films were deeply flawed
1976580	1978580	and often disappointing,
1978580	1979580	but they were important to the people
1979580	1980580	of New Zealand.
1980580	1982580	These are a simple folk
1982580	1983580	just trying to get by
1983580	1985580	in the global economy.
1985580	1988580	So, even if I can't appreciate the films,
1988580	1991580	I can appreciate their legacy.
1994580	1995580	This was so much fun.
1995580	1996580	Yeah.
1996580	1998580	I think I can finally see
1998580	1999580	that The Hobbit movies have done
1999580	2002580	a great service to the country of New Zealand.
2003580	2005580	In terms of legacy,
2005580	2007580	what The Hobbit left behind
2007580	2009580	is a little bit more complicated than that.
2011580	2013580	I'm sorry, who are you?
2013580	2014580	Hi, I'm Tom.
2014580	2016580	I'm a writer for birth, movies, death,
2016580	2017580	and a filmmaker.
2017580	2019580	Just so you know,
2019580	2021580	what The Hobbit actually did
2021580	2023580	for New Zealand was...
2023580	2025580	Well, it kind of fucked us.
2035580	2036580	Oh.
2036580	2037580	Oh.
2037580	2038580	Thank you.
2041580	2042580	Um...
2042580	2044580	We've just been informed by the studio
2044580	2045580	that this is actually going to be
2045580	2046580	three videos now.
