start	end	text
1325600	1329000	and how that is tested by apocalyptic alien invasion.
1329000	1332400	This is relevant because the aliens are, at the emotional core of the film,
1332400	1334800	what tests the strength of the family unit.
1334800	1340800	Rey, the inadequate father, is forced for the first time in his life to take responsibility for his family.
1340800	1342800	Can he do it?
1342800	1345600	You're an asshole. I hate coming here.
1345600	1348400	It's a solid conceit and firm grounding for a screenplay.
1348400	1351800	And for the first half of the film, it executes this fairly well.
1351800	1358000	But, you know, it kind of looks like the screenplay didn't have an answer to that question.
1358000	1359400	Just look at that ending.
1359400	1361400	Hey, Dad.
1361400	1364400	And no, I don't mean how the aliens are defeated.
1364400	1368400	Although I'm not a stickler for faithful adaptations, that is not the problem here.
1368400	1371400	The resolution for the characters is the problem.
1371400	1374400	Unlike Roland's trademark cast of thousands,
1374400	1378000	War of the Worlds features a cast of four.
1378000	1379200	Well, I take that back.
1379200	1383200	You have the two A-listers, one this kid and Tim Robbins,
1383200	1388000	whose introduction brings the film's momentum to a screeching halt from which it never recovers.
1388000	1390800	This movie did not need humanity to save the day.
1390800	1395400	It needed a satisfactory arc for these three characters we spend the entire movie with.
1395400	1400000	And that, and not how the aliens are defeated, is the core of this narrative.
1400000	1402600	And it's kind of a hot mess.
1406600	1408200	For instance, Rachel.
1408200	1409200	Dear Rachel.
1409200	1411000	Hey, she said she could get it.
1411000	1412400	She said she could get it.
1412400	1413600	It's a Scott roller.
1413600	1415800	Mom clearly thinks she's incapable.
1415800	1417200	Dad says she can get it.
1417200	1418400	She said she could get it.
1418400	1421000	And it's almost like we're setting up a character arc here.
1421000	1424000	Like, Rachel's gonna realize that she could indeed get it,
1424000	1427800	even though mom and therapists coddle her to the point of being a complete deer in the head.
1427800	1428400	Nope!
1430600	1432400	Turns out Rachel can't get the bag.
1432400	1435200	A realistic kid and well-rounded character in the first half,
1435200	1438200	she's relegated to little more than a MacGuffin in Act 2,
1438200	1444200	and basically just a doe-eyed trauma figurine in what passes for Act 3 in this movie.
1444200	1447200	Which is kind of a problem for the second biggest character in your movie.
1447200	1451000	And here's the one spot where Independence Day is the superior film.
1451000	1454400	Despite having the trademark Roland Emmerich cast of thousands,
1454400	1458600	all of the character arcs are complete, and they work.
1458600	1462200	They're silly, but they are complete.
1462200	1466200	Roland manages to give all of them a starting point and a culminating moment.
1466200	1469800	President Clint Moore is faced with a country beginning to doubt his adequacy.
1469800	1472000	They elected a warrior and they got a wimp.
1472000	1475600	But through a series of trial and error, including the use of nuclear weapons,
1475600	1477600	May our children forgive us.
1477600	1479000	Whoopsie-daisy.
1479000	1482000	He self-actualizes by firing his Secretary of Defense,
1482000	1485600	and he becomes the warrior the country needed.
1485600	1486400	Literally.
1486400	1488600	Eagle One.
1488600	1490000	Fox Three.
1490000	1492400	Captain Hiller aspires to fly the Space Shuttle,
1492400	1494800	a privilege which he is repeatedly denied.
1494800	1497800	But after a series of conflicts and flying around a lot,
1497800	1504000	he arguably becomes the most qualified person on the planet to fly the alien shuttle.
1504000	1505800	I've been waiting for this my whole life.
1506000	1510400	And David starts with his father and his ex-wife berating him for being a lazy genius.
1510400	1512200	So tell me something. Are you so smart?
1512200	1515200	How come you spent eight years in MIT to become a cable repairman?
1515200	1518200	But in the end, not only does he rise above his inadequacy,
1518200	1521200	his genius literally saves the world.
1521200	1524200	You know how I'm like I'm always trying to save the planet?
1528200	1529200	Here's my chance.
1529200	1531600	There are three separate and distinguishable arcs here,
1531600	1533400	and they are all set up really well,
1533400	1536400	so the audience is very clear about who's accomplishing what,
1536400	1539800	based on whose skill set by the time Act 3 rolls around,
1539800	1541600	and we need to see those skills in action.
1541600	1543800	Hell, even the Randy Quaid subplot,
1543800	1546600	which seems genuinely pointless for most of the film,
1546600	1549400	ends up being one of the most important elements in the movie.
1549400	1551400	His motivation by way of his kids,
1551400	1553000	why he's drunk all the time.
1553000	1553800	Oh, yeah.
1553800	1555800	Seems years back our boy here was kidnapped by aliens,
1555800	1558400	did all kind of experiments on him and such.
1558400	1559600	Tell him about it, Russ.
1559600	1560800	His skill as a pilot.
1560800	1561400	All of it.
1561400	1563000	You know, we see it for a reason.
1563000	1564200	So when it culminates...
1566200	1568200	All right, you alien assholes!
1568200	1570600	Oh, yeah.
1570600	1571600	Sure.
1572000	1574200	Oh, boys!
1574200	1578600	I'm back!
1578600	1582000	Wheeee!
1582000	1584600	War of the Worlds, for all its masterful tension building,
1584600	1586000	beautiful cinematography,
1586000	1587200	genius sound design,
1587200	1589800	and pretty good first half of a screenplay,
1590000	1594600	does not have the same level of build-up and payoff as Independence Day.
1594600	1597600	If you compare the three main character arcs in Independence Day,
1597600	1600400	each cheesy but complete in its own little world,
1600400	1603200	to the one protagonist character arc in War of the Worlds,
1603200	1605800	what is Rey's culminating moment?
1605800	1607600	He is set up as an inadequate father,
1607600	1611200	a blue-collar kind of guy who does not know how to take care of his children,
1611200	1614000	and only endures his custody weekends out of obligation.
1614000	1615200	And when the aliens invade,
1615200	1618400	he is forced into a situation where he must care for his children,
1618400	1619600	all the while said children,
1619600	1621400	a teenage boy on the verge of manhood,
1621400	1623400	and a confused neurotic preteen,
1623400	1625200	are actually acting their age.
1625200	1626400	Rachel, shut up, Rachel!
1626400	1627800	I can't sleep in your house!
1627800	1628800	Look, I'm driving!
1628800	1631400	Rey does not know how to take responsibility for them,
1631400	1633800	but through the situation, he is forced to.
1633800	1636800	And the screenwriters didn't seem to know where to go with that.
1636800	1638400	And this is where the movie falls apart.
1638400	1640800	Robbie is constantly wanting to get out and break free,
1640800	1642200	and be a man,
1642200	1643800	but break free from what?
1643800	1646800	You only chose Boston because you hope Mom's there,
1646800	1649200	and if she's there, you can dump us on her!
1649200	1651000	Rey's not an overbearing father,
1651000	1654600	he doesn't even give Robbie a slap on the wrist when he steals his car.
1654600	1655800	Yeah, Robbie?
1656800	1659800	Why, I might just smack my own hand.
1659800	1663800	Nor is Robbie given any motivation to find some greater calling in Act 1.
1663800	1667400	He doesn't lose anyone, or see the initial carnage Rey saw,
1667400	1668800	so this...
1668800	1670800	We catch up with these soldiers,
1670800	1672400	hook up with whoever else is in debt,
1672400	1673800	and we get back at them!
1673800	1676800	...is the idiotic, macho blathering of a teenage boy
1676800	1679000	who has no idea what he's talking about.
1679000	1681200	So by the time the movie starts to fall apart,
1681200	1683800	Robbie has shown no maturation.
1683800	1685400	And then this happens.
1685400	1686400	Robbie?
1687200	1688000	Stay together!
1688000	1689000	Robbie.
1689000	1689600	Robbie.
1689600	1690200	Robbie, no.
1690200	1691600	Ro- Robbie, come back.
1691600	1694200	Robbie, no, you're gonna- you're gonna ruin the movie, Robbie.
1694200	1695000	Get back here!
1695000	1697400	What, what do you think you're gonna be the Randy Quaid of this movie?
1697400	1699400	This movie doesn't get a Randy Quaid, Robbie!
1699400	1701000	It's not 1996 anymore!
1701000	1703400	Please let me go. You need to let me go.
1703600	1705800	So now Robbie is basically out of the movie,
1705800	1710000	and despite idiotically running into a gigantic fireball...
1710800	1711800	Don't worry.
1711800	1714400	Everyone makes it to Grandma's house in the end.
1715200	1716000	He's fine.
1719800	1722800	It's not even that Robbie needed to die in the fireball.
1722800	1725800	It's that he needed a different story arc altogether.
1725800	1727200	If they wanted it to be,
1727200	1729600	Rey realizes Robbie's a man,
1729600	1731200	they should have built it to that.
1731200	1734800	Because Robbie, as Rit, is a complete dipshit.
1734800	1738400	Between these balls, we go back there and find one of those things and kill it.
1738400	1741800	Every action he takes is immature, spiteful, and wrong-headed.
1741800	1745600	Now let's try one that doesn't involve your ten-year-old sister joining the army!
1745600	1747800	The movie begins with him stealing Rey's car,
1747800	1750000	and he does not mature past this.
1750000	1752800	He never once earns the trust that Rey deigned to give him.
1752800	1757000	There's never a moment where Robbie and Rey learn to respect each other as men.
1757000	1757800	So this?
1757800	1760400	Please let me go. You need to let me go.
1760400	1761200	It's like...
1762200	1764200	Where the hell did that come from?
1764200	1767000	Let's draw a comparison to one of cinema's most famous
1767000	1768800	you-need-to-let-go moments.
1768800	1771200	When Marlin and Dory are trapped in a whale,
1771200	1774200	and Marlin has to make a metaphorical leap of faith...
1774200	1778200	He says it's time to let go!
1778200	1780200	Everything's gonna be alright!
1780200	1782800	This is a culminating moment for Marlin's character.
1782800	1784800	Marlin is an overprotective father.
1784800	1785600	He's overbearing.
1785600	1786600	He's overcompensating.
1786600	1787600	He's neurotic.
1787600	1790400	He has already endured the horrible loss of his wife,
1790400	1792600	which makes the loss of Nemo his greatest fear,
1792600	1795000	and literally the worst thing that could happen to him.
1795000	1798200	How do you know something bad isn't gonna happen?
1798200	1799800	I don't!
1799800	1802400	So Marlin letting go in the face of uncertainty
1802400	1804600	is a signifier of character growth.
1804600	1806200	Rey, on the other hand...
1806200	1807200	Meh.
1807200	1808200	He's a bad father.
1808200	1810000	He makes no room in his life for his children.
1810000	1811200	He is a poor caretaker,
1811200	1813000	and he takes no interest in their lives.
1813000	1816400	I'm allergic to peanut butter.
1816400	1817400	Since when?
1818200	1818800	Birth.
1818800	1822000	So what sense does it make for this to be any kind of culminating moment?
1822000	1824200	It's a kid who's trying to break free from a dad
1824200	1827000	who was never really there for him in the first place.
1827000	1829200	And Rey is eventually like,
1829200	1831200	Okay.
1831200	1832200	Do whatever you want.
1832200	1835200	Yes, I see that the movie is trying to push that it's building up,
1835200	1837200	that this is Robbie crossing into manhood
1837200	1839400	and Rey learning to respect him as a man.
1839400	1840600	But this does not work,
1840600	1844400	given how obviously wrongheaded his moves to be a man have been
1844400	1845600	and continue to be.
1845600	1846800	Please let me go.
1846800	1848200	You need to let me go.
1848200	1849200	Nope.
1849200	1852400	If we need balls, we go back there and find one of those things and kill it.
1852400	1855800	So it's at this point in the narrative that we trade in Robbie for Tim Robbins
1855800	1858200	and spend the next 40 minutes in a basement.
1858200	1860800	Tim Robbins slides into the role of Robbie in the narrative
1860800	1863200	as the party who wants to fight back.
1863200	1864600	Why did you bring us here?
1864600	1866000	To fight them together.
1866000	1869400	Against the wishes of Rey, who is just trying to not die.
1869400	1871200	And it is the worst thing.
1871200	1873800	Now we'll be the ones coming up from underground.
1873800	1876200	Only we have no attachment to Tim Robbins.
1876200	1879000	He is crazy and he's just here now.
1879000	1880000	In the movie.
1880800	1883400	Yaaaaaaaaaaaaaaaaaay...
1883400	1888000	So rather than making it a story about how Robbie and Rey reconcile these two approaches to,
1888000	1890200	you know, alien invasion,
1890200	1894800	all the while trying to keep the helpless girl child safe from the barbarousness of humanity,
1894800	1896000	we get Tim Robbins.
1896000	1897600	We're right under their feet, right?
1897600	1898600	Right here.
1898600	1899600	Under their feet.
1899600	1902600	So pretty much no matter what happens after Robbie leaves the narrative,
1902600	1905600	at least if he does consequence-free come back,
1905600	1906800	which is what happens,
1906800	1909600	it's not going to be satisfying to the audience as a story.
1909600	1911200	Because the payoff does not work,
1911200	1914200	either logically, thematically, emotionally,
1914200	1915200	with what was built up.
1915200	1916400	So this...
1918800	1920600	isn't the real problem.
1920600	1921600	This is.
1923600	1926200	I'm not saying it would have been better if Robbie never came back into the ne-
1926200	1927800	well, I mean, kind of would have.
1927800	1930600	It would have shown Rey that his inadequacy actually has a consequence.
1930600	1934600	But rather that Rey steps up and is the goddamn dad for once.
1934600	1936400	And then maybe later when this happens,
1936400	1938800	Robbie plays some integral role and helps Rey out.
1938800	1941800	Like, maybe Robbie is the guy who grabs onto him and pulls him back out
1941800	1944600	instead of this random guy we've never met.
1944600	1946000	And then they all three realize that,
1946000	1948000	yeah, they did need each other, something something,
1948000	1951800	and father-son develop a sense of, you know, something, mutual respect, whatever,
1951800	1954000	something that pays off the setup.
1954000	1955600	And it was not a bad setup,
1955600	1958400	but it needed to find some sense of organic resolution,
1958400	1962200	or your audience is gonna be pissed that they spent the last two hours with these people.
1963200	1965800	Which is more or less what happened.
1965800	1968200	The problem of invasion narratives in general
1968200	1972800	is that they're really difficult to resolve in ways that aren't just transparently unrealistic.
1974400	1977000	But moreover, especially for American-made films,
1977000	1978800	revenge is often a key element.
1978800	1980800	Get off my plane.
1980800	1982800	We want revenge against the invaders,
1982800	1985000	and War of the Worlds 05 didn't deliver.
1985000	1986800	It just kind of peters out,
1986800	1989200	as does the narrative about Rey and his family.
1989200	1991800	Both the invasion narrative and the character narrative
1991800	1996200	just kind of slops out at the end like a dying alien out of a tripod.
1996200	1998200	American audiences in 2005,
1998200	2000400	jacked up on war on terror propaganda
2000400	2003200	and seeking narratives that provide a sense of revenge,
2003200	2005200	were left cold by the film upon release.
2005200	2006800	In the 14 years since,
2006800	2010200	feelings have softened on it to the point that there's a sort of cultural amnesia
2010200	2012400	of how much people hated it at the time.
2012400	2015400	But that it's finally getting a more positive re-evaluation,
2015400	2017200	or at least a more nuanced re-evaluation,
2017200	2018800	is deserved in my opinion.
2018800	2020800	Except, of course, the resolution.
2021400	2023800	Part of why invasion narratives have fallen out of favor
2023800	2026400	is that they're really hard to resolve with a happy ending.
2026400	2029400	We were okay with a dumb happy ending in 1996,
2029400	2031400	but not in 2005,
2031400	2033400	and not really now either.
2033400	2036400	It will never be 1996 again.
2036400	2038800	You cannot go back to Independence Day.
2038800	2043800	If we can conceive of an other enemy that is capable of defeating us so completely,
2043800	2047200	it's harder to suspend disbelief that there is a way we could fight back
2047200	2048800	and have a happy ending.
2049600	2053800	Now, a completeness in an invasion narrative just doesn't feel narratively truthful
2053800	2056800	that humanity could survive something so devastating.
2056800	2058800	And it's not that invasion narratives are gone,
2058800	2061800	but nowadays they tend to be secondary to the main conflicts.
2061800	2065200	In movies like Avengers, Transformers, or even Man of Steel,
2065200	2067600	the invasion only happens in the third act,
2067600	2070400	and all of these movies involve super-powered beings
2070400	2073400	or giant anthropomorphic robots protecting the Earth,
2073400	2076800	not normal humans as in Independence Day or War of the Worlds.
2076800	2079800	Moreover, the villains in these films are not like locusts.
2079800	2081800	They're like locusts.
2081800	2084400	They're moving from planet to planet.
2084400	2087400	They are not intellects vast and cool and unsympathetic.
2087400	2092000	Intellects vast and cool and unsympathetic.
2092000	2095800	They are, in effect, despite technically being aliens, human.
2095800	2099200	Their motivations are clear and completely understandable to the audience.
2099200	2101400	Movies with more straightforward alien invasions,
2101400	2103400	as seen in films like Edge of Tomorrow,
2103400	2105000	tend to be commercial failures.
2105000	2106600	Now audiences want a twist,
2106600	2109600	and the ones you do see tend to be low-budget suspense thrillers
2109600	2113200	that have more in common with the horror genre and character studies
2113200	2114600	than action sci-fi.
2114600	2118400	Films like A Quiet Place and 10 Cloverfield Lane, for instance.
2118400	2120600	So the alien invasion motif is not gone,
2120600	2123600	but it's nothing like War of the Worlds or Independence Day.
2123600	2128000	As filmgoers, we aren't really interested in villains we can't understand anymore.
2128000	2131000	Part of that may be because we've culturally stared down an event
2131000	2135000	that we were unprepared for and incapable of adequately resolving,
2135000	2139000	in part because comprehending it would mean facing our own societal evil.
2139000	2141400	So, an incomprehensible villain,
2141400	2144200	mass audiences just aren't really interested in that anymore.
2144200	2146600	And in the year of our Lord, 2019,
2146600	2149400	I can think of a number of reasons why that might be.
2152400	2154400	That's what I call a close encounter.
2154600	2157600	Ding-a-ding-a-ding-a-ding-a-ding-a-ding-a-ding-a
2157600	2160800	Living in LA, I sure do sit in a lot of traffic,
2160800	2165400	so I get most of my reading done with our good friends at Audible.
2165400	2168200	With Audible, you get access to an unbeatable selection of audiobooks,
2168200	2173000	including bestsellers, motivation, mystery, thrillers, memoirs, and more.
2173000	2175000	Audible members can choose three titles every month,
2175000	2177400	one audiobook, and two Audible Originals.
2177400	2180000	Orson Welles' original radio drama from the 1930s,
2180000	2183600	which I used a very small amount of in this episode, is on Audible.
2183800	2187200	There's a War of the Worlds musical that is an Audible Original,
2187200	2190000	so you get that on top of your free Audible credit.
2190800	2192200	How could you say no?
2192200	2194200	Listen on any device, anytime, anywhere,
2194200	2197600	and you'll also enjoy easy audiobook exchanges, rollover, credits,
2197600	2201600	and an audiobook library you keep forever, even if you cancel.
2201600	2205600	It started with a 30-day trial when you go to audible.com slash lindsayellis
2205600	2212600	or text lindsayellis to 500-500 and listen for a change.
