start	end	text
0	18960	All right children, it's a new decade, it's time to face the facts.
18960	21280	How do I put this delicately?
21280	24400	Your humble hostess is a total les.
24400	26760	Shame.
26760	31440	You're probably worried this is a coming out video, and I'm sorry to tell you that it is,
31440	35080	but oh, it's so much worse than just that.
35080	41440	You know, one coming out may be regarded as a misfortune, two, looks like carelessness,
41440	45120	and three, well at that point you're just doing it for attention.
45120	50400	And I do love attention, I want to be very clear about that, but I also happen to be
50400	51400	gay.
51400	54440	Some gay people love attention, it's been known to happen.
54440	59680	So there comes a time in a woman's life when you have to take a step back, look yourself
59680	64880	in the mirror, and admit this is some high-key lesbicious behavior.
64880	67840	And I'm going to talk you through how I got to that point.
67840	70760	So story time, I fell in love with my best friend.
70760	73060	Story time, telling my boyfriend I'm a lesbian.
73060	77720	Story time, my parents walked in on my Taco Bell mukbang, exposed, graphic, the tea is
77720	78720	piping hot.
78720	83080	For a long time on this channel, the official story has been that I'm bi.
83080	84560	I'm a super fucking bi.
84560	89840	But I haven't dated women since I transitioned, and for a while there, I got pretty deep into
89840	91280	the straight lifestyle.
91280	96800	This really started in 2018, by that summer, I had privately convinced myself that I was
96800	99680	a fully heterosexual woman.
99680	104520	And we're gonna circle back to how I reached that conclusion, but I'm starting in the middle
104520	105520	of things.
105520	106520	I'm like an epic poet.
106520	107520	Hail Muse.
107520	109920	Hey how are you, gorge?
109920	114400	So at the beginning of 2018, I became close friends, I'd even say best friends, with a
114400	120400	woman whomp-style called Joanne.
120400	121400	Light of my life.
121400	123200	Can we get some melodramatic music please?
123200	124600	Yeah, here we go.
124600	126680	You're gonna want to pour yourself a glass of something nice.
126680	129360	I want you to fully enjoy my pain.
129360	132400	So my friendship with Joanne got very intense, very fast.
132400	136560	It was that kind of friendship where you develop your own private language of references and
136560	140680	in-jokes, and you drive everyone around you crazy with your unintelligible banter.
140680	143760	We'd call each other pretty much every day, and we'd talk for hours.
143760	147040	And I don't think I've ever called her and not been laughing or smiling in the first
147040	152480	20 seconds, which is very unusual for me, because I am a weird, and I don't get along
152480	153960	that well with that many people.
153960	157040	One reason we got so emotionally close is, we're both trans.
157040	161200	And there's a kind of intuitive understanding and a sense of humor that I can share with
161200	164600	another trans woman that I can't really have with anyone else.
164640	171480	Oh and by the way, Joanne also happens to be just angelically beautiful, which I did
171480	173440	notice every time I looked at her.
173440	178320	And from the beginning of this relationship, it wasn't sexual, but it wasn't exactly
178320	179320	platonic either.
179320	183760	We'd get drunk and make out, we'd sleep in the same bed and cuddle, straight girls
183760	184760	do that right?
184760	185760	Gal pals!
185760	191080	I remember one of the first times I hung out with Joanne, we got our nails done together,
191080	195960	and that night we were bar hopping and she took my pretty hand and her pretty hand and
195960	198160	we walked down the street together holding hands.
198160	203560	This is garbage and I want to die, I hope you all know that I'm in agony.
203560	207360	Later we were at a bar table with friends, and every time one of us needed a drink, we'd
207360	210840	run off to the bar and she'd secretly kiss me.
210840	211840	Ah!
211840	215040	It's still one of the most magical gay things that's ever happened to me.
215040	217640	Joanne had a boyfriend at the time, but he didn't care.
217680	221800	A lot of men think girls kissing is hot, but they don't take it seriously.
221800	225320	They don't think it could ever mean anything or lead to a real relationship.
225320	228200	Gal pals!
228200	229200	Just kill me.
229200	233600	Take me out behind the shed, put me down humanely, and just buy a new YouTuber before
233600	235720	the kids get home and they won't notice.
235720	240920	So this very intimate friendship went on for about a year without me acknowledging to Joanne
240920	244020	or to myself that I was falling in love.
244020	248740	So not only was I in denial about being in love with her, but at the same time I had
248740	252940	basically convinced myself that I only wanted to date men.
252940	254860	So how could I possibly think that?
254860	257860	Well, the short answer is shame.
257860	260180	Why is no one talking about the shame?
260180	263460	I was so ashamed of my attraction to women.
263460	266380	There were days I thought the shame was going to crush me to death.
266380	272260	Oh, I wanted to be straight so bad, and let no one say I didn't make a strong attempt.
272260	277020	There should honestly be a statue of me sucking dick in the town square with the inscription
277020	279940	Here knelt Natalie Wynn, attempted heterosexual.
279940	282060	I'm a bronze star lesbian.
282060	286380	Well, if we're really being honest, I don't think I get a star.
286380	288380	Oh, I was desperate to be straight.
288380	289580	I tried prayer.
289580	291380	I tried electric shocks.
291380	292620	All the classics.
292620	293620	All the hits.
293620	297500	You know, the idea is if you shock yourself every time you think about women, you start
297500	299120	to associate the two in your head.
299120	301560	So now I'm a lesbian and I enjoy electric shocks.
301560	307600	This is supposed to hurt, but I just feel like I'm on a road trip with Cate Blanchett.
307600	310160	So at some point, the shame was just too much for me.
310160	312320	And it literally broke my brain.
312320	317840	I no longer wanted to be straight, I simply deluded myself into thinking I was straight.
317840	318840	Maybe a little bi.
318840	319840	A little bit.
319840	325000	By that time, I had started dating men, and I got into a serious long-term relationship
325000	326000	with a man.
326000	329920	At first, I explained away my feelings for Joanne by telling myself, female friendships
329920	331320	are just really intense.
331320	334160	That's probably why I feel so strongly.
334160	339040	And everyone thinks women are beautiful, so it's only natural I'd notice that.
339040	344600	And you know, spend a lot of time thinking about it.
344600	347480	So this nonsense went on until the beginning of last year.
347480	349400	And then two things happened.
349400	352400	First, Joanne started dating a cis lesbian.
356000	360240	Fuck my drag, right?
360240	365240	I think before that, I always knew she was bi, but some combination of self-interested
365240	370240	denial and bi-phobia allowed me to write off my initial crush on her as, I just have a
370240	371920	thing for my straight best friend.
371920	372920	Like who doesn't?
372920	377080	But that's a very self-serving narrative, because it quarantines your feelings inside
377080	382360	the safety of unattainable fantasy, and it wards off the pain of potential rejection.
382360	385840	Because that way, it's not really me she's rejecting, it's just, she's just not that
385840	386840	into women.
386840	390200	But once she started dating women, I couldn't tell myself that anymore.
390200	394800	And the jealousy hit me so hard, I couldn't ignore it.
394800	399000	Second, around that same time, Joanne decided to visit me for a few weeks.
399000	400400	It was a long distance friendship.
400400	403480	And about halfway through that visit, I cracked.
403480	410080	One morning, I woke up next to her, gal pals, and I looked at her pretty fucking face, and
410080	414760	I had the thought, I want to wake up next to you every day of my life.
414760	420480	And that is a pretty alarming thought for a petite heterosexual bio-girl to have about
420480	421640	her gal pal.
421640	425840	Oh, never in my life have I fallen so deeply in love with someone.
425840	427680	Like what the fuck is this?
427680	428760	What am I feeling?
428760	434040	I was experiencing an intensity of emotion that has no right to exist outside of 19th
434040	435840	century Italian opera.
435840	443280	So I confessed my feelings to Joanne, and love confession gone wrong, devastating.
443280	445560	She did not reciprocate my feelings.
445560	446560	Nurse!
446560	449280	My pain is at a 10, I need more pills!
449280	452960	Needless to say, my heart was shattered, I cried a sea of tears, blah blah blah, I'm
452960	454480	sure we all know how that goes.
454480	459080	And here's the thing, if we'd taken a three month friendship break right then and there,
459080	460400	I might have recovered.
460400	462460	But we couldn't keep away from each other.
462460	466820	She wasn't in love with me, but she must have been in something with me, because the
466820	469620	truth is, we were never just gal pals.
469620	474800	And I was beyond reason, like, I probably would have started one of those lesbian couple
474800	477740	joint Instagram accounts, that's how tragic this got.
477740	478740	Those are great by the way.
478740	479940	Pay no attention to bitter queens.
479940	484820	So for the rest of 2019, Joanne and I kept talking, kept visiting each other, and I just
484820	487860	repeated this heartbreak again and again and again.
487860	492340	Now if she had reciprocated my feelings, I probably would have come out as gay last year,
492340	496300	because the heat of a romantic relationship has a way of evaporating shame.
496300	500700	But rejection and heartbreak are shameful in themselves, and only made the situation
500700	501700	worse.
501700	507140	So I spent most of 2019 going in and out of denial, until finally, last October, I got
507140	510180	super fucking canceled on Twitter as discussed in my last video.
510180	512180	Link in the description, subscribe!
512180	516540	And at the same time, Joanne realized that she was gonna have to be the one to enforce
516540	519940	a friendship break, otherwise I was never gonna get over her.
519940	523460	So there was this combination of things, being politically canceled by Twitter, being
523460	528540	romantically canceled by Joanne, and also losing her as my closest friend, which sent
528540	532140	me into this catatonic, rock bottom kind of depression.
532140	537340	And of course depression is a terrible thing, but I think it can also serve a purpose.
537340	542860	Because depression brings your life to a standstill, and in the quiet of that standstill, you sometimes
542860	544860	feel outside yourself.
544860	547180	And with that, comes a new perspective.
547180	551740	So last December, when I was lying around drinking white claw all day and binge-watching
551740	556020	Orange is the Bluest L Word, I actually didn't feel so much shame anymore.
556020	558700	And that gave me a new kind of clarity.
558700	563340	I looked back on the last couple years, and saw that I'd been avoiding the obvious.
563340	570900	So that's what it took for me to finally face the fact that I am a, uh, I am a gay.
570900	571900	Not clickbait.
577180	596860	Adam's a great guy and all, but I want Lilith.
596860	604860	Shame.
604860	609900	This floral fantasy is a little less Mother of Mankind and a little more Coachella 2015.
609900	611860	Well that's my Eden.
611860	612860	Candy flipping.
612860	613860	I love it.
613860	618580	Okay, let's circle back and talk about how a wholesome homo like me wound up in the clutches
618580	619860	of the straight agenda.
619860	623160	It starts with denial, and there's two sides to gay denial.
623160	627140	First there was a period where I repressed or explained away my attraction to women.
627140	629140	Female friendships are just really intense.
629140	630900	Straight girls have girl crushes too.
630940	635980	And second, I experienced and acted on what I genuinely thought was sexual and romantic
635980	636980	attraction to men.
636980	640540	And to be honest, I'm still kind of struggling to make sense of all this.
640540	644980	Maybe I'm not quite ready to make this video, but I'm afraid that if I don't, the shame
644980	648380	will overpower me again, and I'll slide back into denial.
648380	653180	So while I'm still thinking semi-clearly, let me talk you through the struggle.
653180	657660	Because like most queer people, I find nothing more fascinating than an in-depth analysis
657660	658660	of my own personality.
658660	659660	She's a Libra.
659980	662860	So in 2017, I started taking feminizing hormones.
662860	667500	And most people are aware of the more obvious effects of that, like it makes you grow breasts,
667500	670340	at least, in theory.
670340	672780	I just added progesterone, we'll see if that does anything.
672780	676300	But the lesser known thing is it has some pretty major effects on your mood and your
676300	677300	sexuality.
677300	681820	The first few months I was on hormones, I actually wondered if I was now asexual, because
681820	684580	the libido I had known before was just gone.
684980	690740	But I'm very much not asexual, it just took me a while to adjust to an endocrinologically
690740	693060	female sex drive.
693060	698420	One of the differences for me is it's not as obvious now whomst I'm attracted to.
698420	703820	Just looking at an attractive person, well, let's put it this way, it sparks my interest,
703820	705860	but it doesn't light my fire.
705860	709420	It's not the instant inferno that is testosterone-fueled lust.
709420	712340	It's a slow burn that has to be built up.
712340	717900	Some people call this demisexual, which is a term I'm ambivalent about, but I think
717900	720300	the concept it describes applies to me.
720300	723900	Like I form little crushes on people based on watching their YouTube videos or whatever,
723900	728340	but I don't feel intense sexual attraction to anyone until I've gotten close to them
728340	729340	as a friend.
729340	732740	So I have a hard time getting too excited about casual dating, you know?
732740	736780	Can't I just find a new best friend, fall insanely in love with her, and then get gay-married?
736780	739140	I know that's not how it works.
739140	740420	I have to play the field.
740420	744300	I also think it's a reason I don't really like porn that much.
744300	747700	Because sex without context is just mechanics to me.
747700	748700	It's boring.
748700	753500	The buildup of desire, that's the interesting part, and the struggle between desire and
753500	754500	shame.
754500	757340	I shouldn't, but I want to.
757340	758940	That's how you build a plotline, kids.
758940	764140	I'm also guessing this kind of slow-burn sexuality is more common in women than men.
764140	768820	And I wonder if that's a reason why gay men tend to know they're gay at an earlier age
768820	769820	than gay women.
770220	774540	When you have teenage boy testosterone levels, it's harder to be agnostic or mistaken about
774540	778740	who you're attracted to, whereas there's a lot of gay women who don't realize they're
778740	781420	gay until they're in their 30s, or even later.
781420	785460	And thank god for them, they make me feel less bad about my wasted youth.
785460	790500	So it's hard for me to use visual sexual interest as a guide to my sexuality, because I do feel
790500	795180	aesthetic attraction towards beautiful people of any gender, and that can be pretty intense
795180	796180	in its own right.
796180	802260	I guess the difference for me is looking at a beautiful woman is more emotionally captivating
802260	807860	to me than looking at a beautiful man, which can be moving in its own way, but it's more
807860	811980	like the way I'm moved by, I don't know, the Parthenon.
811980	816300	You know, it's sturdy, symmetrical, has impressive columns.
816300	819620	That's not to say it's totally asexual, I mean I'd fuck the Parthenon.
819620	820620	I'd fuck it so hard.
820740	826380	I admit I do have some kind of erotic fascination with masculinity, and maybe that stems from
826380	831940	my pre-transition sense of having failed at masculinity, so I'm mesmerized by the real thing.
831940	839180	There's something about the contrast between me and a masculine man that's sexually intriguing to me.
839180	847180	Like I've sometimes pleasantly gasped at the feeling of hairy, muscly arms enfolding my
847180	849900	smooth, fragile body.
850540	856020	Or maybe it's more Freudian, the masculine man as daddy, the archetypal father, the symbolic
856020	859780	power of the phallus, penetration as the ultimate expression of desire and possession.
859780	864940	There's a lot of sexual connotations to manhood, and I think that's why I can look at a sexy
864940	870060	man and create plausible fantasies in my head where I'd absolutely enjoy letting him do
870060	871060	things to me.
871060	876900	And I can find things I like about male bodies, like they're very warm.
876900	880180	I love it when you get under the covers with a man and he warms you up.
880180	883020	But that's when the lesbian voice comes into my head, and she says,
883020	885740	but are you attracted to men?
885740	888100	Or do you just like being warm?
888100	889980	My attraction to women is very different.
889980	896820	I look at a beautiful woman and it's just like, oh no, you're gorgeous, you're beautiful.
896820	898380	This is going to destroy me.
898380	901620	You know, it can actually be painful how beautiful a woman is.
901620	906020	I've never once been in pain over male beauty, but around Joanne, once I was open about my
906020	910060	feelings and things got bad, there'd be moments I'd have to just look away from her and be
910060	914060	like, don't even enter my line of sight right now, you're too beautiful, I can't stand it.
914060	918460	There's a kind of sick masochism in wanting someone who doesn't want you back.
918460	920260	It's insatiable, like an addiction.
920260	925220	And on the flip side, there's an intense erotic thrill in being desired.
925220	928420	I think that's what got me interested in men in the first place.
928420	933460	It's that they're interested in me, and that's pretty interesting.
933500	938540	I've felt desired by men in a way I've never truly felt desired by women.
938540	944460	You know, a man will glower at you with that agitated, carnivorous desperation.
944460	945500	Fuck me up, king.
945500	946740	God, that's hot.
946740	948220	Gets me every time.
948220	953700	But notice how excitement at the attention, the flattery of being desired,
953700	957580	is not the same thing as attraction to men.
957580	963020	You know, there's a difference between I want you and I like that you want me.
963020	965780	But for a long time, I confused one for the other.
965780	971060	And one reason I was able to do that is that the normative sexual role for women
971060	977420	is to be pursued, possessed, desired, seduced, dominated by men.
977420	982140	It's all very passive, and in most of the sexual encounters I've had with men,
982140	984500	I've taken a very submissive role.
984500	989180	Sometimes I just submit to the glower and let him do things to me.
989180	994620	And I do think that the thrill of being desired is a valid thing to want.
994620	997860	I like that feeling myself, and I do genuinely enjoy
997860	1000300	taking on a more submissive role sometimes.
1000300	1002340	But you have to go about it thoughtfully.
1002340	1007740	Because if you don't, sexual submission can be a way to avoid
1007740	1010700	confronting what your desires actually are.
1010700	1012580	It's freedom from freedom.
1012580	1014780	And if you're ashamed of your sexual orientation,
1014780	1016980	and ashamed of your transsexual body,
1016980	1019900	and ashamed of having any sexual feelings at all
1019900	1023380	because of stigma about trans women being fetishists,
1023380	1026460	then relinquishing responsibility for your own desires
1026460	1028780	by letting someone else take control
1028780	1031900	can be the only way you can enjoy sex at all.
1031900	1035060	And for a while, it was almost the only way I could enjoy it.
1035060	1037980	And I was able to convince myself that was normal
1037980	1041660	because the sexual situation of a lot of cis straight women
1041660	1043700	isn't really that much more liberated.
1043700	1046380	Like I read Fifty Shades of Grey years ago,
1046380	1048980	and totally identified with the fantasy.
1048980	1051420	And later, I thought that was evidence
1051420	1054020	I had normative female desires.
1054020	1055580	Never mind that I was identifying
1055580	1057420	with the midlife crisis fantasies
1057420	1059060	of a repressed English housewife
1059060	1062060	longing to be brutalized by a capitalist tyrant.
1062060	1064700	I mean, not to shame women who genuinely do enjoy
1064700	1066860	a healthier version of that fantasy.
1066860	1068820	I think a lot of women pointlessly suffer
1068820	1071020	under a kind of feminist guilt about that.
1071020	1073260	But what makes me different is that for me,
1073260	1076380	submission to a man was simply the only way
1076380	1078220	I could enjoy sex without shame.
1078220	1080420	And that's a lot of what I did for a couple years,
1080420	1083780	even though my real sexual attraction is to women.
1083780	1087100	Whereas, even in the most patriarchal situation,
1087100	1090780	straight women are ultimately attracted to men
1090780	1092580	and sexually aroused by male bodies.
1092580	1093780	Or are they?
1093780	1095180	Gay men certainly are,
1095180	1098020	and gay women are just rhapsodic about women.
1098020	1101180	But a lot of straight women are just kind of meh
1101180	1103220	about male bodies and men in general.
1104020	1106100	Which, what is that about?
1106100	1109940	I just, I just do not understand straight women.
1109940	1112540	I don't think I ever will, and that's okay.
1112540	1114540	I'm just gonna accept my bewilderment
1114540	1116360	and move on with my lesbian life.
1116360	1119380	Now, what I've been giving you so far
1119380	1121500	is a retrospective analysis,
1121500	1125300	an autopsy of my romantic failings of the last two years.
1125300	1126340	But you have to understand
1126340	1128060	that when I was living through this,
1128060	1129820	I experienced it very differently
1129820	1131860	because I didn't have these insights.
1131860	1134660	So I wasn't thinking, oh, I'm not really attracted to men,
1134660	1137140	but I enjoy the thrill of being desired by them,
1137140	1139500	so I'm gonna pursue that to distract myself
1139500	1141700	from how ashamed I am of my attraction to women.
1141700	1145740	No, subconsciously, I put my attraction to women on mute,
1145740	1148220	at least until Joanne ruined my life.
1148220	1150500	And I genuinely thought I was attracted to men,
1150500	1153980	which was a lot more than just a frivolous sexual fantasy.
1153980	1157420	I had a serious long-term boyfriend for a year and a half
1157420	1159900	who I had very genuine feelings for.
1159900	1162060	Plot twist, story time.
1162060	1167060	So my ex-boyfriend, let's call him Chad.
1167620	1172240	Oh, and he was a Chad, like full giga-Chad fantasy.
1172240	1173980	You know, he was very masculine,
1173980	1177620	taller than me, objectively attractive, very charming.
1177620	1179380	Straight women used to tell me all the time
1179380	1181100	they were jealous of me for being with him,
1181100	1183060	and obviously I loved that.
1183060	1187220	To me, Chad represented almost an ideal of manhood,
1187220	1189980	a sort of archetypal romantic elite
1189980	1193740	who swept me off my feet and fulfilled my sick fantasies
1193740	1195460	of being a heterosexual woman.
1195460	1197020	Now, you probably think I'm gonna say
1197020	1199740	that he was just an abstract fantasy to me,
1199740	1202320	but that once it came to actually dating,
1202320	1203780	I realized I didn't like it.
1203780	1206300	But honestly, it's more complicated than that.
1206300	1209860	Like, at the beginning, I was the one who pursued him,
1209860	1211700	and I still think of him as the one
1211700	1213980	genuine boy crush of my life.
1213980	1216740	When we started dating, it was really exciting.
1216740	1218260	I'd never had a boyfriend before,
1218260	1220300	and he'd never been with a trans woman before,
1220300	1221820	and we had this, like,
1221820	1224280	adorably heterosexual energy together,
1224280	1226460	like holding hands in the park.
1226460	1227460	It was cute.
1227460	1230460	This would be a better lesbian story if Chad was a Cad.
1230460	1231600	But he wasn't.
1231600	1232440	He was great.
1232440	1233820	He took very good care of me.
1233820	1236420	He was never ashamed to be seen with me,
1236420	1239260	or of his friends and family knowing he was dating me,
1239260	1243260	which, if you're a trans woman, that's a huge deal.
1243260	1246720	He was a lot less ashamed of me than I am of myself,
1247560	1250440	and when I was with him, I wasn't ashamed,
1250440	1253040	and that meant a lot.
1253040	1255200	So I really wanted this to work.
1255200	1259200	Like, if I was gonna be with a man, he was the one.
1259200	1262260	And for a year or so, I thought it was working.
1262260	1264080	I enjoyed the time we spent together.
1264080	1266280	I missed him when he was gone.
1266280	1268520	I told him I loved him, and I meant it.
1268520	1271360	But what happened is, by the end of the first year,
1271360	1274200	the initial excitement had died down,
