start	end	text
1377300	1380620	But not only was the big boss easily stabbed away by a character who had nothing to do
1380620	1385020	with the White Walker plot, but the long night was about as long as a viewing of Titanic
1385020	1388900	with a couple of bathroom breaks thrown in, and instead of nearly wiping out humanity,
1388900	1392900	it wiped out… about one half of one army?
1392900	1396300	What they see is just the end of the Dothraki, essentially.
1396300	1397300	Question mark?
1397300	1400300	Two episodes later- Wait, Lindsay, did you steal my joke again?
1402300	1407620	And we learn that after that's done, it doesn't matter that the world of men was
1407620	1412380	too preoccupied with political squabbles to worry about an endless horde of ice zombies,
1412380	1417980	because all you needed to end the existential threat is the one special knife of no importance.
1417980	1421380	This is a recurring problem which ties in with what we were talking about in the last
1421380	1426500	episode- subverting expectations, despite the fact that it doesn't work for the story.
1426500	1431140	Arya's training as a faceless man builds not at all to this- it could have been anyone
1431260	1435220	with a strong ten-yard jump, and yeah, the fact that the Night King focuses his wrath
1435220	1439500	on Bran and Jon Snow means that Bran and Jon Snow should have been involved here.
1439500	1444260	Doesn't mean that Jon Snow needed to do the stabbing, but he needed some resolution
1444260	1449740	other than spending the battle screaming at his new archenemy, Zombie Dragon.
1449740	1456300	Tangent, I also saw one idea that it should have been Jaime who kills the Night King,
1456300	1460220	you know, bring that whole Kingslayer thing full circle, that would have been cool and
1460220	1464300	give Jaime a reason for existing, but you know, that would also have made sense.
1464300	1468660	Jon's main motivation is farted out of existence without any of his involvement, and after
1468660	1472700	it's over, the only thing that has materially changed, apart from the bloodletting of a
1472700	1477540	couple of supporting characters, is that Daenerys finds out about Jon being a Targaryen, which
1477540	1481420	not only has nothing to do with the White Walkers, or the effect they have in this world,
1481420	1484580	it probably would have happened eventually anyway.
1484580	1489740	But with regard to Jon learning the truth about who he is, he never really reacts to it.
1489940	1491300	You're the true king.
1492580	1496300	Aegon Targaryen, 6th of his name, protector of the realm, all of him.
1496300	1500700	A revelation this momentous, especially to someone like Jon Snow, whose entire identity
1500700	1503660	was wrapped around his bastardness,
1503660	1504860	You're Ned Stark's bastard.
1504860	1506380	Ned Stark's bastard.
1506380	1508140	Ned Stark's bastard.
1508140	1509580	I'm a bastard.
1509580	1512060	Okay, but you don't have to call yourself that though.
1512060	1516380	should merit more of a reaction than frowns.
1516540	1520380	There's no moment where he sits down and really parses this, discusses it with anyone.
1520380	1524140	Sansa and Arya in particular don't seem to care about the implication this has for their
1524140	1528700	family history, that the stories they heard about their aunt their whole life were a lie,
1528700	1531860	that their father lied to them, that the rift in their parents' marriage was based on
1531860	1537580	a falsehood, that Ned had remained faithful to Cat, but sacrificed his honor and basically
1537580	1539420	his marriage to protect Jon.
1539420	1544380	No, in the end, Jon reacts to this news like he's just been served jury duty, learning
1544380	1548460	that he was not only legitimate, but was loved and wanted from the moment of his birth,
1548460	1553420	has no effect on his identity or sense of self-worth, and is only addressed in the utilitarian
1553420	1557580	question of birthright and primogeniture, to which he immediately hops to
1557580	1559500	You are my queen.
1559500	1564260	and not wanting it is his sole motivation for the rest of the show.
1564260	1568380	They keep trying to force this ending to make sense vis-a-vis Jon's motivation.
1568380	1570380	Love is the death of duty.
1570380	1574700	Because if we had to have this ending, Tyrion is the one who feels responsible for the war
1574700	1575860	crimes here.
1575860	1580420	If we must put the bitch down like old Yeller, it should have been Tyrion that did it, not
1580420	1581780	Jon Snow.
1581780	1586780	Instead of Tyrion being the little finger to Jon Snow's Lysa Arryn.
1586780	1588180	I love her too.
1588180	1589180	Yuck.
1589180	1593460	By the end, Jon Snow's character has been reduced to a gelatinous mess because he doesn't
1593460	1594460	want anything.
1594460	1597500	He has no motivation after the Night King is gone.
1597500	1604980	This is a problem he has in common with Tyrion's path from the book diverges around the beginning
1604980	1606140	of season 5.
1606140	1609580	In the books, Tyrion's departure from Westeros makes it pretty obvious he's on the path
1609580	1612620	to vengeance and drinking himself into an early grave.
1612620	1616180	But around this point in the series, the showrunners decided that it's more important for Tyrion
1616180	1621100	to be an audience avatar, the voice of reason, a nice guy, and here he shall remain until
1621100	1623420	the last agonizing moments of the series.
1623420	1626600	There's nothing in the world more powerful than a good story.
1626600	1630320	And characters being wrong in a story is not bad.
1630320	1633840	Character flaws are a good thing, but Tyrion over the course of these three seasons is
1633840	1639040	so consistently terrible at his job that he should have been, at minimum, fired a while
1639040	1640040	ago.
1640040	1643360	Instead, Tyrion just hatches one bad plan after another.
1643360	1645560	And Daenerys keeps him on for some reason.
1645560	1649180	Let's go invade Casterly Rock, a place with no tactical advantage.
1649180	1653040	Let's not attack King's Landing now, before they can bolster their armies.
1653040	1654040	You're too valuable.
1654040	1655040	It's too great a risk.
1655040	1656040	You're too important.
1656040	1657040	Let's trust Cersei.
1657040	1661040	She's pregnant, which means she's good and trustworthy now.
1661040	1663040	Let's not go rescue Jon Snow.
1663040	1664040	He's not worth it.
1664040	1669040	Let's go hide in the fucking crypts while an army with the power to raise the dead is
1669040	1670040	attacking us.
1670040	1675040	He's bringing all the dead people back to life, and they put women and children in a
1675040	1678040	crypt with all the dead people.
1678040	1680040	So, brah.
1680040	1683040	Tyrion is smart, but I guess not that smart.
1683040	1688040	If you rewatch season 7, it seems like they're setting up a Tyrion-betrays-Daenerys twist.
1688040	1691040	Like, actually betrays her, not this piddling squirt of nothing.
1691040	1695040	A betrayal twist would have at least explained why his powers of deduction got pushed out
1695040	1696040	of a window.
1697040	1699040	You're not a monster.
1699040	1702040	Two seasons earlier?
1702040	1705040	My expectations have been subverted.
1706040	1707040	Kill me.
1714040	1721040	I kept waiting for anything Tyrion did this season to make sense, especially with regard
1721040	1722040	to Cersei.
1722040	1726040	You crossed the narrow sea with the intent of dethroning your sister.
1726040	1729040	How else did you see this ending?
1729040	1733040	I watched the people of King's Landing rebel against their king when they were hungry,
1733040	1735040	and that was before winter began.
1735040	1739040	Give them the opportunity, and they will cast Cersei aside.
1739040	1742040	Yes, a short but violent siege is bad.
1742040	1744040	Mass starvation is much better.
1744040	1749040	And Tyrion, why are you so horrified with the prospect of killing innocent or honorable
1749040	1750040	people all of a sudden?
1751040	1753040	Those are brave men knocking at our door.
1755040	1756040	Let's go kill them!
1756040	1761040	It's only because Dragon Lady bad that Tyrion has a completely out-of-character concern
1761040	1764040	for the innocence of King's Landing.
1764040	1769040	I saved this city and all your worthless lives.
1769040	1773040	And the opposing side, and this pity party for Cersei where he keeps trying to save her
1773040	1778040	life, even though it makes no sense for Tyrion to want to see his sister anything but dead.
1778040	1783040	The reign is over, but that doesn't mean your life has to end.
1783040	1784040	Why?
1784040	1786040	Why, why, why, why, why?
1786040	1787040	Why do you care?
1787040	1790040	Tyrion, you've given her like 200 chances to surrender.
1790040	1794040	Who cares that she's pregnant, which she has been for approximately two years and has
1794040	1796040	not yet started to show.
1796040	1797040	Weird that.
1797040	1801040	Tyrion was likely originally intended to be a corrupting influence on Daenerys and or
1801040	1807040	play up both his and her vindictive tendencies, especially after coming off his wildly successful
1807040	1810040	kill everyone in King's Landing speech.
1810040	1814040	I wish I had enough poison for the whole pack of you.
1814040	1818040	I would gladly give my life to watch you all swallow it.
1818040	1823040	Hence this red priestess stink eye here, foreshadowing that ultimately goes nowhere.
1823040	1826040	And I suppose this could have played nicely into the theme of vengeance as a self-destructive
1826040	1832040	force, but dang you Peter Dinklage, you're just so ding dong dang likable.
1832040	1837040	Sacrificing any gray area or moral ambivalence turns Tyrion into the worst thing he can be.
1837040	1838040	Boring.
1843040	1847040	And it begs the question, what does Tyrion even want?
1847040	1849040	Why do you want Cersei deposed?
1849040	1852040	Because it kind of seems like maybe you don't.
1852040	1854040	I don't want to destroy our family.
1854040	1855040	I never have.
1856040	1858040	Five seasons earlier?
1858040	1860040	How much of this show has there been?
1860040	1862040	I will hurt you for this.
1862040	1869040	The day will come when you think you're safe and happy and your joy will turn to ashes in your mouth.
1869040	1874040	Never mind the show dropping the Tysha subplot after season one or TV Shea getting murdered
1874040	1878040	or literally anything that would make you stop and have ambivalent feelings about Tyrion.
1879040	1881040	You may sit, Shafki, let's roll a joke.
1883040	1888040	Instead, Tyrion remains the ultimate centrist, the voice of reason in a crazy world, and
1888040	1892040	at long hellish last, in the end, comes up with the worst idea ever.
1892040	1897040	Who has a better story than Bran the Broken?
1897040	1901040	Yeah, so let's ignore the nonsense of A, this new system of government they've come up with.
1901040	1903040	I'm not sure I get a vote, but I.
1904040	1910040	B, the person on trial nominating the king and everyone being like, yeah, that's a good idea.
1910040	1913040	From now on, rulers will not be born.
1913040	1915040	They will be chosen.
1915040	1918040	On this spot are the lords and ladies of Westeros.
1918040	1923040	This speech is also a thesis of sorts on the nature of narrative.
1923040	1928040	I guess D&D decided that the show needed a thesis and also needed it to be self-congratulatory
1928040	1931040	instead of relevant to the story they wrote.
1931040	1933040	What unites people?
1933040	1934040	Armies?
1934040	1935040	Gold?
1935040	1937040	Flags?
1937040	1939040	Stories?
1939040	1943040	So Tyrion's thesis is about the importance of storytelling and writing and how writers
1943040	1946040	are the most important people alive and please give us an Emmy.
1946040	1952040	I've had nothing to do but think these past few weeks about our bloody history.
1952040	1954040	Boy, I'm sure glad that's over with.
1954040	1956040	Me too!
1956040	1958040	Yeah, but you know, I learned something today.
1958040	1962040	So the show ends with what once was its strongest character, not making decisions that make
1962040	1966040	sense but instead being carried along by the inertia of the plot.
1966040	1969040	I used to think you were the cleverest man alive.
1969040	1974040	No revenge quest against Cersei, no quest for power of his own, just the voice of common
1974040	1979040	sense who at some point on the boat ride over adopted a pacifist ideology and a 21st century
1979040	1981040	moral code.
1981040	1985040	So since themes are for 8th grade book reports, his character arc fizzles out in a little
1985040	1990040	puff of whatever, but Tyrion is not the worst done-by descendant of Lan the Clever in terms
1990040	1992040	of his ending.
1996040	1997040	Oh, Jaime.
1997040	2001040	The heel with a heart of gold, the man who sacrificed his honor to save countless innocents
2001040	2006040	from the madness of King Aerys by killing him and forever being saddled with the nickname
2006040	2007040	Kingslayer.
2007040	2011040	You all despise me, Kingslayer.
2012040	2016040	For a principal player, a point of view character, and arguably one of the series' protagonists,
2016040	2021040	you sure didn't have a point in the end.
2021040	2025040	Jaime was instrumental in precipitating the inciting action in the beginning, nearly killed
2025040	2029040	Bran and managed to make his way into most of the major battles in Westeros.
2029040	2033040	But after the beginning, he never really made much of a choice that impacted the story.
2033040	2037040	When you break it down, he mostly spent all of his time going back and forth to Cersei
2037040	2038040	doing her bidding.
2038040	2043040	And by Season 7, with good reason, it seems like he's at long last finally over Cersei.
2043040	2048040	But one key thing that is left out of the show is part of Maggy the Frog's prophecy,
2048040	2053040	that Cersei will be killed by the Valonqar, which means, like, little sibling.
2053040	2056040	Cersei grows up thinking that it's going to be Tyrion, but it is heavily foreshadowed
2056040	2058040	that it's supposed to be Jaime.
2058040	2062040	So I thought maybe this was going to be like a bait and switch, and that's why he was
2062040	2067040	really going back to King's Landing and he was going to kill Cersei, but instead he doesn't
2067040	2071040	even do that much and they both pointlessly get a rocks fall, everyone dies, death.
2071040	2076040	So Jaime ends up being like the Nick Carraway of Game of Thrones, affecting the plot not
2076040	2080040	at all, except for being a prisoner of war slash bargaining chip in the second and third
2080040	2084040	season and just kind of watching stuff go down, not really doing anything.
2084040	2085040	But here's the thing.
2085040	2089040	Jaime not driving any action doesn't need to be a bad thing.
2089040	2092040	Not every character has to have a utilitarian plot purpose.
2092040	2097040	Some characters have internal journeys, as we saw illustrated by Jaime in season three,
2097040	2099040	and that can make for great television.
2099040	2104040	Many have bemoaned a redemption arc ruined, but I actually agree with Nicolai Costa-Waldo's
2104040	2105040	take on Jaime.
2105040	2108040	I never saw him as a guy who needed redemption as such.
2108040	2112040	The whole Kingslayer thing on the surface was about him being dishonorable, so now he
2112040	2116040	needed to redeem himself because he did this horrible thing when, in fact, killing the
2116040	2118040	king was probably his proudest moment.
2118040	2120040	Jaime didn't need a redemption arc, per se.
2120040	2124040	He displayed his bravery and selflessness when he killed the Mad King and was forever
2124040	2125040	dishonored for it.
2125040	2129040	Jaime's story was more about learning to care about people who weren't his immediate
2129040	2132040	family, to grow beyond that Lannister, fuck you, got mine attitude.
2132040	2137040	A lion doesn't concern himself with the opinions of a sheep.
2137040	2141040	At some point, Jaime realized that Cersei didn't really love him, but just kind of
2141040	2145040	wanted to possess him, and that she didn't care about the type of person he was.
2145040	2148040	I told you no one walks away from me.
2150040	2152040	Are you going to order him to kill me?
2152040	2156040	If she thought about her brother slaying the Mad King at all, she saw it as a move to protect
2156040	2159040	their family, and not an act to prevent harm to the people of King's Landing.
2159040	2165040	Jaime's arc in Game of Thrones was one of self-discovery, of actualization, not redemption.
2165040	2169040	But there's no motivation behind him abandoning all and returning to Cersei.
2169040	2172040	It's not like he did something selfless and got dishonored again.
2172040	2176040	He did the right thing, showed up at Winterfell, and was more or less accepted, despite his
2176040	2177040	transgressions.
2177040	2180040	Pretty much everyone was on the path for giving him a second shot.
2180040	2181040	Brienne gets it in.
2181040	2185040	Hell, even Bran, the child he pushed out of a window, is like, you know, you had to do
2185040	2186040	you, babe.
2186040	2187040	I gotcha.
2187040	2190040	You won't be able to help us in this fight if I let them murder you first.
2195040	2200040	So all this affirmation happens, and then Jaime just kind of leaves.
2200040	2205040	She's hateful, and so am I.
2205040	2207040	A statement which is not supported by any of his actions.
2207040	2210040	Even pushing Bran out of a window was described as,
2210040	2212040	The things I do for love.
2212040	2215040	And that is why his ending is bogus.
2215040	2219040	Not because he had a redemption arc ruined, but because he kind of forgot about rediscovering
2219040	2223040	himself when there was nothing going on in the story that would actually make him go
2223040	2224040	back on that.
2224040	2226040	Jaime is not hateful.
2226040	2229040	The revelation in season 3 is a testament to how he never was.
2229040	2231040	So what the hell is this?
2231040	2233040	She's hateful.
2235040	2236040	And so am I.
2236040	2241040	And then in the penultimate episode, Jaime gets, well, not the worst line, but his worst
2241040	2242040	line.
2242040	2246040	If not for yourself, if not for her, then for every one of the million people in that
2246040	2248040	city, innocent or otherwise.
2248040	2251040	To be honest, I never really cared much for them.
2251040	2253040	Innocent or otherwise.
2253040	2260040	Then why the fuck did you sacrifice everything, your reputation, your honor, your oath, to
2260040	2262040	stab and eat the Burn Man?
2262040	2265040	And I don't want to hear any of the ease and denial crap.
2265040	2266040	This is the end of the show.
2266040	2268040	We ain't got time for that.
2268040	2272040	Jaime's narrative being totally character driven would have been fine if it went anywhere.
2272040	2277040	But like Tyrion, like Jon Snow, Jaime's motivation is driven into fucking nonsense in the service
2277040	2281040	of keeping him sympathetic relative to Dragon Lady bad.
2281040	2284040	We know what kind of a guy Jaime is based on his actions.
2284040	2285040	So for him to say,
2285040	2287040	She's hateful.
2288040	2290040	And so am I.
2290040	2294040	Without even really giving us a why only serves as a cheap twist.
2294040	2297040	It's surprising, but not unexpected, isn't it?
2297040	2300040	After all, he's explaining his motivation with words.
2300040	2304040	And if motivations are explained with words, that means they de facto make sense.
2304040	2309040	Telling the audience the thing makes sense with your dialogue while not supporting the
2309040	2315040	thing with the character's actions is kind of a trend in the last season of Game of Thrones.
2318040	2324040	So Cersei Lannister, one of the greatest villains not just in TV history, but arguably in all
2324040	2326040	of literature.
2326040	2330040	She sure didn't have much to do by the end there, did she?
2330040	2334040	All of Tyrion's stupid mistakes and wildly out of character and unmotivated sudden trust
2334040	2339040	in his evil sister serve the purpose of keeping Cersei in the game.
2339040	2346040	Perhaps you'll remember I chose to help with no promises or assurances from any of you.
2346040	2351040	Which feels even more insulting given that Cersei, close blowing up the Sept, faces no
2351040	2356040	consequences nor has a secret evil plan beyond staring on a balcony and glowering over my
2356040	2358040	domain with a glass of wine.
2358040	2359040	Which, look, I get it.
2359040	2360040	That's my usual Friday night.
2360040	2365040	But, um, that's pretty much all she does in season 8.
2365040	2368040	You know, besides, you know, the thing with Hot Topic Pirate.
2368040	2371040	You might be the most arrogant man I've ever met.
2373040	2375040	I like that.
2375040	2380040	And then the show makes Cersei sympathetic, but it's like in the most condescending way possible.
2380040	2383040	I want our baby to live.
2383040	2385040	Don't let me die, Jane.
2385040	2387040	Please don't let me die.
2387040	2392040	Cersei is one of the most horrendous characters committed to film.
2392040	2397040	Yet somehow at the end she's just a girl and she's just scared and he's there to comfort her.
2397040	2400040	What?
2405040	2410040	When the plot says so, Cersei's armies instantly crumble and she dies a weirdly sympathetic
2410040	2414040	death in Jaime's arms who is here for some reason in a Rocks Fall, Everyone Dies situation
2414040	2419040	that feels more on par with like a C-tier Disney movie and less in line with someone
2419040	2420040	who once said,
2420040	2422040	Power is power.
2423040	2426040	But more than this, it's important to look at Cersei for who she is presented as a monarch
2426040	2430040	and what the show built her up to be before Daenerys torched King's Landing.
2430040	2436040	Let the monsters kill each other, and while they battle in the north, we take back the
2436040	2437040	lands that belong to us.
2437040	2442040	The big thing here, and I mean big thing as a defining action in Cersei's rule, is her
2442040	2447040	effectively blowing up the in-universe equivalent of the Vatican as a means to wipe out her
2447040	2452040	enemies and flex on how many fucks she gives, which is… zero.
2452040	2456040	And yes, this scene was awesome, and yes, it feels like something someone as reckless
2456040	2460040	and vengeful as Cersei would do when pushed to the utter brink.
2460040	2461040	But.
2461040	2462040	But.
2462040	2467040	Prior to season 4, most of the plot of Game of Thrones is centered around the direct consequences
2467040	2472040	of one guy, Ned Stark, getting his head lopped off in what pretty much everyone who wasn't
2472040	2476040	the child who ordered it, even Cersei, felt was a massive dick move.
2476040	2481040	Meanwhile, post season 6, Cersei not only blew up one of the largest buildings in Westeros
2481040	2485040	and wiped out a decent chunk of the Faith and its leader, but also decimated one of
2485040	2490040	the most powerful, wealthy, and well-liked families in Westeros with a lot of loyal bannermen,
2490040	2494040	and apart from a few stray remarks from other characters,
2494040	2502040	But your sister has done things I wasn't capable of imagining.
2502040	2507040	this major act of mass violence, it just kinda, we just move on.
2507040	2508040	It's, nobody cares.
2508040	2510040	There are no consequences for this.
2510040	2512040	She's crowned, and life goes on.
2512040	2517040	The only person opposing her is Dragon Lady, who would have invaded no matter who was on the throne.
2517040	2519040	So let's break this down.
2519040	2523040	Why in God's name would they set up Cersei finally exacting revenge on the faceless masses
2523040	2528040	that threw literal feces on her during her walk of shame and weeding out religious extremism
2528040	2533040	with impunity, only to conveniently forget the internal logic of much smaller scale political
2533040	2537040	issues like Ned Stark's execution causing massive upheaval?
2537040	2540040	Not to mention, again, wasting someone like Lena Headey's talent.
2540040	2542040	I wanted those elephants.
2542040	2544040	Well, here's why.
2544040	2547040	It's because of how Season 8 ends.
2547040	2554040	This one act necessitates that, yes, Cersei would be considered an unparalleled, top-tier,
2554040	2556040	Megatron-grade tyrant.
2556040	2561040	She couldn't have wiped out all of the Faith Militant, or even most of them,
2561040	2565040	let alone the countless followers of the Seven in Westeros who would feel understandably
2565040	2568040	very pissed and personally attacked by this maneuver.
2568040	2572040	This is also to say nothing of all the people who saw her as 100% illegitimate or believed
2572040	2576040	that her children were inbred bastards, or who would want revenge on her for what she
2576040	2578040	did to House Tyrell.
2578040	2581040	So these dum-dums wrote a juicy situation which in theory could have led to some of
2581040	2586040	the best acting from one of their most talented players, but the problem here is that it would
2586040	2590040	have revealed her as a tyrant, leading to a situation where literally anyone with a
2590040	2595040	claim to the throne would be looked upon by the people of King's Landing as a liberator.
2595040	2599040	Which leads us to the person who, at least as far as everyone knows, has the best claim
2599040	2605040	to the throne, and wouldn't you know it, has already defined herself as a liberator.
2605040	2610040	So if Dragon Lady shows up riding some dragons like, oh hey, hi, I'm here to liberate y'all,
2610040	2615040	I'm the breaker of chains, love me please, it's fair to say that D&D created a situation
