start	end	text
1195360	1197920	He doesn't believe in whites being superior.
1197920	1202000	So Richard Spencer is not a white supremacist, apparently.
1202000	1204640	He's a white nationalist, according to Lauren Southern.
1205520	1206400	However...
1206400	1208400	And I don't identify as a white nationalist,
1208400	1211280	just to, you know, let that be known.
1211280	1213760	History is often a zero-sum game.
1213760	1217360	History is often about subordination and domination.
1217360	1220160	And it's about patronage and so on.
1220160	1222000	And if we want to try to get away from that
1222000	1223920	in order to be ideologically pure,
1223920	1226640	like, oh, every ethnicity will have its little state,
1226640	1228080	we're not going to really go anywhere.
1228080	1231840	So why would Lauren Southern lie about Richard Spencer's views?
1232480	1237360	Well, because she's trying to downplay the seriousness and danger of white supremacy,
1237360	1240000	because that furthers her political goals.
1240000	1243120	If more people believe there are no more white supremacists,
1243120	1247040	that's fewer people who could recognize her as a white supremacist.
1247040	1250480	You see, Lauren Southern pals around with various, air-quote,
1250480	1252320	identitarian groups,
1252320	1256800	most famously to interfere with migrant rescue operations in the Mediterranean.
1256800	1260480	She shared false information about the Quebec City mosque shooting on Twitter,
1260480	1263440	incorrectly identifying the shooters as Syrian refugees
1263440	1265920	when it was actually a far-right white nationalist.
1265920	1270880	She made a video popularizing the white supremacist Great Replacement conspiracy theory,
1270880	1274720	the same conspiracy theory that inspired the Christchurch mosque shootings
1274720	1277040	that killed more than 50 people in New Zealand.
1277040	1281120	The shooter titled his manifesto The Great Replacement, even.
1281760	1286160	And Lauren Southern is a frequent guest on Steven Crowder's show.
1286160	1290720	So again, we have someone who all but calls themselves a white nationalist,
1290720	1294240	who downplays the existence of Nazis and white supremacists
1294240	1296960	while sharing their conspiracy theories,
1296960	1299360	being supported by Steven Crowder.
1299360	1302800	But again, let's not jump the gun here, we'll keep going.
1302800	1306400	So this is Milo Yiannopoulos, a former Breitbart contributor
1306400	1310400	who was fired from everything after he said child abuse was okay.
1310400	1313600	Here he is serenading a bunch of neo-Nazis in a bar,
1313680	1316400	including Richard Spencer throwing a Hitler salute.
1316400	1319440	Now in 2017, a bunch of Breitbart emails were leaked,
1319440	1323840	which included, among other things, a leak of Milo's password for his email account,
1323840	1326720	which was Long Knives 1290.
1326720	1329360	Now that's a reference to both the Night of the Long Knives,
1329360	1332160	which was a Nazi purge carried out by Adolf Hitler,
1332160	1334880	and the 1290 Edict of Expulsion,
1334880	1338160	a royal decree issued by King Edward I of England,
1338160	1340800	expelling all the Jews from his kingdom.
1340800	1342560	Well, you know the punchline by now.
1342560	1346640	Milo Yiannopoulos has appeared several times on Steven Crowder's show.
1346640	1349040	Moving on, this chap is Gavin McInnes,
1349040	1351760	founder of the far-right gang The Proud Boys.
1351760	1353360	And this is an easy one.
1353360	1356800	Here's a clip of Gavin McInnes calling himself anti-Semitic
1356800	1359200	and sympathizing with Holocaust deniers.
1360000	1362160	This is basically a brainwashing trip.
1362160	1365440	I mean, I think the Israeli government paid for this,
1366000	1369200	and we had donors too, but I think they were mostly Israelis
1369200	1372880	that assume that we're going to listen to all this shit, we get fed.
1373600	1377120	And that is having the reverse effect on me.
1377120	1380800	I'm becoming anti-Semitic, like at the Holocaust Museum,
1381680	1384160	or as I call it, the Holocaust Museum.
1384160	1384880	No, I'm just kidding.
1386720	1388480	Yeah, like at one point the tour guide goes,
1388480	1391040	you know, and there are people who think that this didn't happen.
1391680	1397520	And I felt myself defending the super far-right Nazis,
1397520	1400080	just because I was sick of being so much brainwashing,
1400080	1404080	and I felt like going, well, they never said it didn't happen.
1404080	1407040	What they're saying is that it was much less than six million,
1407040	1410880	and that they starved to death and they weren't gassed,
1410880	1413040	that they didn't have supplies.
1413040	1417440	Notice how Gavin downplays the actual beliefs of Holocaust deniers there,
1417440	1421440	because of course there are people who think the entire Holocaust was a hoax,
1421440	1426080	including Andrew Anglin from the white supremacist website The Daily Stormer,
1426080	1428080	who wrote about this clip saying,
1428080	1431920	I completely 100% endorse these statements.
1431920	1435200	Obviously I disagree with the Holocaust happened part,
1435200	1437600	but we can't really expect him not to say that
1437600	1440400	while he's literally still in Israel filming this.
1440400	1444720	Everything else is totally and completely on point and awesome,
1444720	1447280	which is not a sentence you want The Daily Stormer
1447280	1450000	to ever say about any of your opinions.
1450000	1454080	Gavin McInnes also wrote about Richard Spencer back in 2016 saying,
1454080	1458560	I've known alt-right pioneer Richard Spencer since he got me the job at this magazine,
1458560	1464000	and even he, the head of the snake, comes across as perfectly reasonable in conversation.
1464000	1467680	He doesn't think non-whites can be included in a harmonious America,
1470480	1470980	but...
1473280	1476080	everything else on his plate is relatively civil.
1476080	1479680	Gavin McInnes has also provided a platform to Jared Taylor.
1479680	1482640	The main researcher on this is Edward Rubenstein.
1482640	1485760	He's a very well-known economist and researcher.
1485760	1488240	He did a really fantastic, thorough job.
1488240	1488740	So...
1488740	1491040	Sounds like, uh, hee-hee!
1492240	1494240	What's this?
1494560	1497760	That's my, uh, Jew, uh, finger thing.
1497760	1503120	And of course, Gavin McInnes is a frequent contributor to Steven Crowder's show.
1503120	1507520	All right, next up we have Owen Benjamin, who is a comedian, apparently.
1507520	1510960	Now, Owen has been on Steven Crowder's show multiple times,
1510960	1515440	even filling in as host of the show when Steven Crowder wasn't available.
1515440	1518880	So you'd imagine he's a pretty trusted person around those parts
1518880	1521200	if they let him in the driver's seat, right?
1521200	1526720	Now, Owen Benjamin also does his own internet web streams on YouTube,
1526720	1529520	and let's take a peek at one of those.
1529520	1531040	But it wasn't gas chambers.
1531040	1533760	It wasn't extermination based on race.
1533760	1539440	What if it literally was work will set you free work, motherfucker,
1540000	1540720	and they died?
1542160	1544400	That's infinitely more probable.
1544400	1546400	If you're a dictator, right?
1547280	1549120	Why would you kill your slaves?
1549120	1551680	Well, I have another artist that I'm a big fan of.
1551680	1552180	Hitler.
1552640	1553840	He was a great artist.
1553840	1555200	He was also a great writer.
1555200	1556880	Mein Kampf and all his paintings.
1557440	1560080	Really, what he was trying to do is clean Germany.
1560080	1562560	Clean it of the parasites, of the fleas.
1562560	1564480	He was not, he did not hate Jews.
1564480	1565440	He hated filth.
1565440	1566880	And he was trying to clean up.
1566880	1569920	And I'm not sure there's much I need to say about that.
1569920	1572640	So, to Steven Crowder, I'll say this.
1572640	1575680	If you want people to not call you a racist,
1575680	1579520	maybe stop inviting racists onto your YouTube show that you do.
1579520	1584560	And if you're confused about who is and is not a white nationalist or white supremacist,
1584560	1586720	maybe before whining about the left,
1586720	1591600	you should ask the various guests who come on your show to define those terms.
1591600	1594560	Because if sympathizing with white nationalism,
1594560	1598960	platforming racists, sharing white supremacist propaganda,
1598960	1600560	questioning the Holocaust,
1600560	1606240	and outright saying Hitler was good don't make you a racist or white supremacist,
1607200	1608320	what does, man?
1609200	1610800	A big swastika tattoo?
1610800	1612480	That's, that's it, isn't it?
1612480	1615360	It's just the big swastika tattoo.
1615360	1620480	Now, I'm certain some Steven Crowder fans will protest my last two examples there,
1620480	1622720	Gavin McInnes and Owen Benjamin,
1622720	1625760	because they've quite recently been in trouble with Blaze TV,
1625760	1628800	the network that hosts Steven Crowder's show.
1628800	1632160	So if the network doesn't want to work with those people anymore,
1632160	1638000	surely that's them being disciplined for their racist behavior and all is well, right?
1638000	1640720	However, Steven Crowder was apparently worried
1640720	1645680	about being made out to be some network stooge following Blaze TV orders.
1645680	1648720	So he addressed both of these controversies publicly.
1648720	1650000	Listen, this is Mug Club.
1650000	1651440	We're funded by you, the viewer at Mug.
1651440	1655120	So let me tell you, I had no idea about a lot of this stuff going on, okay?
1655760	1657360	I've never worked for the Blaze.
1657360	1658560	I don't work for the Blaze.
1659200	1660560	This is something that is separate,
1660560	1663520	where we actually allow you to get more value for your, for your buck,
1664320	1666560	in agreement with CRTV, I guess now the Blaze,
1666560	1668080	where you get more content.
1668080	1671360	I didn't know about the Gavin McInnes situation until you did.
1671360	1672400	And let me be really clear,
1672400	1677200	Gavin McInnes has an open seat and invitation to work on a permanent basis here on this show,
1677200	1678080	if he wants to.
1678080	1680560	He knows, and by the way, also do his own show.
1680560	1682560	And by the way, it has, I want to make sure this is really clear.
1682560	1684880	Owen was never let go from this show.
1685520	1688640	Owen could still write for this show, and I, I love him.
1688640	1690160	Owen's a brilliant writer.
1690160	1694240	So Steven Crowder is happy to keep working with these people, apparently.
1694240	1697440	Gavin McInnes is still guesting on his show.
1697440	1700320	So, you know, make of that what you will.
1700320	1704160	I'd like now to talk about Steven's various comparative statements
1704160	1707520	he makes throughout the video, so let's have a listen to a couple.
1708080	1712400	"...is believing that the United States is believing that America is superior to Mexico.
1712400	1713200	White supremacy.
1714000	1717280	What if I were to say that white people, on average,
1718080	1721760	have higher IQ scores than black people, on average?
1722560	1724320	Is that white supremacy?"
1724320	1729600	So then, did those statements what Steven Crowder said make him a racist?
1729600	1734560	Well, I've actually explained my thoughts about such statements in a fairly old video of mine,
1734560	1736640	but I'll give the short answer here.
1736640	1739920	It depends on the context in which the statements were said.
1739920	1741760	So let's take the statement,
1741760	1745680	black people, on average, have lower IQ scores than white people.
1745680	1749040	Now, I'm gonna say that again in two different contexts,
1749040	1750960	and we'll see if we can spot the difference.
1751600	1752560	So, okay.
1752560	1756400	Black people, on average, have lower IQ scores than white people.
1756400	1761200	However, lacking equal access to education and economic equality,
1761200	1764880	this statement by itself can tell us nothing about any possible differences
1764960	1768480	in cognitive ability inherent to black and white people.
1768480	1773360	Without accounting for social influences, this statement is practically useless.
1773360	1777040	I could also go into the problems with IQ as a measure of intelligence here,
1777040	1779520	and especially the problems with the book The Bell Curve,
1779520	1782960	which is the study mentioned in the screenshot that Crowder shows.
1782960	1786560	However, I have a whole video dedicated to The Bell Curve in the works,
1786560	1790560	and I don't want to spoil it here, so I'll just say it's rubbish.
1790560	1794800	So okay, let's say that phrase again, but in the manner of a clueless racist.
1794800	1799040	I want to create a white ethnostate and kick out all of the black people,
1799040	1802960	because black people, on average, have lower IQ scores than white people.
1802960	1807360	You see, I said the same words, Stephen, but in a different context.
1807360	1810800	Whether or not they're racist depends on why you're saying them.
1810800	1815760	So I suppose the pertinent question here is, in what context did you say them?
1815760	1818880	Well, they're in a video, the goal of which is to create the impression
1818880	1823120	that the terms white nationalist and white supremacist have lost all their meaning,
1823120	1827360	hosted on the same channel that features you doing things like this.
1827360	1828880	Of China.
1828880	1830880	Miso Hori!
1840880	1847040	So, yes, I deem this a pretty racist context in which to say those statements.
1847040	1850000	Running defense for racists is racist.
1850640	1855920	Platforming other racists on your show is racist, and I shouldn't have to say this one,
1855920	1860240	but dressing up as offensive racial stereotypes is racist.
1861680	1864160	Steven Crowder's a racist, basically.
1864160	1869280	Now, to be fair, Crowder's show's primary purpose seems not to be any conscious attempt
1869280	1871840	to spread racist beliefs for their own sake.
1871840	1877120	The show is more of a hastily constructed anti-left stream of consciousness,
1877120	1881360	made for what can be mockingly referred to as entertainment purposes.
1881360	1885760	It turns out, though, that if you're in the anti-left pro-right entertainment game,
1885760	1888880	there's just a lot of overlap with being a racist.
1888880	1890800	And there's no difference functionally,
1890800	1894160	so, you know, it doesn't really matter whether they're consciously doing it or not.
1894160	1896480	To paraphrase a famous quote here,
1896480	1899600	don't believe people when they tell you who they are.
1899600	1902480	Believe people when they show you who they are.
1902480	1905760	Steven Crowder can disavow racism a million times,
1905840	1910720	and it won't mean anything if you keep sharing his platform with racists and white nationalists.
1910720	1916240	All we can infer from that is that either he's a racist or a white nationalist or a white supremacist.
1918560	1920640	Thanks a lot for watching, folks.
1920640	1923920	There is one question left I haven't answered yet, however.
1923920	1928880	Who should be banned by all those evil, lefty tech CEOs?
1929600	1934720	Well, I happen to think that every white nationalist, white supremacist or racist,
1934720	1937840	should be banned by every website they ever use.
1937840	1940800	Now, how can I defend thinking that?
1940800	1943760	Well, it's because I believe in freedom of speech.
1943760	1948080	The idea that you can have a social media community in which everyone,
1948080	1953680	racists and racial minorities, homophobes and gay people, transphobes and trans people,
1953680	1959520	all freely discourse and speak their minds equally, is a doomed liberal fantasy.
1959520	1962560	If you let the KKK recruit on your website,
1962640	1967360	black people, understandably, aren't gonna trust you and they'll not want to use it.
1967360	1973280	If you signal to your user base that harassing gay people doesn't violate your terms of service,
1973280	1977760	gay people will not feel safe expressing themselves on your platform.
1977760	1982320	This is a much worse affront to free speech than banning a few bigotses.
1982320	1987440	We can't be tolerant of intolerance here, we have to pick a side, necessarily.
1987440	1992800	Trying to keep everyone on board, which is the strategy favored by capitalist corporations,
1992800	1996480	obviously, as that's the scenario with the theoretical largest return,
1996480	1998720	even if it's unworkable in the long run,
1998720	2004400	can only lead to that community eventually being overrun by intolerant bigots.
2004400	2007280	So the solution is fairly simple, really.
2007920	2009040	Just ban them all.
2009680	2012560	And if they don't like it, fuck them.
