start	end	text
0	29960	Death, death, death, death, death, is the only thing everyone fears.
29960	33120	And the only thing that gets me off.
33120	35440	Hello, my devilish darlings.
35440	42240	I am Lenora LeVay, your hostess of horror, your rare and radiant maiden of mayhem.
42240	46560	Tonight's program is about the death of meaning itself.
46560	48920	The story is rather simple, really.
48920	53280	The he's become she's, and the she's become he's, and those in the middle are them and
53280	54280	them.
54280	59920	And then, my dreadful dears, the western world shall surely succumb to renewable energy, affordable
59920	63480	health care, and video games for lesbians.
63480	71160	But there's one man who stands in the way, the villain of tonight's thriller, a meddling
71160	78200	little cipher of a man, a man who prefers light to darkness, reason to madness, order
78200	79200	to chaos.
79200	81600	Can you imagine?
81600	88360	His name is Ben Shapiro, and his catchphrase, facts don't care about your feelings.
88360	90600	Can our heroine put a stop to this?
90600	93400	Well, I'm just the executioner.
93400	96160	You, my vile viewers, must be the judge.
118360	129040	Hi girls, it's me, Ms. Points, Mademoiselle Poin.
129040	132200	Words, words, words, what do they even fucking mean?
132200	136760	Well, I don't know, and I don't care, but we have to talk about it anyway, because of
136760	138480	a boy named Ben Shapiro.
138480	140280	So who is Ben Shapiro?
140280	145840	Well, he's a popular conservative pundit, the editor of the Daily Wire, and the auteur
145840	150480	behind such criterion-collection classics as Ben Shapiro Destroys Yale Snowflakes, Ben
150480	155200	Shapiro Destroys Every College Snowflake Part 7, Ben Shapiro Crushes Anti-Free Speech College
155200	159720	Snowflake, and Ben Shapiro Destroy Caitlyn Jenner.
159720	165600	Ben's especially notorious for his provocative, controversial, politically incorrect, snowflake-smashing
165600	168240	refusal to call transgender people by their pronouns.
168240	171560	I'm willing to call Caitlyn Jenner Caitlyn Jenner, I'm not willing to call Caitlyn Jenner
171560	172560	a she.
172560	177120	It's surprising, you might think, for a person so insistent on the value of civil discussion.
177120	179120	And let's be civil, right?
179120	180280	That's the tone of the day.
180280	181280	I'm a fan.
181280	185880	But Ben seems to abandon civility in his discussions of trans people, preferring to fall back on
185880	186880	his edgier mantra,
186880	188560	Facts don't care about your feelings.
188560	192120	And you know, on this one point, I actually agree with Ben.
192120	195000	It's true, facts don't care about my feelings.
195000	199440	I dislike this trend toward regarding as a conclusive argument the proposition,
199440	201600	This makes me feel invalidated.
201600	206120	Because sometimes, things that make you feel bad, are true.
206120	211200	It makes me feel bad that I used to be a sexy, sexy boy with rippling abs, but too fucking
211200	216160	bad for me, because there I am, indelibly exhibited on YouTube for everyone to gawk
216160	217160	at forever.
217160	219400	Mm, I was a yum-yum though.
219400	220780	Build me a time machine, doc.
220780	223280	We call this auto-androphilia, nurse.
223280	224280	What can I say?
224280	225280	I like younger men.
225280	226440	I'm a cougar.
226440	227440	In tiger's clothing.
228440	230960	So look, I want to be treated like an adult.
230960	232600	I don't want to be indulged.
232600	235480	If I'm delusional, I want to be disillusioned.
235480	239360	I don't want people lying to me just to protect whatever deranged fantasy stories I need to
239360	241400	tell myself to make it through the night.
241400	245200	It's probably just dry down there, they're just ingrown hairs.
245200	248240	I'm sure plenty of healthy people have blood in their urine.
248240	252520	I don't want my gender to be tolerated in the way that liberal Christians tolerate other
252520	254920	of course false and heathen religions.
254920	257320	I am an evangelical transsexual.
257320	259000	I don't want toleration, dammit.
259000	260000	I want converts.
260000	261000	Excuse me, sir.
261000	263760	Do you have a moment to talk about my woman head?
263760	264760	Sure.
264760	265760	Go ahead.
265760	266760	Touch it.
266760	267760	So look, Shapiro.
267760	268760	Benny.
268760	269760	Baby.
269760	272360	I invite you to disenchant all of my fairy tales.
272360	277800	To melt away every crystal of my snowflakery and henceforth dispense only the most scalding
277800	278800	tea.
278800	279800	Alright, big boy?
279800	281160	Let's have it.
281160	282920	I'm willing to call Caitlyn Jenner Caitlyn Jenner.
282920	285200	I'm not willing to call Caitlyn Jenner a she.
285200	286200	Because you can't change her sex.
286200	287200	You can change her name.
287200	288200	Caitlyn Jenner is a man.
288200	289200	A biological man.
289200	292600	And if he were born with a high dosage of estrogen in his bloodstream, he would also
292600	293600	not be a woman.
293600	294600	Right.
294600	295600	You are determined by your chromosomes.
295600	300680	So the argument is that what it means to be a she is to have a normal female karyotype,
300680	302800	that is, XX sex chromosomes.
302800	307640	And if you don't have that karyotype, then you're not a she, and to call you she would
307640	309400	be tantamount to a lie.
309400	314960	I was just wondering what you see the detriment of society, like why we can't let a transgender
315040	317040	like woman be called she or something.
317040	318400	Because it is a lie.
318400	322720	So since you think that calling a trans woman she is a lie, and you think that what it means
322720	328600	to be a she is to have a normal female karyotype, then you must think that when we call a trans
328600	332540	woman she, we are saying that she has a normal female karyotype.
332540	337920	But hold on, I'm a transgender woman and I've never claimed to have a normal female karyotype,
337920	344200	and yet my friends, lovers, and most strangers call me she, her, miss, ma'am, girlfriend,
344200	348720	ladies, good girl, good girl, just like that, don't stop, don't stop.
348720	351120	Are all of us deluded about my biology?
351120	352120	No.
352120	357680	It is not I who misunderstands biology, Ben Shapiro, it is you who misunderstands language.
357680	362240	You have deceptively framed the debate as a debate about biology, which it is not.
362240	364080	We all agree on the biology.
364080	370360	The actual subject of the debate is the proper use of words, such as he, she, man, and woman.
370360	373520	But how do we decide on the correct way to use a word?
373520	378240	Well there are two kinds of arguments we could make, descriptive or prescriptive.
378240	382840	If we take the descriptive approach, then what we must do is act like anthropologists
382840	388080	and study the way a word, for instance she, is used by a linguistic community, and whatever
388080	390480	the social convention is is what's correct.
390480	394280	But if we take the prescriptive approach, then we must make an argument about the way
394280	400000	the word she should be used, meaning we either defer to an authority such as the dictionary,
400000	403760	or my ruler on your wrist, you naughty boy, or we must have some goal that we want to
403760	407920	accomplish by approving some uses of the word and prohibiting others.
407920	411920	Now if we take the descriptive approach, you lose, Ben Shapiro, because most people call
411920	413920	me she, and that's all there is to it.
413920	419640	What's more, your usage of a she and a he is ungrammatical, you don't put an article
419640	420640	before a pronoun.
420640	422840	That's not how pronouns work, you silly dum-dum.
422840	427760	Also, human sex chromosomes were discovered in 1905, while the English pronouns he and
427760	432320	she originate in the Proto-Germanic language spoken during the pre-Roman Iron Age of Northern
432320	434760	Europe beginning around 500 BCE.
434760	438960	Therefore, by insisting that the singular third-person pronouns of the English language
438960	444160	refer specifically to karyotype, it is you, and not I, who is breaking from linguistic
444160	445800	tradition, Ben Shapiro.
445800	451360	However, as a trans woman, it's not generally in my interest to defer to traditions.
451360	454160	So let's try out a prescriptive approach.
454160	458880	Without simply appealing to the way a word is already used, how do we decide how a word
458880	461000	should be used?
461000	465960	Language is by nature ambiguous, and the way we attempt to disambiguate it is often motivated
465960	467400	by political goals.
467400	471840	Ben Shapiro thinks we should not call trans women she because his political goal is to
471840	477160	reinforce rigid conservative gender roles, whereas I think we should call trans women
477160	482240	she because my political goal is to live in a society where I can achieve the same level
482240	484600	of sadness and dysfunction as everyone else.
484600	488440	It's analogous to the debate about same-sex marriage from a decade ago.
488440	492360	Opponents argued the dictionary and legal definition of marriage was union between a
492360	499080	man and a woman, and the definition shouldn't be changed because… it's the definition.
499080	501080	And how am I supposed to explain to my child?
501080	505400	And on the other hand, gay people argued that the definition should be changed, because
505400	509400	they wanted to achieve the same level of sadness and dysfunction as everyone else.
509400	514400	And they succeeded, because as it turns out, you can in fact change the definitions of
514400	515400	words.
515400	519240	The dictionary is simply a usage guide, it's not the bible, and for that matter you can
519240	520240	change the bible.
520240	522960	I mean have you read the contemporary English version?
522960	525200	The prose is atrocious, appalling.
525200	526440	I won't stand for this.
526440	530280	But unlike the debate about gay marriage, the question about trans womanhood is more
530280	532440	than just a political and legal dispute.
532440	536880	It seems to me that whatever Church, State, and Merriam-Webster decide, trans women already
536880	538840	are and will continue to be women.
539000	543760	And to see why, I want to elaborate on an argument posed to Ben Shapiro by my sometime
543760	545320	rival Blair White.
545320	549720	Yes, even though she's one of the YouTubers whomst is bad.
549720	554080	The debate begins with Ben Shapiro asserting his usual position that pronouns are used
554080	557520	to designate so-called biological men and biological women.
557520	561800	Blair responds by observing that Ben's way of using pronouns is in her case completely
561800	562800	impractical.
562800	566880	Well if you and I were to go to a business dinner, or any kind of dinner, and you were
566880	571200	meeting me at a restaurant, and I was there first, and I was in an orange shirt, and you
571200	575440	had to tell, you know, the host, I'm here to meet my friend, Blair, and they said okay,
575440	579720	and you had to describe me to take me to the table, um, you wouldn't say the man in the
579720	582240	orange shirt, you would say Blair, you would say her over there.
582240	585640	Ben then responds saying, I think there's some truth to that, meaning that I think that
585640	589880	there is a utility to the use of pronouns, but that's not quite the same as suggesting
589880	593360	that a transgender woman is a she in the objective sense.
593360	596800	And Blair responds to that with what I think is a very good analogy.
596800	601440	For instance, if someone were to adopt children, there's no biological basis for calling them
601440	604800	that kid's parents, because they're not, like they're just literally not, there's no link
604800	609520	at all biologically, but there is a social reason to do it, and there's a legal reason to do it.
609520	611160	Let's expand on that analogy.
611160	614640	Suppose you're an adoptive parent, and you're arguing with someone who says your adopted
614640	618360	child isn't really your child, and you aren't really a parent.
618360	622720	As evidence, they point to the dictionary definition of parent, one that begets or brings
622720	624120	forth offspring.
624120	629080	You did not beget or bring forth offspring, they argue, therefore you are not a parent.
629080	630960	Facts don't care about your feelings.
630960	635760	No matter how much you love and care for this child, you'll never be anything but a glorified kidnapper.
635760	640360	I think it's clear that the person who makes this argument is being uncivil, yes, being
640360	644000	provocative, controversial, politically incorrect.
644000	646040	But they're not just impolite.
646040	648100	They're also wrong.
648100	653400	Because an adoptive parent is, socially and functionally, just as real a parent as a biological
653400	657840	parent, and to say otherwise is not just rude, it's false.
657840	660480	So what do you have to say to that, Ben Shapiro?
660480	663840	I would say that we actually do have different descriptions for adoptive parents than biological
663840	664840	parents, right?
664840	668120	You'll say in shorthand that they're parents, because they're all different types of parents,
668120	669880	but we do say adoptive parents.
669880	670880	Right.
670880	671880	Adoptive parents.
671880	673920	An entirely valid type of parent.
673920	676720	To call them parents is not a lie.
676720	681940	And then the question becomes, okay, exactly as the context that you were suggesting matters,
681940	683580	in what context are we talking about the parents?
683580	684820	Are we talking about a PTA meeting?
684820	689260	Okay, this person is the legal guardian, and therefore the parent, because parenting has
689260	690260	two aspects, right?
690260	693940	There's the biological parentage, and then there is the actual role of parenting.
693940	698140	So yes, there are some contexts where we do need to distinguish between biological and
698140	699140	adoptive parents.
699140	703380	For instance, if a doctor is assessing a child's risk of some hereditary disease, they need
703380	705740	to know if the parents are adoptive or biological.
705740	710660	But at the PTA meeting, and in most other contexts, it doesn't matter in the slightest.
710660	714380	In the dinner conversation, the same thing sort of holds true, meaning there is the biological
714380	718260	role of woman, which you are not, and then there is the, you look like a woman, which
718260	721960	is, I'm gonna describe you as a woman to the waiter when he comes to direct me to the table.
721960	726300	Just when Ben seems on the cusp of having a breakthrough, he and Blair pause their argument
726300	729860	to congratulate themselves on how civil their discussion is.
729860	734620	From what I've seen, a lot of your interactions with trans people, they always end up kind
734620	735620	of ugly.
735620	736620	You know what I mean?
736620	737620	Yeah.
737620	738620	There was the, I think the person's name was Zoe Tur.
738620	740620	There was the threat of physical violence.
740620	742420	What are your genetics, sir?
742420	745020	You cut that out now, or you'll go home in an ambulance.
745020	748860	Yeah, I mean what's hilarious about this, Blair, is literally the exact same thing that
748860	752940	I'm saying to you right now is exactly what I said to Zoe Tur on the air.
752940	755660	But that's not exactly true, is it Ben?
755660	757820	Zoe threatened you after you called her sir.
757820	760700	And you didn't call Blair sir, did you?
760700	762460	Why did you call Zoe sir?
762460	767620	What kind of reaction were you hoping to elicit, oh distinguished destroyer of snowflakes?
767620	770300	I suppose you were just sticking to the facts.
770300	773860	I suppose sir is a strictly biological term.
773860	779420	Queen Guinevere said in days of old, I knight thee Lancelot, thou that art care-y-o-typically
779420	780420	male.
780420	784220	And you're exactly right, when people start yelling at each other or tweeting out F-you,
784220	786020	that's not a great way to change my mind.
786020	787740	It turns out that's not particularly convincing.
787740	791140	So what is a great way to change your mind, Ben Shapiro?
791140	796980	Did Blair budge you an inch with her rationality, her even temper, her civility, her aesthetic?
796980	798900	It doesn't seem like she did.
798900	802180	At the end of this debate, you regurgitate your original position undigested.
802180	806300	You know, I'm the editor of a pretty major site, and my basic rule is that when we're
806300	809420	discussing people who are trans, we immediately say in the first paragraph trans woman and
809420	814260	then refer to them by their biological pronoun, because biology is the nature of the pronouns.
814260	816460	Biology is the nature of the pronouns?
816460	820500	Didn't Blair just demonstrate to you that in most contexts that's not true for her?
820500	823020	Remember the analogy of adoptive parents.
823020	827140	There are some contexts where it makes sense to distinguish between adoptive parents and
827140	828660	biological parents.
828660	833140	Likewise, there are some scientific and medical contexts where it makes sense to distinguish
833140	838060	between transgender and cisgender, or as you say, biological women.
838060	842020	For instance, when discussing who needs access to certain reproductive healthcare you think
842020	843180	should be illegal.
843180	845220	But does this apply to pronouns?
845220	850820	That is, are pronouns technical biological terms denoting karyotypes, or are they part
850820	853900	of the everyday language we use to describe each other socially?
853900	855820	The answer is obvious.
855820	858220	There are no geneticists studying pronouns.
858220	862700	In fact, there is not a single biology textbook with a chapter on the difference between a
862700	864700	he and a she.
864700	867220	There is no such thing as biological pronouns.
867220	872420	This is a phrase invented in the last decade to describe the misgendering of trans people.
872420	877260	So as a trans woman, I'm reintegrating myself into society as a woman.
877260	881980	She pronouns are therefore most appropriate for me, regardless of my anatomy, which is
881980	886100	none of your business Ben Shapiro, fascinating though it is.
886100	890580	And just as it's incorrect to tell an adoptive mother that her son is not her child, to call
890580	896020	me he is not just rude or insensitive, it is, in effect, false.
896020	900940	But it is also rude and insensitive, so even if you don't agree with me, you could still
900940	901940	not.
901940	902940	What's the harm, right?
902940	907060	If I teach my almost four year old girl that she can become a boy, then I think that is
907060	910140	not only lying to her, I think it's confusing her and I think it's damaging to her psyche.
910140	912260	Oh yes, the classic argument.
912260	914500	How do I explain to my child?
914500	918100	Kill your shitty child for all I care, that's simply not my problem.
918100	920380	I regret every night I spent with you Ben Shapiro.
920380	923140	I'm in a new relationship now, with a lesbian.
923140	924620	You and I are through.
924620	927020	I'm getting an abortion and you can't stop me.
933340	936620	It's disgusting what they allow on TV these days.
936620	941420	I won't allow my children to watch movies unless there's at least a bloodbath.
941420	943060	Or maybe an orgy.
943060	946540	But hey, I don't choose this schlock, I just present it.
946540	951580	The second program of tonight's science fiction double feature is about a cult of chaos hell
951580	954420	bent on destroying western civilization.
954420	957340	I sure hope there's more sex and violence this time.
958340	964620	Hi boys, it's points again.
964620	966620	Same queen, new look, try to keep up.
966620	970860	In my previous video, Nasty T-Babe Likes It Rough, I made an argument about why it's
970860	975100	correct to call trans women she, but I'd be bullshitting you if I only discussed fully
975100	977300	integrated binary trans people.
977300	979940	Everyone basically calls them by their pronouns already.
979940	984540	Dingbats like Ben Shapiro have to exert conscious effort to continue the charade of misgendering
984540	985540	them.
986540	991460	I've never watched that show either, but she's on the cover of Time Magazine.
991460	992460	Or he's on the cover of Time Magazine.
992460	1000220	I limited my argument to trans women who look the way society expects a woman to look, because
1000220	1004420	cis people have an easier time making sense of that, but the reality is that in a lot
1004420	1006780	of cases, it's a little more complicated.
1006780	1011940	Now, as far as early transition trans people go, I am fairly integrated.
1011940	1014100	Everybody basically gets that I'm a woman.
1014100	1019220	Without me having to explain my gender, strangers usually default to she, her, miss, ma'am.
1019220	1022100	Hey, haven't I seen your videos on tgirllove.com?
1022100	1024540	But the truth is, I don't pass perfectly.
1024540	1027780	I got called sir last week by the cashier at H&M.
1027780	1033340	Not that I usually deign to shop at H&M, but needless to say it was a desperate emergency,
1033340	1037420	and by emergency I mean I met a cute busboy at P.F. Chang's, and what happened next
1037420	1042140	stays between me and the Lord, but suffice to say that my blouse was irrevocably drenched
1042140	1043140	in-
1043140	1046260	Okay, I embellished the story a little.
1046260	1047420	He wasn't cute.
1047420	1052620	So between being 6'1", the horrific transsexual squawking I try to pass off as my voice, and
1052620	1056900	my tragic inability to conduct myself in a manner befitting a lady of good breeding,
1056900	1061660	your girl remains, despite my desperate, painstaking efforts, somewhat clockable.
1061660	1063420	You look great, hun.
1064220	1068180	In that debate between Ben and Blair, Blair says that pronoun usage boils down to what
1068180	1069180	you look like.
1069180	1071980	But it really does kind of boil down to what you look like.
1071980	1076740	And it's true that most strangers will choose a pronoun for you largely based on your appearance.
1076740	1080500	So appearance definitely matters, but in my opinion, passing, in the sense of looking
1080500	1083740	like a cis woman, is really the most important thing.
1083740	1089060	What matters more to me is the kind of vibe you give off, the way you speak, the gestures,
1089060	1090820	the conversational dynamic.
1090820	1095140	That kind of stuff, to me, is what makes a person viscerally seem like a man or a woman.
1095140	1100980	So my goal isn't necessarily to serve unclockable fish, so much as to embody a certain kind
1100980	1103940	of diaphanous archetypal femininity.
1103940	1106100	In layman's terms, girl dick energy.
1106100	1109300	Also I am gonna have a lot of plastic surgery, thank god.
1109300	1113300	Last month I released a video called Sexy Furry Pounded by Skinny T-Babe, and a lot
1113300	1117300	of trans people got mad at me because they thought I was saying that performing your
1117300	1120900	gender is the only thing that matters, and that how you identify counts for nothing.
1120900	1122580	But that's not what I think.
1122580	1127500	I do prefer to argue that trans women are women because we live the lives of women,
1127500	1131580	because I think that's a much more compelling argument than I'm a woman because I psychologically
1131580	1135700	identify as a woman, which in my experience doesn't really persuade anyone.
1135700	1137380	It's just too easy to poke holes in it.
1137380	1141620	But identity definitely does matter, especially when it comes to pronouns, and I'll explain why.
1141620	1147260	Now first, I should acknowledge that a lot of cis people are very sensitive about anyone
1147260	1151940	telling them what pronouns to use, so I'm gonna try to be respectful of your feelings
1151940	1155680	and what a difficult and personal issue this must be for you.
1155680	1159980	After all, we live in a repressive political era, despite the best efforts of hero professor
1159980	1160980	Jordan B. Peterson.
1160980	1166660	But alas, he was too late, now we have Bill C-16, which compels speech and sends people
1166660	1170620	to jail for- oh it's been more than a year since Bill C-16 passed?
1170620	1174540	Let's check in on how many people have gone to jail for pronoun misuse.
1175540	1186540	🎵sad music🎵
1186540	1191340	Oh, guess that, uh, guess that was a false alarm, huh?
1191340	1193020	God, goddammit.
1193020	1197060	Look, I'm not gonna tell you what pronouns you have to use, I'm just gonna tell you how
1197060	1201700	I use pronouns and my reasoning behind it, and you are welcome to use your free speech
1201700	1206100	to choose how much of an obstinate hobgoblin you wanna be, okay?
1206100	1207900	So, back to identity.
1207900	1213980	If I were a cashier at the Emporium of Ethereal Trinkets, and a customer were to walk in looking
1213980	1220020	like this, I might ordinarily default to female pronouns, but that would be wrong, since I
1220020	1226260	happen to know this person is not only a man, he is THE man, YouTube's most regal makeup
1226260	1231260	artist, his lordship John McClane, and he uses he-him pronouns.
1231260	1235860	Likewise, if I were approached by this person, I'd fall in love and then default to female
1235860	1241380	pronouns, and this time I'd be correct, but not because she's a cis woman or a trans woman,
1241380	1245700	but because she's gender-fluid drag queen Courtney Act, who has the fucking audacity
