start	end	text
1245700	1250020	to be a more beautiful woman than I am, and who so far as I know uses male pronouns in
1250020	1253820	boy mode and female pronouns in girl mode, as do most queens.
1253820	1258260	A lot of the complexities of gender, language, identity, and expression get played out in
1258260	1259540	the world of drag.
1259540	1264780	Some queens, like RuPaul, just identify as cis men, who live as men and perform as women.
1264780	1270060	Others, like Courtney, Sasha Velour, Jinx Monsoon, Shea Coulee, and Violet Tchotchke,
1270060	1271540	identify as non-binary.
1271540	1276100	Others still are bio-queens, cis women who perform as drag queens, like Lucy Garland
1276100	1277100	or Creme Fatale.
1277100	1281780	And then there are trans women who are also drag queens, like Peppermint, Imp Queen, or
1281780	1282780	for that matter, me.
1282780	1287740	I mean look at me, do you think I dress like this when I go to 7-Eleven at 2am?
1287740	1288740	Because I do.
1288740	1289740	Look what I've become.
1289740	1292180	A bisexual, transsexual drag queen.
1292180	1296620	Look, I didn't intend to become this much of a snowflake, I just through pure coincidence
1296620	1300620	happened to be the most interesting and unique person who ever lived, I'm so sorry, I can't
1300620	1301620	help it.
1301620	1302620	So let's recap.
1302620	1306540	There are gender non-conforming men who present very femme but use male pronouns.
1306540	1310180	There are cis men who use female pronouns whenever they present female.
1310180	1314420	There are genderfluid people who use different pronouns depending on their current presentation.
1314420	1318180	There are pre-transition trans people who identify as a gender other than the one they
1318180	1321060	present and live as and prefer other pronouns.
1321060	1324460	So you really can't just rely on the way a person looks, because there's a lot of
1324460	1327900	situations where the way they look doesn't tell you the whole story.
1327900	1333500	So as you can see, identity definitely is important, but it's also not the only thing
1333500	1334500	that matters.
1334500	1338500	If psychological identity were the only thing that mattered, then there would be no need
1338500	1343180	for a trans person to come out or do anything to transition, including requesting different
1343180	1348260	pronouns, because pronouns belong to the social world of language, not to individual
1348260	1349260	psychology.
1349260	1352860	This is an idea I tried to explore in my sexy furry video.
1352860	1358260	You can identify however you like, but gender is also social, structural, and interpersonal.
1358260	1363420	So if, for example, you're a trans woman still living as a man, then you are fully
1363420	1368300	trans, your identity is fully valid, but until you begin living as a woman, your womanhood
1368300	1370300	remains kind of hypothetical.
1370420	1373660	And when I say living as a woman, I don't mean passing.
1373660	1378740	There's too much emphasis on physical appearance, and not enough on social relationships.
1378740	1381500	You know, you don't become a woman the first time you put on a dress.
1381500	1385340	You become a woman the first time an older female relative turns to you at a restaurant
1385340	1386340	and says,
1386340	1387880	Maybe you should order the salad, sweetie.
1387880	1390340	My point is not to invalidate anyone's identity.
1390340	1394180	As far as I'm concerned, if a trans person hasn't transitioned yet, they are fully
1394180	1395180	trans.
1395180	1399180	I'm just trying to be realistic about the fact that a lot of people's gendered experience
1399500	1401660	isn't entirely a product of how they identify.
1401660	1406060	Put it this way, I will always use female pronouns for a trans woman, but my thought
1406060	1408820	process behind it isn't always the same.
1408820	1413780	Many trans women just seem like women to me, in literally the same way that cis women seem
1413780	1417780	like women, and I use female pronouns for them effortlessly just as I was trained to
1417780	1418780	do from birth.
1418780	1421980	This, I think, is the goal for most binary trans people.
1421980	1426700	We want not necessarily to pass perfectly, but at least to seem like our genders to the
1426700	1427980	people around us.
1427980	1432180	As Laura Jane Grace put it, you want them to see you like they see every other girl.
1432180	1436380	I want people calling me she not out of politeness or respect for my identity
1436380	1437780	AS A TRANS WOMAN
1437780	1440420	but just because I seem like a woman to them.
1440420	1446700	Because the reality is, not all trans women seem like a woman to me in that visceral way,
1446700	1451380	and I live with this constant crushing anxiety that I don't seem like a woman to other people.
1451380	1455580	I'm terrified of looking like a third-rate drag queen, and I cope with that fear by looking
1455580	1457460	like a second-rate drag queen.
1457460	1462460	But look, even if a person is giving my eyes and ears a 0% woman, if she tells me she's
1462460	1466660	a trans woman, I'm gonna use female pronouns no matter what she looks like.
1466660	1471700	Not just to be polite, but also because I want to recognize the reality of her psychological
1471700	1476700	experience, and especially because I want to help her re-socialize and reintegrate into
1476700	1478540	the world as her true gender.
1478540	1483820	And of course, cis people, you legally have the freedom to refuse to do that, but if you
1483820	1486740	refuse, you are being a shit gibbon.
1486740	1489340	And I would prefer that you not be a shit gibbon.
1489340	1492540	Now, we need to address the genderqueer elephant in the room.
1492540	1497380	An increasing number of people identify not as male or female, but as non-binary, an umbrella
1497380	1502500	term encompassing a bunch of more specific labels such as genderqueer, genderfluid, agender,
1502500	1504220	greygender, and so on.
1504220	1506580	Many of these people use a non-binary pronoun.
1506580	1508420	In English, usually they.
1508420	1512420	Now if your first impulse is to argue that singular they is ungrammatical nonsense, consider
1512420	1517140	that having gendered singular third-person pronouns at all is a particular feature of
1517140	1521700	the English language that's by no means shared by all other languages, including Turkish,
1521700	1524420	Korean, and Finnish, which don't have them at all.
1524420	1527220	Language is just a bunch of fucking sounds coming out of your mouth that humans make
1527220	1528740	up to suit our purposes.
1528740	1532420	If you're new to using singular they, it is a little confusing at first, but with some
1532420	1534260	practice it gets pretty easy.
1534260	1538940	They poured milk on me, I poured milk on them, they did anoint themselves in their milk and
1538940	1540900	it was good, thus saith the Lord.
1540900	1542820	So the polite thing to do here is easy.
1542820	1546260	If someone asks you to call them they, you call them they.
1546260	1550500	But if you're like me, you don't want to just do a thing because you dogmatically believe
1550500	1552020	it's the woke thing to do.
1552020	1554340	You want to understand why you're doing it.
1554340	1558660	I don't just want to tolerate non-binary people, I want to be a convert.
1558660	1562780	I want to believe about them what they believe about themselves, so long as those beliefs
1562780	1563780	are reasonable.
1563780	1565620	So what do all these words mean?
1565620	1567380	What are these people talking about?
1567380	1570700	Remember earlier we distinguished gender expression from gender identity.
1570700	1575700	John McClane is feminine in expression but a man in identity, whereas I am a woman in
1575700	1578740	identity and in expression I am a mess.
1578740	1584060	Let us meditate upon one of lesbian culture's great contributions to humanity, art, science,
1584060	1587580	spirituality, sexuality, metaphysics, the Futch scale.
1587580	1592220	The Futch scale is a diagram that looks like this and quantifies from 1 to 10, or high
1592220	1597140	femme to stone butch, the gender expression of a given domain, such as Mulan looks or
1597140	1598460	Steven Universe characters.
1598860	1604140	It can also be used more abstractly for weapons, fish Pokemon, or wind instruments.
1604140	1608580	Maybe what non-binary people are trying to do with words like genderqueer, agender, greygender,
1608580	1613780	and so on is to give to identity the same kind of specificity the Futch scale gives
1613780	1614780	to expression.
1614780	1618460	But my input on this isn't really worth that much, because I'm not non-binary.
1618460	1622900	And to tell you the truth, I kind of feel for cis people here because all this talk
1622900	1627460	about gender identity, a lot of the time I don't really get it either.
1627460	1631460	I look inside myself and ask, do I feel like a man or a woman?
1631460	1635820	And after all these years, the answer is still that I feel like shit.
1635820	1637620	And that's how I experience gender.
1637620	1642540	I live, I exist, as a woman, which is the only way I can achieve the same level of sadness
1642540	1644580	and dysfunction as everyone else.
1644580	1646780	And I identify as trash.
1646780	1651100	I guess there are certain moments that make me feel like a natural woman, oh, listening
1651100	1656260	to Aretha Franklin, the pain and ecstasy of penetration, waiting in a long-ass line for
1656260	1661140	the restroom, a big strong arm around my waist, being asked if I have any tampons,
1661140	1666460	having tampons in case someone asks, a dude explaining philosophy 101 to me, and me going
1666460	1669100	oh really, wow.
1669100	1672920	But you know these experiences mean different things to different people, so all I can really
1672920	1678700	tell you is that I prefer to express myself with diaphanous feminine gestures, that taking
1678700	1682740	female hormones and having feminizing medical procedures makes me feel more at home in my
1682740	1687700	body, and that I like it when other people treat me as a woman, socially, spiritually,
1687700	1688700	sexually.
1688700	1691500	So that's the jargon-free explanation of my gender as I see it.
1691500	1696420	Am I really truly a woman ontologically, neurologically, metaphysically?
1696420	1699420	Well honestly, I don't even know what that would mean.
1699420	1705220	But I do know that the life I live as a woman is the only life I have, and that, I think,
1705220	1706580	is legitimate enough.
1706580	1710940	So I know what living as a woman means to me, but what does it mean to live a non-binary
1710940	1711940	life?
1712140	1715140	Well, just like what it means to be a man or a woman, that's something that's going
1715140	1717780	to vary between individuals and cultures.
1717780	1722300	Some cultures have ancient third gender traditions, such as the Hidra of South Asia, a legally
1722300	1727380	recognized gender in India, Pakistan, Nepal, and Bangladesh, or the various two-spirit
1727380	1730620	traditions of indigenous North American tribes.
1730620	1734740	Non-indigenous American culture doesn't have a third gender tradition, but we do have individual
1734740	1739340	non-binary people, some of whom are making content that has taught me a lot about non-binary
1739340	1742780	experience, non-binary bodies, and non-binary life.
1742780	1746260	We have a lot in common, binary and non-binary trans people.
1746260	1751260	Even as a binary trans person, I used to live as one gender and now I live as another gender.
1751260	1755460	That in itself is a pretty serious challenge to the stability of the binary.
1755460	1759180	But many of the people who call themselves non-binary seem to be fighting for something
1759180	1762780	more radical than what I'm fighting for, at least in my personal life.
1762780	1768060	I'm just trying to assimilate into a pre-existing female gender role.
1768100	1770420	As you can see by the normal way I'm dressed.
1770420	1772740	The traditional female carp of my culture.
1772740	1775420	Nier nier nier nier nier nier nier.
1775420	1776780	No!
1776780	1781260	Whereas non-binary people are trying to cast off these roles entirely, they're effectively
1781260	1784480	trying to create the society that includes them.
1784480	1789140	And sometimes that puts me at cross-purposes with some non-binary people who, for example,
1789140	1792220	promote the practice of always asking for someone's pronouns.
1792220	1797060	Whereas I love it when people assume my gender, provided they assume it correctly.
1797140	1800700	Otherwise I will throw you in imaginary Canadian pronoun jail.
1800700	1805620	But what we all agree on is that many trans, non-binary, and gender non-conforming people
1805620	1810140	find it easier to navigate the world using pronouns other than the ones that Ben Shapiro
1810140	1811260	wants you to use.
1811260	1814140	So if you want me to call you they, I'm gonna call you they.
1814140	1820020	And though I cannot and will not force you, viewer, to do or say anything, I do hope you
1820020	1825380	use your free will to freely choose to use your freedom of speech to choose to do the same.
1825380	1826380	Freely.
1827060	1828060	Freely.
1828060	1829060	Freely.
1829060	1830060	Freely.
1830060	1831060	Freely.
1831060	1832060	Freely.
1832060	1833060	Freely.
1833060	1834060	Freely.
1834060	1836580	Well, at least there was a hideous monster this time.
1836580	1840540	I'm talking about the female lead.
1840540	1842280	Now the fun really begins.
1842280	1843280	The show's over.
1843280	1846300	I'm gonna go take my tits out at a funeral parlor.
1846300	1848860	So goodbye, my satanic subscribers.
1848860	1854200	Until next week, go to hell!
1854400	1865400	You can't make me you.
1865400	1873400	You can't make that true.
1873400	1882400	This is who I am.
1882400	1893600	We'll go hand in hand in hand in hand.
1912400	1915600	We'll go hand in hand in hand.
