start	end	text
1226000	1230000	he resists being pinned down to any more specific position.
1230000	1232000	I was maybe too harsh on Cathy Newman earlier.
1232000	1234000	She came out of that interview looking bad,
1234000	1236000	but she had a tough job to do.
1236000	1238000	Peterson's rhetorical strategy involves
1238000	1241000	saying something that's more or less uncontroversially true,
1241000	1244000	while at the same time implying something controversial.
1244000	1247000	For instance, Jordan Peterson will make a claim like
1247000	1250000	there are biological differences between men and women,
1250000	1251000	which is obviously true.
1251000	1254000	But he'll say it in the context of a conversation
1254000	1256000	about the underrepresentation of women in government,
1256000	1259000	which implies... what, exactly?
1259000	1261000	So how do you respond to this?
1261000	1263000	Well, either you fall into the trap of arguing
1263000	1265000	against the obviously true statement,
1265000	1267000	where you have to guess at what he's implying,
1267000	1271000	in response to which he can accuse you of misrepresenting him,
1271000	1274000	which is exactly what happened with the Cathy Newman interview.
1274000	1276000	The most famous moment where Peterson does this
1276000	1278000	is the notorious lobster argument.
1278000	1280000	So he starts by saying...
1280000	1283000	There's this idea that hierarchical structures
1283000	1287000	are a sociological construct of the Western patriarchy.
1287000	1290000	And then he goes on to say that lobsters exist in hierarchies
1290000	1294000	and lobsters predate Western patriarchy by millions of years,
1294000	1297000	so checkmate postmodern neo-Marxists.
1297000	1300000	You're saying that we should organize our societies
1300000	1302000	along the lines of the lobsters.
1302000	1305000	I'm saying that it's inevitable that there will be continuity
1305000	1308000	in the way that animals and human beings organize their structures.
1308000	1312000	The problem with that is that no one has ever said
1312000	1316000	that every hierarchy is the product of Western patriarchy.
1316000	1318000	This is such a massive strawman
1318000	1321000	that it overshadows any uncharitable interpretation of Peterson
1321000	1323000	suggested by Cathy Newman in this interview.
1323000	1327000	No one on the left denies that there are some natural hierarchies.
1327000	1331000	Even the anarchists, whose whole thing is abolishing hierarchies,
1331000	1334000	limit themselves to the abolition of unjust hierarchies.
1334000	1337000	No one wants to abolish lobster hierarchies.
1337000	1341000	The hierarchies we're interested in are those of gender, race, and economics
1341000	1345000	within our own society, to which the lobster case is a complete non sequitur.
1345000	1349000	I mean, you could use Peterson's lobster argument the same way he uses it
1349000	1354000	to justify literally any hierarchy or authority, no matter how unjust.
1354000	1358000	You could be an 18th century Republican arguing against the monarchy,
1358000	1360000	and the monarch could turn around and say,
1360000	1364000	well, hierarchies are inevitable. God save the lobster queen.
1366000	1368000	Oh, dear God.
1368000	1372000	My lords, ladies, and those at length betwixt,
1372000	1376000	present rumors of Republican rumblings amongst the rabble
1376000	1379000	have compelled us to summon you together.
1379000	1383000	Let us remind you that nature hath so made the lobster
1383000	1387000	that some individuals be stronger than the others.
1387000	1393000	Therefore, let not the power of our crustacean sovereignty
1393000	1395000	be anywise impugned.
1395000	1398000	And as for parliamentarians,
1398000	1402000	well, let them vote for cake.
1404000	1406000	Very good. Thank you.
1409000	1411000	I need new roommates.
1411000	1414000	So I've argued that Peterson is invoking the incoherent concept
1414000	1417000	of postmodern neo-Marxism as the supervillain
1417000	1420000	in a childishly simple worldview he's promoting
1420000	1423000	where these evil leftists are out to destroy the West.
1423000	1426000	Now, it's time to inspect the other side of this coin.
1426000	1428000	What, exactly, is the West?
1428000	1431000	Well, there's an academic usage of the term the West
1431000	1433000	that describes the intellectual tradition
1433000	1437000	that runs from ancient Athens to modern-day Europe and its colonies.
1437000	1441000	Now, a true postmodernist would want to deconstruct the whole concept of the West
1441000	1445000	and show how the very idea is racist and exclusionary and supremacist
1445000	1448000	and justifies imperialism and all that kind of thing.
1448000	1450000	But we don't have time for that right now,
1450000	1452000	so I'm just gonna grant that the West is a thing
1452000	1455000	and look at how Jordan Peterson thinks about it.
1455000	1459000	For Peterson, the West seems to be equivalent to capitalism, individualism,
1459000	1462000	the idea that each human has a spark of divinity
1462000	1465000	and he therefore equates it with Judeo-Christian values,
1465000	1469000	a term more popular with conservative pundits than intellectual historians.
1470000	1474000	Peterson contrasts Judeo-Christian values with postmodern neo-Marxism,
1474000	1479000	which he describes as anti-Western, collectivist, relativist, and totalitarian.
1479000	1483000	This framing of a conflict of ideas in terms of geographical chauvinism
1483000	1486000	and external threat is inaccurate and scaremongering.
1486000	1491000	Marxism is Western philosophy. Postmodernism is Western philosophy.
1491000	1494000	If you're really concerned about preserving the geographical boundaries
1494000	1498000	of the intellectual tradition, you should be ranting against the influence of Buddhism.
1498000	1504000	Likewise, there is no feature of SJW ideology that is meaningfully non-Western.
1504000	1509000	The very idea of people requesting different pronouns to suit their individual needs
1509000	1513000	is exactly the kind of thing a person who values individual liberty
1513000	1515000	over collective dogma should be on board with.
1515000	1519000	You could even argue that Marxism is an extension of Enlightenment philosophy,
1519000	1523000	with its concern for human progress, science, and liberty.
1523000	1527000	I think a lot of people like listening to Jordan Peterson talk about the Western tradition,
1527000	1530000	but they don't seem to like reading any of it themselves.
1530000	1534000	If you did read it, you'd find a surprising diversity of thought
1534000	1537000	that doesn't reduce to Judeo-Christian values.
1537000	1542000	Much of Plato's political dialogues are concerned with arguing against cultural relativism,
1542000	1546000	suggesting that, far from being an invention of postmodernity,
1546000	1550000	it was actually a pretty popular worldview among ancient Athenian pederasts.
1550000	1555000	Our favorite Enlightenment philosopher David Hume famously said that reason is
1555000	1560000	and ought only to be the slave of the passions, literally feels over reels.
1560000	1566000	And meanwhile, his contemporary the Marquis de Sade was advocating the abolition of morality,
1566000	1568000	filling the churches with scat porn,
1568000	1573000	and ushering in a reign of untethered sexual perversion so decadent and depraved
1573000	1576000	I'm not even allowed to talk about it on YouTube.
1576000	1579000	This is the Enlightenment, not postmodernism,
1579000	1584000	and it's just as much a part of the West as Peterson's soggy, Bible-padding conservatism.
1584000	1590000	But again, and I really can't stress this enough, I don't care either way.
1590000	1594000	I make YouTube videos because I enjoy mood lighting and set design.
1594000	1596000	So, what do you people want from me?
1596000	1599000	The Lobster Queen is dead. Long live the Queen.
1615000	1620000	Can't save the Lobster Queen.
1620000	1624000	Long live the Lobster Queen.
1624000	1628000	Can't save the Queen.
1632000	1638000	Stabbing through the skin with those crustaceans.
1638000	1642000	Can't save the Lobster Queen.
1642000	1649000	Stabbing through the skin with those crustaceans.
1669000	1670000	Where are those people?
1670000	1675000	There's a YouTuber that I'm actually quite interested in,
1675000	1679000	that I watch her, and I don't mean to misgender her because I think she identifies with her,
1679000	1682000	ContraPoints, I don't know if you've heard of this YouTuber.
1682000	1685000	I've seen the name come up every now and again on Twitter.
1685000	1687000	Totally disagree with everything this person says,
1687000	1691000	but I look at it and I'm like, this seems very reasonable, educated, academic,
1691000	1696000	and I'm seeing reasons to hope that everyone's going to like her.
1696000	1698000	Hello, Dave.
